Sheet: Beta coef
A1: beta coef
A2: 200
A4: Room | B4: Center | C4: Sensor | D4: Center K base
A5: 18.5 | B5: 15771 | C5: 6698 | D5: of:=[.B5]*330/16384 -> 317.653198242188
A6: 19 | B6: 15797 | C6: 6697 | D6: of:=[.B6]*330/16384 -> 318.176879882812
A7: 20 | B7: 15833 | C7: 6689 | D7: of:=[.B7]*330/16384 -> 318.901977539062
A8: 22 | B8: 15746 | C8: 6672 | D8: of:=[.B8]*330/16384 -> 317.149658203125
A9: 23 | B9: 15862 | C9: 6645 | D9: of:=[.B9]*330/16384 -> 319.486083984375
A10: 24 | B10: 15652 | C10: 6616 | D10: of:=[.B10]*330/16384 -> 315.25634765625
A11: 25 | B11: 15515 | C11: 6592 | D11: of:=[.B11]*330/16384 -> 312.496948242187
A12: 27 | B12: 15535 | C12: 6552 | D12: of:=[.B12]*330/16384 -> 312.899780273437
A13: 29 | B13: 15680 | C13: 6547 | D13: of:=[.B13]*330/16384 -> 315.8203125
A14: 31.5 | B14: 15789 | C14: 6535 | D14: of:=[.B14]*330/16384 -> 318.015747070312
A15: red bg was taken with heater, looks not correct
B18: Beta 18,5 | C18: Beta 19 | D18: Beta 20 | E18: Beta 22 | F18: Beta 23 | G18: Beta 24 | H18: Beta 25 | I18: Beta 27 | J18: Beta 29 | K18: Beta 31,5
A19: of:=[.A5]+273 -> 291.5 | B19: of:=1 / ( (LN([.$C5])-LN([.$C$5])) / [.$A$2] + 1 / ([.$A$5]+273))-[.$A19] -> 0 | C19: of:=1 / ( (LN([.$C5])-LN([.$C$6])) / [.$A$2] + 1 / ([.$A$6]+273))-[.$A19] -> 0.436360270730063 | D19: of:=1 / ( (LN([.$C5])-LN([.$C$7])) / [.$A$2] + 1 / ([.$A$7]+273))-[.$A19] -> 0.923976885616867 | E19: of:=1 / ( (LN([.$C5])-LN([.$C$8])) / [.$A$2] + 1 / ([.$A$8]+273))-[.$A19] -> 1.81731738200597 | F19: of:=1 / ( (LN([.$C5])-LN([.$C$8])) / [.$A$2] + 1 / ([.$A$8]+273))-[.$A19] -> 1.81731738200597 | G19: of:=1 / ( (LN([.$C5])-LN([.$C$10])) / [.$A$2] + 1 / ([.$A$10]+273))-[.$A19] -> 0.164793306186141 | H19: of:=1 / ( (LN([.$C5])-LN([.$C$11])) / [.$A$2] + 1 / ([.$A$11]+273))-[.$A19] -> -0.4186403096258 | I19: of:=1 / ( (LN([.$C5])-LN([.$C$12])) / [.$A$2] + 1 / ([.$A$12]+273))-[.$A19] -> -1.10002543800584 | J19: of:=1 / ( (LN([.$C5])-LN([.$C$13])) / [.$A$2] + 1 / ([.$A$13]+273))-[.$A19] -> 0.447915676838932 | K19: of:=1 / ( (LN([.$C5])-LN([.$C$14])) / [.$A$2] + 1 / ([.$A$14]+273))-[.$A19] -> 1.99135497407622 | M19: of:=DEVSQ([.B19:.K19]) -> 9.53093400654029
A20: of:=[.A6]+273 -> 292 | B20: of:=1 / ( (LN([.$C6])-LN([.$C$5])) / [.$A$2] + 1 / ([.$A$5]+273))-[.$A20] -> -0.436550395134475 | C20: of:=1 / ( (LN([.$C6])-LN([.$C$6])) / [.$A$2] + 1 / ([.$A$6]+273))-[.$A20] -> 0 | D20: of:=1 / ( (LN([.$C6])-LN([.$C$7])) / [.$A$2] + 1 / ([.$A$7]+273))-[.$A20] -> 0.487829408517086 | E20: of:=1 / ( (LN([.$C6])-LN([.$C$8])) / [.$A$2] + 1 / ([.$A$8]+273))-[.$A20] -> 1.3815606761504 | F20: of:=1 / ( (LN([.$C6])-LN([.$C$8])) / [.$A$2] + 1 / ([.$A$8]+273))-[.$A20] -> 1.3815606761504 | G20: of:=1 / ( (LN([.$C6])-LN([.$C$10])) / [.$A$2] + 1 / ([.$A$10]+273))-[.$A20] -> -0.271685321092548 | H20: of:=1 / ( (LN([.$C6])-LN([.$C$11])) / [.$A$2] + 1 / ([.$A$11]+273))-[.$A20] -> -0.855372841094948 | I20: of:=1 / ( (LN([.$C6])-LN([.$C$12])) / [.$A$2] + 1 / ([.$A$12]+273))-[.$A20] -> -1.53705385732093 | J20: of:=1 / ( (LN([.$C6])-LN([.$C$13])) / [.$A$2] + 1 / ([.$A$13]+273))-[.$A20] -> 0.0115604447250348 | K20: of:=1 / ( (LN([.$C6])-LN([.$C$14])) / [.$A$2] + 1 / ([.$A$14]+273))-[.$A20] -> 1.5556745357332 | M20: of:=DEVSQ([.B20:.K20]) -> 9.53925202161967
A21: of:=[.A7]+273 -> 293 | B21: of:=1 / ( (LN([.$C7])-LN([.$C$5])) / [.$A$2] + 1 / ([.$A$5]+273))-[.$A21] -> -0.927614836842338 | C21: of:=1 / ( (LN([.$C7])-LN([.$C$6])) / [.$A$2] + 1 / ([.$A$6]+273))-[.$A21] -> -0.489537934604812 | D21: of:=1 / ( (LN([.$C7])-LN([.$C$7])) / [.$A$2] + 1 / ([.$A$7]+273))-[.$A21] -> 0 | E21: of:=1 / ( (LN([.$C7])-LN([.$C$8])) / [.$A$2] + 1 / ([.$A$8]+273))-[.$A21] -> 0.896868802927145 | F21: of:=1 / ( (LN([.$C7])-LN([.$C$8])) / [.$A$2] + 1 / ([.$A$8]+273))-[.$A21] -> 0.896868802927145 | G21: of:=1 / ( (LN([.$C7])-LN([.$C$10])) / [.$A$2] + 1 / ([.$A$10]+273))-[.$A21] -> -0.762173540134654 | H21: of:=1 / ( (LN([.$C7])-LN([.$C$11])) / [.$A$2] + 1 / ([.$A$11]+273))-[.$A21] -> -1.34789964744868 | I21: of:=1 / ( (LN([.$C7])-LN([.$C$12])) / [.$A$2] + 1 / ([.$A$12]+273))-[.$A21] -> -2.03195632101341 | J21: of:=1 / ( (LN([.$C7])-LN([.$C$13])) / [.$A$2] + 1 / ([.$A$13]+273))-[.$A21] -> -0.477937034785271 | K21: of:=1 / ( (LN([.$C7])-LN([.$C$14])) / [.$A$2] + 1 / ([.$A$14]+273))-[.$A21] -> 1.07159502410605 | M21: of:=DEVSQ([.B21:.K21]) -> 9.6061690571322
A22: of:=[.A8]+273 -> 295 | B22: of:=1 / ( (LN([.$C8])-LN([.$C$5])) / [.$A$2] + 1 / ([.$A$5]+273))-[.$A22] -> -1.8381627785285 | C22: of:=1 / ( (LN([.$C8])-LN([.$C$6])) / [.$A$2] + 1 / ([.$A$6]+273))-[.$A22] -> -1.39680919200833 | D22: of:=1 / ( (LN([.$C8])-LN([.$C$7])) / [.$A$2] + 1 / ([.$A$7]+273))-[.$A22] -> -0.903603817159592 | E22: of:=1 / ( (LN([.$C8])-LN([.$C$8])) / [.$A$2] + 1 / ([.$A$8]+273))-[.$A22] -> 0 | F22: of:=1 / ( (LN([.$C8])-LN([.$C$8])) / [.$A$2] + 1 / ([.$A$8]+273))-[.$A22] -> 0 | G22: of:=1 / ( (LN([.$C8])-LN([.$C$10])) / [.$A$2] + 1 / ([.$A$10]+273))-[.$A22] -> -1.67148461072486 | H22: of:=1 / ( (LN([.$C8])-LN([.$C$11])) / [.$A$2] + 1 / ([.$A$11]+273))-[.$A22] -> -2.26158655221099 | I22: of:=1 / ( (LN([.$C8])-LN([.$C$12])) / [.$A$2] + 1 / ([.$A$12]+273))-[.$A22] -> -2.95074249082057 | J22: of:=1 / ( (LN([.$C8])-LN([.$C$13])) / [.$A$2] + 1 / ([.$A$13]+273))-[.$A22] -> -1.38512145380469 | K22: of:=1 / ( (LN([.$C8])-LN([.$C$14])) / [.$A$2] + 1 / ([.$A$14]+273))-[.$A22] -> 0.176040732660624 | M22: of:=DEVSQ([.B22:.K22]) -> 9.75059950929344
A23: of:=[.A9]+273 -> 296 | B23: of:=1 / ( (LN([.$C9])-LN([.$C$5])) / [.$A$2] + 1 / ([.$A$5]+273))-[.$A23] -> -1.08524357927257 | C23: of:=1 / ( (LN([.$C9])-LN([.$C$6])) / [.$A$2] + 1 / ([.$A$6]+273))-[.$A23] -> -0.638592171400035 | D23: of:=1 / ( (LN([.$C9])-LN([.$C$7])) / [.$A$2] + 1 / ([.$A$7]+273))-[.$A23] -> -0.13945705412209 | E23: of:=1 / ( (LN([.$C9])-LN([.$C$8])) / [.$A$2] + 1 / ([.$A$8]+273))-[.$A23] -> 0.775036724854431 | F23: of:=1 / ( (LN([.$C9])-LN([.$C$8])) / [.$A$2] + 1 / ([.$A$8]+273))-[.$A23] -> 0.775036724854431 | G23: of:=1 / ( (LN([.$C9])-LN([.$C$10])) / [.$A$2] + 1 / ([.$A$10]+273))-[.$A23] -> -0.916565622395467 | H23: of:=1 / ( (LN([.$C9])-LN([.$C$11])) / [.$A$2] + 1 / ([.$A$11]+273))-[.$A23] -> -1.51374239447006 | I23: of:=1 / ( (LN([.$C9])-LN([.$C$12])) / [.$A$2] + 1 / ([.$A$12]+273))-[.$A23] -> -2.21114254202632 | J23: of:=1 / ( (LN([.$C9])-LN([.$C$13])) / [.$A$2] + 1 / ([.$A$13]+273))-[.$A23] -> -0.626764029246374 | K23: of:=1 / ( (LN([.$C9])-LN([.$C$14])) / [.$A$2] + 1 / ([.$A$14]+273))-[.$A23] -> 0.953202970943607 | M23: of:=DEVSQ([.B23:.K23]) -> 9.98640248444336
A24: of:=[.A10]+273 -> 297 | B24: of:=1 / ( (LN([.$C10])-LN([.$C$5])) / [.$A$2] + 1 / ([.$A$5]+273))-[.$A24] -> -0.170875563330071 | C24: of:=1 / ( (LN([.$C10])-LN([.$C$6])) / [.$A$2] + 1 / ([.$A$6]+273))-[.$A24] -> 0.281597772932002 | D24: of:=1 / ( (LN([.$C10])-LN([.$C$7])) / [.$A$2] + 1 / ([.$A$7]+273))-[.$A24] -> 0.78724944978751 | E24: of:=1 / ( (LN([.$C10])-LN([.$C$8])) / [.$A$2] + 1 / ([.$A$8]+273))-[.$A24] -> 1.71371141445877 | F24: of:=1 / ( (LN([.$C10])-LN([.$C$8])) / [.$A$2] + 1 / ([.$A$8]+273))-[.$A24] -> 1.71371141445877 | G24: of:=1 / ( (LN([.$C10])-LN([.$C$10])) / [.$A$2] + 1 / ([.$A$10]+273))-[.$A24] -> 0 | H24: of:=1 / ( (LN([.$C10])-LN([.$C$11])) / [.$A$2] + 1 / ([.$A$11]+273))-[.$A24] -> -0.604951333378324 | I24: of:=1 / ( (LN([.$C10])-LN([.$C$12])) / [.$A$2] + 1 / ([.$A$12]+273))-[.$A24] -> -1.3114107061723 | J24: of:=1 / ( (LN([.$C10])-LN([.$C$13])) / [.$A$2] + 1 / ([.$A$13]+273))-[.$A24] -> 0.293580211264782 | K24: of:=1 / ( (LN([.$C10])-LN([.$C$14])) / [.$A$2] + 1 / ([.$A$14]+273))-[.$A24] -> 1.8942137034627 | M24: of:=DEVSQ([.B24:.K24]) -> 10.2487888733966
A25: of:=[.A11]+273 -> 298 | B25: of:=1 / ( (LN([.$C11])-LN([.$C$5])) / [.$A$2] + 1 / ([.$A$5]+273))-[.$A25] -> 0.438792936401626 | C25: of:=1 / ( (LN([.$C11])-LN([.$C$6])) / [.$A$2] + 1 / ([.$A$6]+273))-[.$A25] -> 0.896190776393723 | D25: of:=1 / ( (LN([.$C11])-LN([.$C$7])) / [.$A$2] + 1 / ([.$A$7]+273))-[.$A25] -> 1.40735467222862 | E25: of:=1 / ( (LN([.$C11])-LN([.$C$8])) / [.$A$2] + 1 / ([.$A$8]+273))-[.$A25] -> 2.34394070526895 | F25: of:=1 / ( (LN([.$C11])-LN([.$C$8])) / [.$A$2] + 1 / ([.$A$8]+273))-[.$A25] -> 2.34394070526895 | G25: of:=1 / ( (LN([.$C11])-LN([.$C$10])) / [.$A$2] + 1 / ([.$A$10]+273))-[.$A25] -> 0.611527339108818 | H25: of:=1 / ( (LN([.$C11])-LN([.$C$11])) / [.$A$2] + 1 / ([.$A$11]+273))-[.$A25] -> 0 | I25: of:=1 / ( (LN([.$C11])-LN([.$C$12])) / [.$A$2] + 1 / ([.$A$12]+273))-[.$A25] -> -0.714121692473384 | J25: of:=1 / ( (LN([.$C11])-LN([.$C$13])) / [.$A$2] + 1 / ([.$A$13]+273))-[.$A25] -> 0.908303728645649 | K25: of:=1 / ( (LN([.$C11])-LN([.$C$14])) / [.$A$2] + 1 / ([.$A$14]+273))-[.$A25] -> 2.5264191537068 | M25: of:=DEVSQ([.B25:.K25]) -> 10.4733911177391
A26: of:=[.A12]+273 -> 300 | B26: of:=1 / ( (LN([.$C12])-LN([.$C$5])) / [.$A$2] + 1 / ([.$A$5]+273))-[.$A26] -> 1.17410375380416 | C26: of:=1 / ( (LN([.$C12])-LN([.$C$6])) / [.$A$2] + 1 / ([.$A$6]+273))-[.$A26] -> 1.63993102890555 | D26: of:=1 / ( (LN([.$C12])-LN([.$C$7])) / [.$A$2] + 1 / ([.$A$7]+273))-[.$A26] -> 2.16053070598252 | E26: of:=1 / ( (LN([.$C12])-LN([.$C$8])) / [.$A$2] + 1 / ([.$A$8]+273))-[.$A26] -> 3.11444797341409 | F26: of:=1 / ( (LN([.$C12])-LN([.$C$8])) / [.$A$2] + 1 / ([.$A$8]+273))-[.$A26] -> 3.11444797341409 | G26: of:=1 / ( (LN([.$C12])-LN([.$C$10])) / [.$A$2] + 1 / ([.$A$10]+273))-[.$A26] -> 1.35001995987915 | H26: of:=1 / ( (LN([.$C12])-LN([.$C$11])) / [.$A$2] + 1 / ([.$A$11]+273))-[.$A26] -> 0.727236553430316 | I26: of:=1 / ( (LN([.$C12])-LN([.$C$12])) / [.$A$2] + 1 / ([.$A$12]+273))-[.$A26] -> 0 | J26: of:=1 / ( (LN([.$C12])-LN([.$C$13])) / [.$A$2] + 1 / ([.$A$13]+273))-[.$A26] -> 1.65226738996779 | K26: of:=1 / ( (LN([.$C12])-LN([.$C$14])) / [.$A$2] + 1 / ([.$A$14]+273))-[.$A26] -> 3.30030951684444 | M26: of:=DEVSQ([.B26:.K26]) -> 10.8635118963276
A27: of:=[.A13]+273 -> 302 | B27: of:=1 / ( (LN([.$C13])-LN([.$C$5])) / [.$A$2] + 1 / ([.$A$5]+273))-[.$A27] -> -0.479265811457026 | C27: of:=1 / ( (LN([.$C13])-LN([.$C$6])) / [.$A$2] + 1 / ([.$A$6]+273))-[.$A27] -> -0.0123648185949037 | D27: of:=1 / ( (LN([.$C13])-LN([.$C$7])) / [.$A$2] + 1 / ([.$A$7]+273))-[.$A27] -> 0.509436791958706 | E27: of:=1 / ( (LN([.$C13])-LN([.$C$8])) / [.$A$2] + 1 / ([.$A$8]+273))-[.$A27] -> 1.46556180161446 | F27: of:=1 / ( (LN([.$C13])-LN([.$C$8])) / [.$A$2] + 1 / ([.$A$8]+273))-[.$A27] -> 1.46556180161446 | G27: of:=1 / ( (LN([.$C13])-LN([.$C$10])) / [.$A$2] + 1 / ([.$A$10]+273))-[.$A27] -> -0.302944319199923 | H27: of:=1 / ( (LN([.$C13])-LN([.$C$11])) / [.$A$2] + 1 / ([.$A$11]+273))-[.$A27] -> -0.927161465001234 | I27: of:=1 / ( (LN([.$C13])-LN([.$C$12])) / [.$A$2] + 1 / ([.$A$12]+273))-[.$A27] -> -1.65606846386385 | J27: of:=1 / ( (LN([.$C13])-LN([.$C$13])) / [.$A$2] + 1 / ([.$A$13]+273))-[.$A27] -> 0 | K27: of:=1 / ( (LN([.$C13])-LN([.$C$14])) / [.$A$2] + 1 / ([.$A$14]+273))-[.$A27] -> 1.6518543136674 | M27: of:=DEVSQ([.B27:.K27]) -> 10.9137176266128
A28: of:=[.A14]+273 -> 304.5 | B28: of:=1 / ( (LN([.$C14])-LN([.$C$5])) / [.$A$2] + 1 / ([.$A$5]+273))-[.$A28] -> -2.14299982537256 | C28: of:=1 / ( (LN([.$C14])-LN([.$C$6])) / [.$A$2] + 1 / ([.$A$6]+273))-[.$A28] -> -1.67350333030089 | D28: of:=1 / ( (LN([.$C14])-LN([.$C$7])) / [.$A$2] + 1 / ([.$A$7]+273))-[.$A28] -> -1.14879625313745 | E28: of:=1 / ( (LN([.$C14])-LN([.$C$8])) / [.$A$2] + 1 / ([.$A$8]+273))-[.$A28] -> -0.187334330916258 | F28: of:=1 / ( (LN([.$C14])-LN([.$C$8])) / [.$A$2] + 1 / ([.$A$8]+273))-[.$A28] -> -0.187334330916258 | G28: of:=1 / ( (LN([.$C14])-LN([.$C$10])) / [.$A$2] + 1 / ([.$A$10]+273))-[.$A28] -> -1.96569863599677 | H28: of:=1 / ( (LN([.$C14])-LN([.$C$11])) / [.$A$2] + 1 / ([.$A$11]+273))-[.$A28] -> -2.59338154065335 | I28: of:=1 / ( (LN([.$C14])-LN([.$C$12])) / [.$A$2] + 1 / ([.$A$12]+273))-[.$A28] -> -3.32632643146621 | J28: of:=1 / ( (LN([.$C14])-LN([.$C$13])) / [.$A$2] + 1 / ([.$A$13]+273))-[.$A28] -> -1.66106972087721 | K28: of:=1 / ( (LN([.$C14])-LN([.$C$14])) / [.$A$2] + 1 / ([.$A$14]+273))-[.$A28] -> 0 | M28: of:=DEVSQ([.B28:.K28]) -> 11.035559185276
M29: of:=AVERAGE([.M19:.M28]) -> 10.1948325778381
B30: of:=DEVSQ([.B19:.B28]) -> 9.0403415631482 | C30: of:=DEVSQ([.C19:.C28]) -> 9.0699960641214 | D30: of:=DEVSQ([.D19:.D28]) -> 9.10688841452337 | E30: of:=DEVSQ([.E19:.E28]) -> 9.18482428374674 | F30: of:=DEVSQ([.F19:.F28]) -> 9.18482428374674 | G30: of:=DEVSQ([.G19:.G28]) -> 9.05116878364153 | H30: of:=DEVSQ([.H19:.H28]) -> 9.01485984855182 | I30: of:=DEVSQ([.I19:.I28]) -> 8.9795677156677 | J30: of:=DEVSQ([.J19:.J28]) -> 9.07082441389028 | K30: of:=DEVSQ([.K19:.K28]) -> 9.20157413010458 | L30: of:=AVERAGE([.B30:.K30]) -> 9.09048695011423
G34: of:=LN(6592) -> 8.79361207158931 | H34: of:=LN(6645) -> 8.80161997114735

Sheet: Correction
A1: Beta T1 K | B1: Beta T1 sns | C1: beta coef | L1: alpha coef | M1: delta coef
A2: 297 | B2: 6616 | C2: 200 | L2: -1.527608 | M2: -470.897933033281
A5: raw | B5: sensor | C5: temp | D5: base K | E5: Beta K | F5: Beta C | G5: Corr needed | J5: Corrected K | K5: Corr C | L5: Error
A6: 15660 | B6: 6599 | C6: 25 | D6: of:=[.A6]*330/16384 -> 315.41748046875 | E6: of:=1 / ( (LN([.B6])-LN([.$B$2])) / [.$C$2] + 1 / [.$A$2]) -> 298.139088223079 | F6: of:=[.E6]-273 -> 25.1390882230793 | G6: of:=[.D6]-[.C6]-273 -> 17.41748046875 | J6: of:=[.D6]-[.E6]*[.$L$2]+[.$M$2] -> 299.959203717751 | K6: of:=[.J6]-273 -> 26.9592037177512 | L6: of:=[.K6]-[.C6] -> 1.95920371775122
A7: 15385 | B7: 6604 | C7: 27 | D7: of:=[.A7]*330/16384 -> 309.878540039062 | E7: of:=1 / ( (LN([.B7])-LN([.$B$2])) / [.$C$2] + 1 / [.$A$2]) -> 297.802851478194 | F7: of:=[.E7]-273 -> 24.8028514781944 | G7: of:=[.D7]-[.C7]-273 -> 9.8785400390625 | J7: of:=[.D7]-[.E7]*[.$L$2]+[.$M$2] -> 293.906625346683 | K7: of:=[.J7]-273 -> 20.9066253466835 | L7: of:=[.K7]-[.C7] -> -6.09337465331652
A8: 15303 | B8: 6579 | C8: 27 | D8: of:=[.A8]*330/16384 -> 308.226928710937 | E8: of:=1 / ( (LN([.B8])-LN([.$B$2])) / [.$C$2] + 1 / [.$A$2]) -> 299.494240878413 | F8: of:=[.E8]-273 -> 26.494240878413 | G8: of:=[.D8]-[.C8]-273 -> 8.2269287109375 | J8: of:=[.D8]-[.E8]*[.$L$2]+[.$M$2] -> 294.838793997448 | K8: of:=[.J8]-273 -> 21.8387939974477 | L8: of:=[.K8]-[.C8] -> -5.16120600255232
A9: 15771 | B9: 6698 | C9: 18.5 | D9: of:=[.A9]*330/16384 -> 317.653198242188 | E9: of:=1 / ( (LN([.B9])-LN([.$B$2])) / [.$C$2] + 1 / [.$A$2]) -> 291.664793306186 | F9: of:=[.E9]-273 -> 18.6647933061861 | G9: of:=[.D9]-[.C9]-273 -> 26.1531982421875 | J9: of:=[.D9]-[.E9]*[.$L$2]+[.$M$2] -> 292.304736781783 | K9: of:=[.J9]-273 -> 19.3047367817834 | L9: of:=[.K9]-[.C9] -> 0.804736781783447
A10: 15797 | B10: 6697 | C10: 19 | D10: of:=[.A10]*330/16384 -> 318.176879882812 | E10: of:=1 / ( (LN([.B10])-LN([.$B$2])) / [.$C$2] + 1 / [.$A$2]) -> 291.728314678907 | F10: of:=[.E10]-273 -> 18.7283146789075 | G10: of:=[.D10]-[.C10]-273 -> 26.1768798828125 | J10: of:=[.D10]-[.E10]*[.$L$2]+[.$M$2] -> 292.925454179548 | K10: of:=[.J10]-273 -> 19.9254541795485 | L10: of:=[.K10]-[.C10] -> 0.925454179548467
A11: 15833 | B11: 6689 | C11: 20 | D11: of:=[.A11]*330/16384 -> 318.901977539062 | E11: of:=1 / ( (LN([.B11])-LN([.$B$2])) / [.$C$2] + 1 / [.$A$2]) -> 292.237826459865 | F11: of:=[.E11]-273 -> 19.2378264598653 | G11: of:=[.D11]-[.C11]-273 -> 25.9019775390625 | J11: of:=[.D11]-[.E11]*[.$L$2]+[.$M$2] -> 294.428886108484 | K11: of:=[.J11]-273 -> 21.4288861084839 | L11: of:=[.K11]-[.C11] -> 1.42888610848394
A12: 15746 | B12: 6672 | C12: 22 | D12: of:=[.A12]*330/16384 -> 317.149658203125 | E12: of:=1 / ( (LN([.B12])-LN([.$B$2])) / [.$C$2] + 1 / [.$A$2]) -> 293.328515389275 | F12: of:=[.E12]-273 -> 20.3285153892751 | G12: of:=[.D12]-[.C12]-273 -> 22.149658203125 | J12: of:=[.D12]-[.E12]*[.$L$2]+[.$M$2] -> 294.342711906624 | K12: of:=[.J12]-273 -> 21.3427119066243 | L12: of:=[.K12]-[.C12] -> -0.657288093375712
A13: 15862 | B13: 6645 | C13: 23 | D13: of:=[.A13]*330/16384 -> 319.486083984375 | E13: of:=1 / ( (LN([.B13])-LN([.$B$2])) / [.$C$2] + 1 / [.$A$2]) -> 295.083434377605 | F13: of:=[.E13]-273 -> 22.0834343776045 | G13: of:=[.D13]-[.C13]-273 -> 23.486083984375 | J13: of:=[.D13]-[.E13]*[.$L$2]+[.$M$2] -> 299.359965973798 | K13: of:=[.J13]-273 -> 26.3599659737982 | L13: of:=[.K13]-[.C13] -> 3.35996597379818
A14: 15652 | B14: 6616 | C14: 24 | D14: of:=[.A14]*330/16384 -> 315.25634765625 | E14: of:=1 / ( (LN([.B14])-LN([.$B$2])) / [.$C$2] + 1 / [.$A$2]) -> 297 | F14: of:=[.E14]-273 -> 24 | G14: of:=[.D14]-[.C14]-273 -> 18.25634765625 | J14: of:=[.D14]-[.E14]*[.$L$2]+[.$M$2] -> 298.057990622969 | K14: of:=[.J14]-273 -> 25.0579906229695 | L14: of:=[.K14]-[.C14] -> 1.0579906229695
A15: 15515 | B15: 6592 | C15: 25 | D15: of:=[.A15]*330/16384 -> 312.496948242187 | E15: of:=1 / ( (LN([.B15])-LN([.$B$2])) / [.$C$2] + 1 / [.$A$2]) -> 298.611527339109 | F15: of:=[.E15]-273 -> 25.6115273391088 | G15: of:=[.D15]-[.C15]-273 -> 14.4969482421875 | J15: of:=[.D15]-[.E15]*[.$L$2]+[.$M$2] -> 297.760373264348 | K15: of:=[.J15]-273 -> 24.7603732643483 | L15: of:=[.K15]-[.C15] -> -0.239626735651711
A16: 15535 | B16: 6552 | C16: 27 | D16: of:=[.A16]*330/16384 -> 312.899780273437 | E16: of:=1 / ( (LN([.B16])-LN([.$B$2])) / [.$C$2] + 1 / [.$A$2]) -> 301.350019959879 | F16: of:=[.E16]-273 -> 28.3500199598791 | G16: of:=[.D16]-[.C16]-273 -> 12.8997802734375 | J16: of:=[.D16]-[.E16]*[.$L$2]+[.$M$2] -> 302.346548531028 | K16: of:=[.J16]-273 -> 29.346548531028 | L16: of:=[.K16]-[.C16] -> 2.34654853102796
A17: 15680 | B17: 6547 | C17: 29 | D17: of:=[.A17]*330/16384 -> 315.8203125 | E17: of:=1 / ( (LN([.B17])-LN([.$B$2])) / [.$C$2] + 1 / [.$A$2]) -> 301.6970556808 | F17: of:=[.E17]-273 -> 28.6970556808001 | G17: of:=[.D17]-[.C17]-273 -> 13.8203125 | J17: of:=[.D17]-[.E17]*[.$L$2]+[.$M$2] -> 305.797215301155 | K17: of:=[.J17]-273 -> 32.7972153011551 | L17: of:=[.K17]-[.C17] -> 3.79721530115506
A18: 15789 | B18: 6535 | C18: 31.5 | D18: of:=[.A18]*330/16384 -> 318.015747070312 | E18: of:=1 / ( (LN([.B18])-LN([.$B$2])) / [.$C$2] + 1 / [.$A$2]) -> 302.534301364003 | F18: of:=[.E18]-273 -> 29.5343013640032 | G18: of:=[.D18]-[.C18]-273 -> 13.5157470703125 | J18: of:=[.D18]-[.E18]*[.$L$2]+[.$M$2] -> 309.271633075094 | K18: of:=[.J18]-273 -> 36.2716330750943 | L18: of:=[.K18]-[.C18] -> 4.77163307509426
A19: 15156 | B19: 6583 | C19: 26 | D19: of:=[.A19]*330/16384 -> 305.26611328125 | E19: of:=1 / ( (LN([.B19])-LN([.$B$2])) / [.$C$2] + 1 / [.$A$2]) -> 299.221895529029 | F19: of:=[.E19]-273 -> 26.2218955290294 | G19: of:=[.D19]-[.C19]-273 -> 6.26611328125 | J19: of:=[.D19]-[.E19]*[.$L$2]+[.$M$2] -> 291.461941633279 | K19: of:=[.J19]-273 -> 18.4619416332791 | L19: of:=[.K19]-[.C19] -> -7.53805836672092
A20: 20443 | B20: 6572 | C20: 100 | D20: of:=[.A20]*330/16384 -> 411.754760742187 | E20: of:=1 / ( (LN([.B20])-LN([.$B$2])) / [.$C$2] + 1 / [.$A$2]) -> 299.972440397568 | F20: of:=[.E20]-273 -> 26.9724403975678 | G20: of:=[.D20]-[.C20]-273 -> 38.7547607421875 | J20: of:=[.D20]-[.E20]*[.$L$2]+[.$M$2] -> 399.097127439755 | K20: of:=[.J20]-273 -> 126.097127439755 | L20: of:=[.K20]-[.C20] -> 26.0971274397547
A21: 16029 | B21: 6585 | C21: 36.6 | D21: of:=[.A21]*330/16384 -> 322.849731445312 | E21: of:=1 / ( (LN([.B21])-LN([.$B$2])) / [.$C$2] + 1 / [.$A$2]) -> 299.085970450517 | F21: of:=[.E21]-273 -> 26.0859704505169 | G21: of:=[.D21]-[.C21]-273 -> 13.2497314453125 | J21: of:=[.D21]-[.E21]*[.$L$2]+[.$M$2] -> 308.837919560005 | K21: of:=[.J21]-273 -> 35.8379195600052 | L21: of:=[.K21]-[.C21] -> -0.762080439994783
L23: of:=DEVSQ([.L6:.L21]) -> 822.640201236151

Sheet: freshely-boiled-water
A1: Beta T1 K | B1: Beta T1 sns | C1: beta coef | E1: linear coef | F1: linear offset
A2: 297 | B2: 6616 | C2: 200 | E2: -1.527608 | F2: -470.897933033281
A4: min | B4: max | C4: center | D4: sensor | E4: device temp | F4: Device C | G4: cmin | H4: cmax | I4: ccenter
A5: 14996 | B5: 15625 | C5: 15198 | D5: 6579 | E5: of:=1 / ( (LN([.D5])-LN([.$B$2])) / [.$C$2] + 1 / [.$A$2]) -> 299.494240878413 | F5: of:=[.E5]-273 -> 26.494240878413 | G5: of:=[.A5]*330/16384-[.$E5]*[.$E$2]+[.$F$2]-273 -> 15.6553223177597 | H5: of:=[.B5]*330/16384-[.$E5]*[.$E$2]+[.$F$2]-273 -> 28.3243897005722 | I5: of:=[.C5]*330/16384-[.$E5]*[.$E$2]+[.$F$2]-273 -> 19.7239258333847
A6: 14992 | B6: 15615 | C6: 15200 | D6: 6579 | E6: of:=1 / ( (LN([.D6])-LN([.$B$2])) / [.$C$2] + 1 / [.$A$2]) -> 299.494240878413 | F6: of:=[.E6]-273 -> 26.494240878413 | G6: of:=[.A6]*330/16384-[.$E6]*[.$E$2]+[.$F$2]-273 -> 15.5747559115097 | H6: of:=[.B6]*330/16384-[.$E6]*[.$E$2]+[.$F$2]-273 -> 28.1229736849472 | I6: of:=[.C6]*330/16384-[.$E6]*[.$E$2]+[.$F$2]-273 -> 19.7642090365097
A7: 15005 | B7: 15604 | C7: 15180 | D7: 6579 | E7: of:=1 / ( (LN([.D7])-LN([.$B$2])) / [.$C$2] + 1 / [.$A$2]) -> 299.494240878413 | F7: of:=[.E7]-273 -> 26.494240878413 | G7: of:=[.A7]*330/16384-[.$E7]*[.$E$2]+[.$F$2]-273 -> 15.8365967318222 | H7: of:=[.B7]*330/16384-[.$E7]*[.$E$2]+[.$F$2]-273 -> 27.9014160677597 | I7: of:=[.C7]*330/16384-[.$E7]*[.$E$2]+[.$F$2]-273 -> 19.3613770052597
A8: 14995 | B8: 15595 | C8: 15175 | D8: 6579 | E8: of:=1 / ( (LN([.D8])-LN([.$B$2])) / [.$C$2] + 1 / [.$A$2]) -> 299.494240878413 | F8: of:=[.E8]-273 -> 26.494240878413 | G8: of:=[.A8]*330/16384-[.$E8]*[.$E$2]+[.$F$2]-273 -> 15.6351807161972 | H8: of:=[.B8]*330/16384-[.$E8]*[.$E$2]+[.$F$2]-273 -> 27.7201416536972 | I8: of:=[.C8]*330/16384-[.$E8]*[.$E$2]+[.$F$2]-273 -> 19.2606689974472
A9: 15000 | B9: 15588 | C9: 15164 | D9: 6579 | E9: of:=1 / ( (LN([.D9])-LN([.$B$2])) / [.$C$2] + 1 / [.$A$2]) -> 299.494240878413 | F9: of:=[.E9]-273 -> 26.494240878413 | G9: of:=[.A9]*330/16384-[.$E9]*[.$E$2]+[.$F$2]-273 -> 15.7358887240097 | H9: of:=[.B9]*330/16384-[.$E9]*[.$E$2]+[.$F$2]-273 -> 27.5791504427597 | I9: of:=[.C9]*330/16384-[.$E9]*[.$E$2]+[.$F$2]-273 -> 19.0391113802597
A10: 14990 | B10: 15589 | C10: 15162 | D10: 6579 | E10: of:=1 / ( (LN([.D10])-LN([.$B$2])) / [.$C$2] + 1 / [.$A$2]) -> 299.494240878413 | F10: of:=[.E10]-273 -> 26.494240878413 | G10: of:=[.A10]*330/16384-[.$E10]*[.$E$2]+[.$F$2]-273 -> 15.5344727083847 | H10: of:=[.B10]*330/16384-[.$E10]*[.$E$2]+[.$F$2]-273 -> 27.5992920443222 | I10: of:=[.C10]*330/16384-[.$E10]*[.$E$2]+[.$F$2]-273 -> 18.9988281771347
A11: 14995 | B11: 15574 | C11: 15150 | D11: 6579 | E11: of:=1 / ( (LN([.D11])-LN([.$B$2])) / [.$C$2] + 1 / [.$A$2]) -> 299.494240878413 | F11: of:=[.E11]-273 -> 26.494240878413 | G11: of:=[.A11]*330/16384-[.$E11]*[.$E$2]+[.$F$2]-273 -> 15.6351807161972 | H11: of:=[.B11]*330/16384-[.$E11]*[.$E$2]+[.$F$2]-273 -> 27.2971680208847 | I11: of:=[.C11]*330/16384-[.$E11]*[.$E$2]+[.$F$2]-273 -> 18.7571289583847
A12: 14986 | B12: 15570 | C12: 15138 | D12: 6579 | E12: of:=1 / ( (LN([.D12])-LN([.$B$2])) / [.$C$2] + 1 / [.$A$2]) -> 299.494240878413 | F12: of:=[.E12]-273 -> 26.494240878413 | G12: of:=[.A12]*330/16384-[.$E12]*[.$E$2]+[.$F$2]-273 -> 15.4539063021347 | H12: of:=[.B12]*330/16384-[.$E12]*[.$E$2]+[.$F$2]-273 -> 27.2166016146347 | I12: of:=[.C12]*330/16384-[.$E12]*[.$E$2]+[.$F$2]-273 -> 18.5154297396347
A13: 14993 | B13: 15564 | C13: 15127 | D13: 6579 | E13: of:=1 / ( (LN([.D13])-LN([.$B$2])) / [.$C$2] + 1 / [.$A$2]) -> 299.494240878413 | F13: of:=[.E13]-273 -> 26.494240878413 | G13: of:=[.A13]*330/16384-[.$E13]*[.$E$2]+[.$F$2]-273 -> 15.5948975130722 | H13: of:=[.B13]*330/16384-[.$E13]*[.$E$2]+[.$F$2]-273 -> 27.0957520052597 | I13: of:=[.C13]*330/16384-[.$E13]*[.$E$2]+[.$F$2]-273 -> 18.2938721224472
A14: 14996 | B14: 15556 | C14: 15127 | D14: 6579 | E14: of:=1 / ( (LN([.D14])-LN([.$B$2])) / [.$C$2] + 1 / [.$A$2]) -> 299.494240878413 | F14: of:=[.E14]-273 -> 26.494240878413 | G14: of:=[.A14]*330/16384-[.$E14]*[.$E$2]+[.$F$2]-273 -> 15.6553223177597 | H14: of:=[.B14]*330/16384-[.$E14]*[.$E$2]+[.$F$2]-273 -> 26.9346191927597 | I14: of:=[.C14]*330/16384-[.$E14]*[.$E$2]+[.$F$2]-273 -> 18.2938721224472
A15: 15000 | B15: 15555 | C15: 15116 | D15: 6580 | E15: of:=1 / ( (LN([.D15])-LN([.$B$2])) / [.$C$2] + 1 / [.$A$2]) -> 299.426092546124 | F15: of:=[.E15]-273 -> 26.4260925461237 | G15: of:=[.A15]*330/16384-[.$E15]*[.$E$2]+[.$F$2]-273 -> 15.6317847864178 | H15: of:=[.B15]*330/16384-[.$E15]*[.$E$2]+[.$F$2]-273 -> 26.8103736536053 | I15: of:=[.C15]*330/16384-[.$E15]*[.$E$2]+[.$F$2]-273 -> 17.9682105676678
A16: 15002 | B16: 15552 | C16: 15112 | D16: 6579 | E16: of:=1 / ( (LN([.D16])-LN([.$B$2])) / [.$C$2] + 1 / [.$A$2]) -> 299.494240878413 | F16: of:=[.E16]-273 -> 26.494240878413 | G16: of:=[.A16]*330/16384-[.$E16]*[.$E$2]+[.$F$2]-273 -> 15.7761719271347 | H16: of:=[.B16]*330/16384-[.$E16]*[.$E$2]+[.$F$2]-273 -> 26.8540527865097 | I16: of:=[.C16]*330/16384-[.$E16]*[.$E$2]+[.$F$2]-273 -> 17.9917480990097
A17: 15002 | B17: 15547 | C17: 15107 | D17: 6579 | E17: of:=1 / ( (LN([.D17])-LN([.$B$2])) / [.$C$2] + 1 / [.$A$2]) -> 299.494240878413 | F17: of:=[.E17]-273 -> 26.494240878413 | G17: of:=[.A17]*330/16384-[.$E17]*[.$E$2]+[.$F$2]-273 -> 15.7761719271347 | H17: of:=[.B17]*330/16384-[.$E17]*[.$E$2]+[.$F$2]-273 -> 26.7533447786972 | I17: of:=[.C17]*330/16384-[.$E17]*[.$E$2]+[.$F$2]-273 -> 17.8910400911972
A18: 15004 | B18: 15540 | C18: 15101 | D18: 6579 | E18: of:=1 / ( (LN([.D18])-LN([.$B$2])) / [.$C$2] + 1 / [.$A$2]) -> 299.494240878413 | F18: of:=[.E18]-273 -> 26.494240878413 | G18: of:=[.A18]*330/16384-[.$E18]*[.$E$2]+[.$F$2]-273 -> 15.8164551302597 | H18: of:=[.B18]*330/16384-[.$E18]*[.$E$2]+[.$F$2]-273 -> 26.6123535677597 | I18: of:=[.C18]*330/16384-[.$E18]*[.$E$2]+[.$F$2]-273 -> 17.7701904818222
A19: 14996 | B19: 15549 | C19: 15093 | D19: 6579 | E19: of:=1 / ( (LN([.D19])-LN([.$B$2])) / [.$C$2] + 1 / [.$A$2]) -> 299.494240878413 | F19: of:=[.E19]-273 -> 26.494240878413 | G19: of:=[.A19]*330/16384-[.$E19]*[.$E$2]+[.$F$2]-273 -> 15.6553223177597 | H19: of:=[.B19]*330/16384-[.$E19]*[.$E$2]+[.$F$2]-273 -> 26.7936279818222 | I19: of:=[.C19]*330/16384-[.$E19]*[.$E$2]+[.$F$2]-273 -> 17.6090576693222
A20: 15000 | B20: 15541 | C20: 15092 | D20: 6578 | E20: of:=1 / ( (LN([.D20])-LN([.$B$2])) / [.$C$2] + 1 / [.$A$2]) -> 299.562430604735 | F20: of:=[.E20]-273 -> 26.5624306047353 | G20: of:=[.A20]*330/16384-[.$E20]*[.$E$2]+[.$F$2]-273 -> 15.8400558954573 | H20: of:=[.B20]*330/16384-[.$E20]*[.$E$2]+[.$F$2]-273 -> 26.7366623407698 | I20: of:=[.C20]*330/16384-[.$E20]*[.$E$2]+[.$F$2]-273 -> 17.6930832392073
A21: 15005 | B21: 15696 | C21: 15084 | D21: 6579 | E21: of:=1 / ( (LN([.D21])-LN([.$B$2])) / [.$C$2] + 1 / [.$A$2]) -> 299.494240878413 | F21: of:=[.E21]-273 -> 26.494240878413 | G21: of:=[.A21]*330/16384-[.$E21]*[.$E$2]+[.$F$2]-273 -> 15.8365967318222 | H21: of:=[.B21]*330/16384-[.$E21]*[.$E$2]+[.$F$2]-273 -> 29.7544434115097 | I21: of:=[.C21]*330/16384-[.$E21]*[.$E$2]+[.$F$2]-273 -> 17.4277832552597
A22: 15042 | B22: 15774 | C22: 15082 | D22: 6579 | E22: of:=1 / ( (LN([.D22])-LN([.$B$2])) / [.$C$2] + 1 / [.$A$2]) -> 299.494240878413 | F22: of:=[.E22]-273 -> 26.494240878413 | G22: of:=[.A22]*330/16384-[.$E22]*[.$E$2]+[.$F$2]-273 -> 16.5818359896347 | H22: of:=[.B22]*330/16384-[.$E22]*[.$E$2]+[.$F$2]-273 -> 31.3254883333847 | I22: of:=[.C22]*330/16384-[.$E22]*[.$E$2]+[.$F$2]-273 -> 17.3875000521347
A23: 15040 | B23: 15767 | C23: 15080 | D23: 6579 | E23: of:=1 / ( (LN([.D23])-LN([.$B$2])) / [.$C$2] + 1 / [.$A$2]) -> 299.494240878413 | F23: of:=[.E23]-273 -> 26.494240878413 | G23: of:=[.A23]*330/16384-[.$E23]*[.$E$2]+[.$F$2]-273 -> 16.5415527865097 | H23: of:=[.B23]*330/16384-[.$E23]*[.$E$2]+[.$F$2]-273 -> 31.1844971224472 | I23: of:=[.C23]*330/16384-[.$E23]*[.$E$2]+[.$F$2]-273 -> 17.3472168490097
A24: 15030 | B24: 15872 | C24: 15237 | D24: 6575 | E24: of:=1 / ( (LN([.D24])-LN([.$B$2])) / [.$C$2] + 1 / [.$A$2]) -> 299.767248533292 | F24: of:=[.E24]-273 -> 26.767248533292 | G24: of:=[.A24]*330/16384-[.$E24]*[.$E$2]+[.$F$2]-273 -> 16.7571854485391 | H24: of:=[.B24]*330/16384-[.$E24]*[.$E$2]+[.$F$2]-273 -> 33.7164139641641 | I24: of:=[.C24]*330/16384-[.$E24]*[.$E$2]+[.$F$2]-273 -> 20.9264969719766
A25: 15049 | B25: 15931 | C25: 15240 | D25: 6577 | E25: of:=1 / ( (LN([.D25])-LN([.$B$2])) / [.$C$2] + 1 / [.$A$2]) -> 299.630661763606 | F25: of:=[.E25]-273 -> 26.6306617636062 | G25: of:=[.A25]*330/16384-[.$E25]*[.$E$2]+[.$F$2]-273 -> 16.9312248361604 | H25: of:=[.B25]*330/16384-[.$E25]*[.$E$2]+[.$F$2]-273 -> 34.6961174142854 | I25: of:=[.C25]*330/16384-[.$E25]*[.$E$2]+[.$F$2]-273 -> 20.7782707345979
A26: 15049 | B26: 15919 | C26: 15237 | D26: 6578 | E26: of:=1 / ( (LN([.D26])-LN([.$B$2])) / [.$C$2] + 1 / [.$A$2]) -> 299.562430604735 | F26: of:=[.E26]-273 -> 26.5624306047353 | G26: of:=[.A26]*330/16384-[.$E26]*[.$E$2]+[.$F$2]-273 -> 16.8269943720198 | H26: of:=[.B26]*330/16384-[.$E26]*[.$E$2]+[.$F$2]-273 -> 34.3501877313948 | I26: of:=[.C26]*330/16384-[.$E26]*[.$E$2]+[.$F$2]-273 -> 20.6136154657698
A27: 15194 | B27: 15918 | C27: 15229 | D27: 6578 | E27: of:=1 / ( (LN([.D27])-LN([.$B$2])) / [.$C$2] + 1 / [.$A$2]) -> 299.562430604735 | F27: of:=[.E27]-273 -> 26.5624306047353 | G27: of:=[.A27]*330/16384-[.$E27]*[.$E$2]+[.$F$2]-273 -> 19.7475265985823 | H27: of:=[.B27]*330/16384-[.$E27]*[.$E$2]+[.$F$2]-273 -> 34.3300461298323 | I27: of:=[.C27]*330/16384-[.$E27]*[.$E$2]+[.$F$2]-273 -> 20.4524826532698
A28: 15196 | B28: 15929 | C28: 15248 | D28: 6578 | E28: of:=1 / ( (LN([.D28])-LN([.$B$2])) / [.$C$2] + 1 / [.$A$2]) -> 299.562430604735 | F28: of:=[.E28]-273 -> 26.5624306047353 | G28: of:=[.A28]*330/16384-[.$E28]*[.$E$2]+[.$F$2]-273 -> 19.7878098017073 | H28: of:=[.B28]*330/16384-[.$E28]*[.$E$2]+[.$F$2]-273 -> 34.5516037470198 | I28: of:=[.C28]*330/16384-[.$E28]*[.$E$2]+[.$F$2]-273 -> 20.8351730829573
A29: 15206 | B29: 15995 | C29: 15481 | D29: 6579 | E29: of:=1 / ( (LN([.D29])-LN([.$B$2])) / [.$C$2] + 1 / [.$A$2]) -> 299.494240878413 | F29: of:=[.E29]-273 -> 26.494240878413 | G29: of:=[.A29]*330/16384-[.$E29]*[.$E$2]+[.$F$2]-273 -> 19.8850586458847 | H29: of:=[.B29]*330/16384-[.$E29]*[.$E$2]+[.$F$2]-273 -> 35.7767822786972 | I29: of:=[.C29]*330/16384-[.$E29]*[.$E$2]+[.$F$2]-273 -> 25.4239990755722
A30: 15225 | B30: 16016 | C30: 15396 | D30: 6578 | E30: of:=1 / ( (LN([.D30])-LN([.$B$2])) / [.$C$2] + 1 / [.$A$2]) -> 299.562430604735 | F30: of:=[.E30]-273 -> 26.5624306047353 | G30: of:=[.A30]*330/16384-[.$E30]*[.$E$2]+[.$F$2]-273 -> 20.3719162470198 | H30: of:=[.B30]*330/16384-[.$E30]*[.$E$2]+[.$F$2]-273 -> 36.3039230829573 | I30: of:=[.C30]*330/16384-[.$E30]*[.$E$2]+[.$F$2]-273 -> 23.8161301142073
A31: 15250 | B31: 15873 | C31: 15444 | D31: 6578 | E31: of:=1 / ( (LN([.D31])-LN([.$B$2])) / [.$C$2] + 1 / [.$A$2]) -> 299.562430604735 | F31: of:=[.E31]-273 -> 26.5624306047353 | G31: of:=[.A31]*330/16384-[.$E31]*[.$E$2]+[.$F$2]-273 -> 20.8754562860823 | H31: of:=[.B31]*330/16384-[.$E31]*[.$E$2]+[.$F$2]-273 -> 33.4236740595198 | I31: of:=[.C31]*330/16384-[.$E31]*[.$E$2]+[.$F$2]-273 -> 24.7829269892073
A32: 15070 | B32: 15943 | C32: 15625 | D32: 6578 | E32: of:=1 / ( (LN([.D32])-LN([.$B$2])) / [.$C$2] + 1 / [.$A$2]) -> 299.562430604735 | F32: of:=[.E32]-273 -> 26.5624306047353 | G32: of:=[.A32]*330/16384-[.$E32]*[.$E$2]+[.$F$2]-273 -> 17.2499680048323 | H32: of:=[.B32]*330/16384-[.$E32]*[.$E$2]+[.$F$2]-273 -> 34.8335861688948 | I32: of:=[.C32]*330/16384-[.$E32]*[.$E$2]+[.$F$2]-273 -> 28.4285568720198
A33: 15034 | B33: 15928 | C33: 15210 | D33: 6578 | E33: of:=1 / ( (LN([.D33])-LN([.$B$2])) / [.$C$2] + 1 / [.$A$2]) -> 299.562430604735 | F33: of:=[.E33]-273 -> 26.5624306047353 | G33: of:=[.A33]*330/16384-[.$E33]*[.$E$2]+[.$F$2]-273 -> 16.5248703485823 | H33: of:=[.B33]*330/16384-[.$E33]*[.$E$2]+[.$F$2]-273 -> 34.5314621454573 | I33: of:=[.C33]*330/16384-[.$E33]*[.$E$2]+[.$F$2]-273 -> 20.0697922235823
A34: 15035 | B34: 15799 | C34: 15205 | D34: 6578 | E34: of:=1 / ( (LN([.D34])-LN([.$B$2])) / [.$C$2] + 1 / [.$A$2]) -> 299.562430604735 | F34: of:=[.E34]-273 -> 26.5624306047353 | G34: of:=[.A34]*330/16384-[.$E34]*[.$E$2]+[.$F$2]-273 -> 16.5450119501448 | H34: of:=[.B34]*330/16384-[.$E34]*[.$E$2]+[.$F$2]-273 -> 31.9331955438948 | I34: of:=[.C34]*330/16384-[.$E34]*[.$E$2]+[.$F$2]-273 -> 19.9690842157698
A35: 15038 | B35: 15639 | C35: 15197 | D35: 6578 | E35: of:=1 / ( (LN([.D35])-LN([.$B$2])) / [.$C$2] + 1 / [.$A$2]) -> 299.562430604735 | F35: of:=[.E35]-273 -> 26.5624306047353 | G35: of:=[.A35]*330/16384-[.$E35]*[.$E$2]+[.$F$2]-273 -> 16.6054367548323 | H35: of:=[.B35]*330/16384-[.$E35]*[.$E$2]+[.$F$2]-273 -> 28.7105392938948 | I35: of:=[.C35]*330/16384-[.$E35]*[.$E$2]+[.$F$2]-273 -> 19.8079514032698
A36: 15033 | B36: 15641 | C36: 15193 | D36: 6578 | E36: of:=1 / ( (LN([.D36])-LN([.$B$2])) / [.$C$2] + 1 / [.$A$2]) -> 299.562430604735 | F36: of:=[.E36]-273 -> 26.5624306047353 | G36: of:=[.A36]*330/16384-[.$E36]*[.$E$2]+[.$F$2]-273 -> 16.5047287470198 | H36: of:=[.B36]*330/16384-[.$E36]*[.$E$2]+[.$F$2]-273 -> 28.7508224970198 | I36: of:=[.C36]*330/16384-[.$E36]*[.$E$2]+[.$F$2]-273 -> 19.7273849970198
A37: 15037 | B37: 15627 | C37: 15191 | D37: 6577 | E37: of:=1 / ( (LN([.D37])-LN([.$B$2])) / [.$C$2] + 1 / [.$A$2]) -> 299.630661763606 | F37: of:=[.E37]-273 -> 26.6306617636062 | G37: of:=[.A37]*330/16384-[.$E37]*[.$E$2]+[.$F$2]-273 -> 16.6895256174104 | H37: of:=[.B37]*330/16384-[.$E37]*[.$E$2]+[.$F$2]-273 -> 28.5730705392854 | I37: of:=[.C37]*330/16384-[.$E37]*[.$E$2]+[.$F$2]-273 -> 19.7913322580354
A38: 15033 | B38: 15633 | C38: 15183 | D38: 6578 | E38: of:=1 / ( (LN([.D38])-LN([.$B$2])) / [.$C$2] + 1 / [.$A$2]) -> 299.562430604735 | F38: of:=[.E38]-273 -> 26.5624306047353 | G38: of:=[.A38]*330/16384-[.$E38]*[.$E$2]+[.$F$2]-273 -> 16.5047287470198 | H38: of:=[.B38]*330/16384-[.$E38]*[.$E$2]+[.$F$2]-273 -> 28.5896896845198 | I38: of:=[.C38]*330/16384-[.$E38]*[.$E$2]+[.$F$2]-273 -> 19.5259689813948
A39: 15046 | B39: 15630 | C39: 15181 | D39: 6578 | E39: of:=1 / ( (LN([.D39])-LN([.$B$2])) / [.$C$2] + 1 / [.$A$2]) -> 299.562430604735 | F39: of:=[.E39]-273 -> 26.5624306047353 | G39: of:=[.A39]*330/16384-[.$E39]*[.$E$2]+[.$F$2]-273 -> 16.7665695673323 | H39: of:=[.B39]*330/16384-[.$E39]*[.$E$2]+[.$F$2]-273 -> 28.5292648798323 | I39: of:=[.C39]*330/16384-[.$E39]*[.$E$2]+[.$F$2]-273 -> 19.4856857782698
A40: 15041 | B40: 15628 | C40: 15183 | D40: 6578 | E40: of:=1 / ( (LN([.D40])-LN([.$B$2])) / [.$C$2] + 1 / [.$A$2]) -> 299.562430604735 | F40: of:=[.E40]-273 -> 26.5624306047353 | G40: of:=[.A40]*330/16384-[.$E40]*[.$E$2]+[.$F$2]-273 -> 16.6658615595198 | H40: of:=[.B40]*330/16384-[.$E40]*[.$E$2]+[.$F$2]-273 -> 28.4889816767073 | I40: of:=[.C40]*330/16384-[.$E40]*[.$E$2]+[.$F$2]-273 -> 19.5259689813948
A41: 15043 | B41: 15626 | C41: 15180 | D41: 6577 | E41: of:=1 / ( (LN([.D41])-LN([.$B$2])) / [.$C$2] + 1 / [.$A$2]) -> 299.630661763606 | F41: of:=[.E41]-273 -> 26.6306617636062 | G41: of:=[.A41]*330/16384-[.$E41]*[.$E$2]+[.$F$2]-273 -> 16.8103752267854 | H41: of:=[.B41]*330/16384-[.$E41]*[.$E$2]+[.$F$2]-273 -> 28.5529289377229 | I41: of:=[.C41]*330/16384-[.$E41]*[.$E$2]+[.$F$2]-273 -> 19.5697746408479
A42: 15054 | B42: 15621 | C42: 15181 | D42: 6577 | E42: of:=1 / ( (LN([.D42])-LN([.$B$2])) / [.$C$2] + 1 / [.$A$2]) -> 299.630661763606 | F42: of:=[.E42]-273 -> 26.6306617636062 | G42: of:=[.A42]*330/16384-[.$E42]*[.$E$2]+[.$F$2]-273 -> 17.0319328439729 | H42: of:=[.B42]*330/16384-[.$E42]*[.$E$2]+[.$F$2]-273 -> 28.4522209299104 | I42: of:=[.C42]*330/16384-[.$E42]*[.$E$2]+[.$F$2]-273 -> 19.5899162424104
A43: 15026 | B43: 15673 | C43: 15249 | D43: 6574 | E43: of:=1 / ( (LN([.D43])-LN([.$B$2])) / [.$C$2] + 1 / [.$A$2]) -> 299.835604221377 | F43: of:=[.E43]-273 -> 26.8356042213771 | G43: of:=[.A43]*330/16384-[.$E43]*[.$E$2]+[.$F$2]-273 -> 16.7810397382535 | H43: of:=[.B43]*330/16384-[.$E43]*[.$E$2]+[.$F$2]-273 -> 29.812655949191 | I43: of:=[.C43]*330/16384-[.$E43]*[.$E$2]+[.$F$2]-273 -> 21.272616886691
A44: 15038 | B44: 15671 | C44: 15244 | D44: 6576 | E44: of:=1 / ( (LN([.D44])-LN([.$B$2])) / [.$C$2] + 1 / [.$A$2]) -> 299.698934393587 | F44: of:=[.E44]-273 -> 26.6989343935875 | G44: of:=[.A44]*330/16384-[.$E44]*[.$E$2]+[.$F$2]-273 -> 16.8139610347133 | H44: of:=[.B44]*330/16384-[.$E44]*[.$E$2]+[.$F$2]-273 -> 29.5635948237758 | I44: of:=[.C44]*330/16384-[.$E44]*[.$E$2]+[.$F$2]-273 -> 20.9631309565883
A45: 15033 | B45: 15670 | C45: 15237 | D45: 6576 | E45: of:=1 / ( (LN([.D45])-LN([.$B$2])) / [.$C$2] + 1 / [.$A$2]) -> 299.698934393587 | F45: of:=[.E45]-273 -> 26.6989343935875 | G45: of:=[.A45]*330/16384-[.$E45]*[.$E$2]+[.$F$2]-273 -> 16.7132530269008 | H45: of:=[.B45]*330/16384-[.$E45]*[.$E$2]+[.$F$2]-273 -> 29.5434532222133 | I45: of:=[.C45]*330/16384-[.$E45]*[.$E$2]+[.$F$2]-273 -> 20.8221397456508
A46: 15038 | B46: 15668 | C46: 15240 | D46: 6576 | E46: of:=1 / ( (LN([.D46])-LN([.$B$2])) / [.$C$2] + 1 / [.$A$2]) -> 299.698934393587 | F46: of:=[.E46]-273 -> 26.6989343935875 | G46: of:=[.A46]*330/16384-[.$E46]*[.$E$2]+[.$F$2]-273 -> 16.8139610347133 | H46: of:=[.B46]*330/16384-[.$E46]*[.$E$2]+[.$F$2]-273 -> 29.5031700190883 | I46: of:=[.C46]*330/16384-[.$E46]*[.$E$2]+[.$F$2]-273 -> 20.8825645503383
A47: 15048 | B47: 15663 | C47: 15249 | D47: 6577 | E47: of:=1 / ( (LN([.D47])-LN([.$B$2])) / [.$C$2] + 1 / [.$A$2]) -> 299.630661763606 | F47: of:=[.E47]-273 -> 26.6306617636062 | G47: of:=[.A47]*330/16384-[.$E47]*[.$E$2]+[.$F$2]-273 -> 16.9110832345979 | H47: of:=[.B47]*330/16384-[.$E47]*[.$E$2]+[.$F$2]-273 -> 29.2981681955354 | I47: of:=[.C47]*330/16384-[.$E47]*[.$E$2]+[.$F$2]-273 -> 20.9595451486604
A48: 15044 | B48: 15664 | C48: 15228 | D48: 6577 | E48: of:=1 / ( (LN([.D48])-LN([.$B$2])) / [.$C$2] + 1 / [.$A$2]) -> 299.630661763606 | F48: of:=[.E48]-273 -> 26.6306617636062 | G48: of:=[.A48]*330/16384-[.$E48]*[.$E$2]+[.$F$2]-273 -> 16.8305168283479 | H48: of:=[.B48]*330/16384-[.$E48]*[.$E$2]+[.$F$2]-273 -> 29.3183097970979 | I48: of:=[.C48]*330/16384-[.$E48]*[.$E$2]+[.$F$2]-273 -> 20.5365715158479
A49: 15054 | B49: 15658 | C49: 15236 | D49: 6577 | E49: of:=1 / ( (LN([.D49])-LN([.$B$2])) / [.$C$2] + 1 / [.$A$2]) -> 299.630661763606 | F49: of:=[.E49]-273 -> 26.6306617636062 | G49: of:=[.A49]*330/16384-[.$E49]*[.$E$2]+[.$F$2]-273 -> 17.0319328439729 | H49: of:=[.B49]*330/16384-[.$E49]*[.$E$2]+[.$F$2]-273 -> 29.1974601877229 | I49: of:=[.C49]*330/16384-[.$E49]*[.$E$2]+[.$F$2]-273 -> 20.6977043283479
A50: 15053 | B50: 15664 | C50: 15227 | D50: 6577 | E50: of:=1 / ( (LN([.D50])-LN([.$B$2])) / [.$C$2] + 1 / [.$A$2]) -> 299.630661763606 | F50: of:=[.E50]-273 -> 26.6306617636062 | G50: of:=[.A50]*330/16384-[.$E50]*[.$E$2]+[.$F$2]-273 -> 17.0117912424104 | H50: of:=[.B50]*330/16384-[.$E50]*[.$E$2]+[.$F$2]-273 -> 29.3183097970979 | I50: of:=[.C50]*330/16384-[.$E50]*[.$E$2]+[.$F$2]-273 -> 20.5164299142854
A51: 15052 | B51: 15664 | C51: 15233 | D51: 6576 | E51: of:=1 / ( (LN([.D51])-LN([.$B$2])) / [.$C$2] + 1 / [.$A$2]) -> 299.698934393587 | F51: of:=[.E51]-273 -> 26.6989343935875 | G51: of:=[.A51]*330/16384-[.$E51]*[.$E$2]+[.$F$2]-273 -> 17.0959434565883 | H51: of:=[.B51]*330/16384-[.$E51]*[.$E$2]+[.$F$2]-273 -> 29.4226036128383 | I51: of:=[.C51]*330/16384-[.$E51]*[.$E$2]+[.$F$2]-273 -> 20.7415733394008
A52: 15042 | B52: 15656 | C52: 15226 | D52: 6576 | E52: of:=1 / ( (LN([.D52])-LN([.$B$2])) / [.$C$2] + 1 / [.$A$2]) -> 299.698934393587 | F52: of:=[.E52]-273 -> 26.6989343935875 | G52: of:=[.A52]*330/16384-[.$E52]*[.$E$2]+[.$F$2]-273 -> 16.8945274409633 | H52: of:=[.B52]*330/16384-[.$E52]*[.$E$2]+[.$F$2]-273 -> 29.2614708003383 | I52: of:=[.C52]*330/16384-[.$E52]*[.$E$2]+[.$F$2]-273 -> 20.6005821284633
A53: 15058 | B53: 15656 | C53: 15228 | D53: 6576 | E53: of:=1 / ( (LN([.D53])-LN([.$B$2])) / [.$C$2] + 1 / [.$A$2]) -> 299.698934393587 | F53: of:=[.E53]-273 -> 26.6989343935875 | G53: of:=[.A53]*330/16384-[.$E53]*[.$E$2]+[.$F$2]-273 -> 17.2167930659633 | H53: of:=[.B53]*330/16384-[.$E53]*[.$E$2]+[.$F$2]-273 -> 29.2614708003383 | I53: of:=[.C53]*330/16384-[.$E53]*[.$E$2]+[.$F$2]-273 -> 20.6408653315883
A54: 15053 | B54: 15657 | C54: 15214 | D54: 6576 | E54: of:=1 / ( (LN([.D54])-LN([.$B$2])) / [.$C$2] + 1 / [.$A$2]) -> 299.698934393587 | F54: of:=[.E54]-273 -> 26.6989343935875 | G54: of:=[.A54]*330/16384-[.$E54]*[.$E$2]+[.$F$2]-273 -> 17.1160850581508 | H54: of:=[.B54]*330/16384-[.$E54]*[.$E$2]+[.$F$2]-273 -> 29.2816124019008 | I54: of:=[.C54]*330/16384-[.$E54]*[.$E$2]+[.$F$2]-273 -> 20.3588829097133
A55: 15063 | B55: 15651 | C55: 15219 | D55: 6576 | E55: of:=1 / ( (LN([.D55])-LN([.$B$2])) / [.$C$2] + 1 / [.$A$2]) -> 299.698934393587 | F55: of:=[.E55]-273 -> 26.6989343935875 | G55: of:=[.A55]*330/16384-[.$E55]*[.$E$2]+[.$F$2]-273 -> 17.3175010737758 | H55: of:=[.B55]*330/16384-[.$E55]*[.$E$2]+[.$F$2]-273 -> 29.1607627925258 | I55: of:=[.C55]*330/16384-[.$E55]*[.$E$2]+[.$F$2]-273 -> 20.4595909175258
A56: 15047 | B56: 15652 | C56: 15217 | D56: 6577 | E56: of:=1 / ( (LN([.D56])-LN([.$B$2])) / [.$C$2] + 1 / [.$A$2]) -> 299.630661763606 | F56: of:=[.E56]-273 -> 26.6306617636062 | G56: of:=[.A56]*330/16384-[.$E56]*[.$E$2]+[.$F$2]-273 -> 16.8909416330354 | H56: of:=[.B56]*330/16384-[.$E56]*[.$E$2]+[.$F$2]-273 -> 29.0766105783479 | I56: of:=[.C56]*330/16384-[.$E56]*[.$E$2]+[.$F$2]-273 -> 20.3150138986604
A57: 15056 | B57: 15647 | C57: 15214 | D57: 6577 | E57: of:=1 / ( (LN([.D57])-LN([.$B$2])) / [.$C$2] + 1 / [.$A$2]) -> 299.630661763606 | F57: of:=[.E57]-273 -> 26.6306617636062 | G57: of:=[.A57]*330/16384-[.$E57]*[.$E$2]+[.$F$2]-273 -> 17.0722160470979 | H57: of:=[.B57]*330/16384-[.$E57]*[.$E$2]+[.$F$2]-273 -> 28.9759025705354 | I57: of:=[.C57]*330/16384-[.$E57]*[.$E$2]+[.$F$2]-273 -> 20.2545890939729
A58: 15054 | B58: 15652 | C58: 15214 | D58: 6577 | E58: of:=1 / ( (LN([.D58])-LN([.$B$2])) / [.$C$2] + 1 / [.$A$2]) -> 299.630661763606 | F58: of:=[.E58]-273 -> 26.6306617636062 | G58: of:=[.A58]*330/16384-[.$E58]*[.$E$2]+[.$F$2]-273 -> 17.0319328439729 | H58: of:=[.B58]*330/16384-[.$E58]*[.$E$2]+[.$F$2]-273 -> 29.0766105783479 | I58: of:=[.C58]*330/16384-[.$E58]*[.$E$2]+[.$F$2]-273 -> 20.2545890939729
A59: 15060 | B59: 15644 | C59: 15213 | D59: 6577 | E59: of:=1 / ( (LN([.D59])-LN([.$B$2])) / [.$C$2] + 1 / [.$A$2]) -> 299.630661763606 | F59: of:=[.E59]-273 -> 26.6306617636062 | G59: of:=[.A59]*330/16384-[.$E59]*[.$E$2]+[.$F$2]-273 -> 17.1527824533479 | H59: of:=[.B59]*330/16384-[.$E59]*[.$E$2]+[.$F$2]-273 -> 28.9154777658479 | I59: of:=[.C59]*330/16384-[.$E59]*[.$E$2]+[.$F$2]-273 -> 20.2344474924104
A60: 15068 | B60: 15646 | C60: 15210 | D60: 6576 | E60: of:=1 / ( (LN([.D60])-LN([.$B$2])) / [.$C$2] + 1 / [.$A$2]) -> 299.698934393587 | F60: of:=[.E60]-273 -> 26.6989343935875 | G60: of:=[.A60]*330/16384-[.$E60]*[.$E$2]+[.$F$2]-273 -> 17.4182090815883 | H60: of:=[.B60]*330/16384-[.$E60]*[.$E$2]+[.$F$2]-273 -> 29.0600547847133 | I60: of:=[.C60]*330/16384-[.$E60]*[.$E$2]+[.$F$2]-273 -> 20.2783165034633
A61: 15060 | B61: 15643 | C61: 15200 | D61: 6576 | E61: of:=1 / ( (LN([.D61])-LN([.$B$2])) / [.$C$2] + 1 / [.$A$2]) -> 299.698934393587 | F61: of:=[.E61]-273 -> 26.6989343935875 | G61: of:=[.A61]*330/16384-[.$E61]*[.$E$2]+[.$F$2]-273 -> 17.2570762690883 | H61: of:=[.B61]*330/16384-[.$E61]*[.$E$2]+[.$F$2]-273 -> 28.9996299800258 | I61: of:=[.C61]*330/16384-[.$E61]*[.$E$2]+[.$F$2]-273 -> 20.0769004878383
A62: 15042 | B62: 15683 | C62: 15241 | D62: 6573 | E62: of:=1 / ( (LN([.D62])-LN([.$B$2])) / [.$C$2] + 1 / [.$A$2]) -> 299.90400149655 | F62: of:=[.E62]-273 -> 26.9040014965502 | G62: of:=[.A62]*330/16384-[.$E62]*[.$E$2]+[.$F$2]-273 -> 17.207789587986 | H62: of:=[.B62]*330/16384-[.$E62]*[.$E$2]+[.$F$2]-273 -> 30.1185561895485 | I62: of:=[.C62]*330/16384-[.$E62]*[.$E$2]+[.$F$2]-273 -> 21.2159682989235
A63: 15039 | B63: 15683 | C63: 15238 | D63: 6575 | E63: of:=1 / ( (LN([.D63])-LN([.$B$2])) / [.$C$2] + 1 / [.$A$2]) -> 299.767248533292 | F63: of:=[.E63]-273 -> 26.767248533292 | G63: of:=[.A63]*330/16384-[.$E63]*[.$E$2]+[.$F$2]-273 -> 16.9384598626016 | H63: of:=[.B63]*330/16384-[.$E63]*[.$E$2]+[.$F$2]-273 -> 29.9096512688516 | I63: of:=[.C63]*330/16384-[.$E63]*[.$E$2]+[.$F$2]-273 -> 20.9466385735391
A64: 15034 | B64: 15673 | C64: 15238 | D64: 6575 | E64: of:=1 / ( (LN([.D64])-LN([.$B$2])) / [.$C$2] + 1 / [.$A$2]) -> 299.767248533292 | F64: of:=[.E64]-273 -> 26.767248533292 | G64: of:=[.A64]*330/16384-[.$E64]*[.$E$2]+[.$F$2]-273 -> 16.8377518547891 | H64: of:=[.B64]*330/16384-[.$E64]*[.$E$2]+[.$F$2]-273 -> 29.7082352532266 | I64: of:=[.C64]*330/16384-[.$E64]*[.$E$2]+[.$F$2]-273 -> 20.9466385735391
A65: 15037 | B65: 15675 | C65: 15232 | D65: 6576 | E65: of:=1 / ( (LN([.D65])-LN([.$B$2])) / [.$C$2] + 1 / [.$A$2]) -> 299.698934393587 | F65: of:=[.E65]-273 -> 26.6989343935875 | G65: of:=[.A65]*330/16384-[.$E65]*[.$E$2]+[.$F$2]-273 -> 16.7938194331508 | H65: of:=[.B65]*330/16384-[.$E65]*[.$E$2]+[.$F$2]-273 -> 29.6441612300258 | I65: of:=[.C65]*330/16384-[.$E65]*[.$E$2]+[.$F$2]-273 -> 20.7214317378383
A66: 15041 | B66: 15675 | C66: 15233 | D66: 6576 | E66: of:=1 / ( (LN([.D66])-LN([.$B$2])) / [.$C$2] + 1 / [.$A$2]) -> 299.698934393587 | F66: of:=[.E66]-273 -> 26.6989343935875 | G66: of:=[.A66]*330/16384-[.$E66]*[.$E$2]+[.$F$2]-273 -> 16.8743858394008 | H66: of:=[.B66]*330/16384-[.$E66]*[.$E$2]+[.$F$2]-273 -> 29.6441612300258 | I66: of:=[.C66]*330/16384-[.$E66]*[.$E$2]+[.$F$2]-273 -> 20.7415733394008
A67: 15033 | B67: 15667 | C67: 15232 | D67: 6576 | E67: of:=1 / ( (LN([.D67])-LN([.$B$2])) / [.$C$2] + 1 / [.$A$2]) -> 299.698934393587 | F67: of:=[.E67]-273 -> 26.6989343935875 | G67: of:=[.A67]*330/16384-[.$E67]*[.$E$2]+[.$F$2]-273 -> 16.7132530269008 | H67: of:=[.B67]*330/16384-[.$E67]*[.$E$2]+[.$F$2]-273 -> 29.4830284175258 | I67: of:=[.C67]*330/16384-[.$E67]*[.$E$2]+[.$F$2]-273 -> 20.7214317378383
A68: 15037 | B68: 15667 | C68: 15226 | D68: 6576 | E68: of:=1 / ( (LN([.D68])-LN([.$B$2])) / [.$C$2] + 1 / [.$A$2]) -> 299.698934393587 | F68: of:=[.E68]-273 -> 26.6989343935875 | G68: of:=[.A68]*330/16384-[.$E68]*[.$E$2]+[.$F$2]-273 -> 16.7938194331508 | H68: of:=[.B68]*330/16384-[.$E68]*[.$E$2]+[.$F$2]-273 -> 29.4830284175258 | I68: of:=[.C68]*330/16384-[.$E68]*[.$E$2]+[.$F$2]-273 -> 20.6005821284633
A69: 15051 | B69: 15667 | C69: 15234 | D69: 6576 | E69: of:=1 / ( (LN([.D69])-LN([.$B$2])) / [.$C$2] + 1 / [.$A$2]) -> 299.698934393587 | F69: of:=[.E69]-273 -> 26.6989343935875 | G69: of:=[.A69]*330/16384-[.$E69]*[.$E$2]+[.$F$2]-273 -> 17.0758018550258 | H69: of:=[.B69]*330/16384-[.$E69]*[.$E$2]+[.$F$2]-273 -> 29.4830284175258 | I69: of:=[.C69]*330/16384-[.$E69]*[.$E$2]+[.$F$2]-273 -> 20.7617149409633
A70: 15040 | B70: 15661 | C70: 15230 | D70: 6576 | E70: of:=1 / ( (LN([.D70])-LN([.$B$2])) / [.$C$2] + 1 / [.$A$2]) -> 299.698934393587 | F70: of:=[.E70]-273 -> 26.6989343935875 | G70: of:=[.A70]*330/16384-[.$E70]*[.$E$2]+[.$F$2]-273 -> 16.8542442378383 | H70: of:=[.B70]*330/16384-[.$E70]*[.$E$2]+[.$F$2]-273 -> 29.3621788081508 | I70: of:=[.C70]*330/16384-[.$E70]*[.$E$2]+[.$F$2]-273 -> 20.6811485347133
A71: 15037 | B71: 15662 | C71: 15226 | D71: 6575 | E71: of:=1 / ( (LN([.D71])-LN([.$B$2])) / [.$C$2] + 1 / [.$A$2]) -> 299.767248533292 | F71: of:=[.E71]-273 -> 26.767248533292 | G71: of:=[.A71]*330/16384-[.$E71]*[.$E$2]+[.$F$2]-273 -> 16.8981766594766 | H71: of:=[.B71]*330/16384-[.$E71]*[.$E$2]+[.$F$2]-273 -> 29.4866776360391 | I71: of:=[.C71]*330/16384-[.$E71]*[.$E$2]+[.$F$2]-273 -> 20.7049393547891
A72: 15045 | B72: 15663 | C72: 15219 | D72: 6575 | E72: of:=1 / ( (LN([.D72])-LN([.$B$2])) / [.$C$2] + 1 / [.$A$2]) -> 299.767248533292 | F72: of:=[.E72]-273 -> 26.767248533292 | G72: of:=[.A72]*330/16384-[.$E72]*[.$E$2]+[.$F$2]-273 -> 17.0593094719766 | H72: of:=[.B72]*330/16384-[.$E72]*[.$E$2]+[.$F$2]-273 -> 29.5068192376016 | I72: of:=[.C72]*330/16384-[.$E72]*[.$E$2]+[.$F$2]-273 -> 20.5639481438516
A73: 15032 | B73: 15667 | C73: 15211 | D73: 6575 | E73: of:=1 / ( (LN([.D73])-LN([.$B$2])) / [.$C$2] + 1 / [.$A$2]) -> 299.767248533292 | F73: of:=[.E73]-273 -> 26.767248533292 | G73: of:=[.A73]*330/16384-[.$E73]*[.$E$2]+[.$F$2]-273 -> 16.7974686516641 | H73: of:=[.B73]*330/16384-[.$E73]*[.$E$2]+[.$F$2]-273 -> 29.5873856438516 | I73: of:=[.C73]*330/16384-[.$E73]*[.$E$2]+[.$F$2]-273 -> 20.4028153313516
A74: 15042 | B74: 15662 | C74: 15216 | D74: 6577 | E74: of:=1 / ( (LN([.D74])-LN([.$B$2])) / [.$C$2] + 1 / [.$A$2]) -> 299.630661763606 | F74: of:=[.E74]-273 -> 26.6306617636062 | G74: of:=[.A74]*330/16384-[.$E74]*[.$E$2]+[.$F$2]-273 -> 16.7902336252229 | H74: of:=[.B74]*330/16384-[.$E74]*[.$E$2]+[.$F$2]-273 -> 29.2780265939729 | I74: of:=[.C74]*330/16384-[.$E74]*[.$E$2]+[.$F$2]-273 -> 20.2948722970979
A75: 15042 | B75: 15658 | C75: 15225 | D75: 6576 | E75: of:=1 / ( (LN([.D75])-LN([.$B$2])) / [.$C$2] + 1 / [.$A$2]) -> 299.698934393587 | F75: of:=[.E75]-273 -> 26.6989343935875 | G75: of:=[.A75]*330/16384-[.$E75]*[.$E$2]+[.$F$2]-273 -> 16.8945274409633 | H75: of:=[.B75]*330/16384-[.$E75]*[.$E$2]+[.$F$2]-273 -> 29.3017540034633 | I75: of:=[.C75]*330/16384-[.$E75]*[.$E$2]+[.$F$2]-273 -> 20.5804405269008
A76: 15049 | B76: 15656 | C76: 15213 | D76: 6575 | E76: of:=1 / ( (LN([.D76])-LN([.$B$2])) / [.$C$2] + 1 / [.$A$2]) -> 299.767248533292 | F76: of:=[.E76]-273 -> 26.767248533292 | G76: of:=[.A76]*330/16384-[.$E76]*[.$E$2]+[.$F$2]-273 -> 17.1398758782266 | H76: of:=[.B76]*330/16384-[.$E76]*[.$E$2]+[.$F$2]-273 -> 29.3658280266641 | I76: of:=[.C76]*330/16384-[.$E76]*[.$E$2]+[.$F$2]-273 -> 20.4430985344766
A77: 15054 | B77: 15649 | C77: 15214 | D77: 6575 | E77: of:=1 / ( (LN([.D77])-LN([.$B$2])) / [.$C$2] + 1 / [.$A$2]) -> 299.767248533292 | F77: of:=[.E77]-273 -> 26.767248533292 | G77: of:=[.A77]*330/16384-[.$E77]*[.$E$2]+[.$F$2]-273 -> 17.2405838860391 | H77: of:=[.B77]*330/16384-[.$E77]*[.$E$2]+[.$F$2]-273 -> 29.2248368157266 | I77: of:=[.C77]*330/16384-[.$E77]*[.$E$2]+[.$F$2]-273 -> 20.4632401360391
A78: 15049 | B78: 15650 | C78: 15207 | D78: 6576 | E78: of:=1 / ( (LN([.D78])-LN([.$B$2])) / [.$C$2] + 1 / [.$A$2]) -> 299.698934393587 | F78: of:=[.E78]-273 -> 26.6989343935875 | G78: of:=[.A78]*330/16384-[.$E78]*[.$E$2]+[.$F$2]-273 -> 17.0355186519008 | H78: of:=[.B78]*330/16384-[.$E78]*[.$E$2]+[.$F$2]-273 -> 29.1406211909633 | I78: of:=[.C78]*330/16384-[.$E78]*[.$E$2]+[.$F$2]-273 -> 20.2178916987758
A79: 15041 | B79: 15651 | C79: 15201 | D79: 6575 | E79: of:=1 / ( (LN([.D79])-LN([.$B$2])) / [.$C$2] + 1 / [.$A$2]) -> 299.767248533292 | F79: of:=[.E79]-273 -> 26.767248533292 | G79: of:=[.A79]*330/16384-[.$E79]*[.$E$2]+[.$F$2]-273 -> 16.9787430657266 | H79: of:=[.B79]*330/16384-[.$E79]*[.$E$2]+[.$F$2]-273 -> 29.2651200188516 | I79: of:=[.C79]*330/16384-[.$E79]*[.$E$2]+[.$F$2]-273 -> 20.2013993157266
A80: 15046 | B80: 15655 | C80: 15206 | D80: 6576 | E80: of:=1 / ( (LN([.D80])-LN([.$B$2])) / [.$C$2] + 1 / [.$A$2]) -> 299.698934393587 | F80: of:=[.E80]-273 -> 26.6989343935875 | G80: of:=[.A80]*330/16384-[.$E80]*[.$E$2]+[.$F$2]-273 -> 16.9750938472133 | H80: of:=[.B80]*330/16384-[.$E80]*[.$E$2]+[.$F$2]-273 -> 29.2413291987758 | I80: of:=[.C80]*330/16384-[.$E80]*[.$E$2]+[.$F$2]-273 -> 20.1977500972133
A81: 15034 | B81: 15677 | C81: 15242 | D81: 6573 | E81: of:=1 / ( (LN([.D81])-LN([.$B$2])) / [.$C$2] + 1 / [.$A$2]) -> 299.90400149655 | F81: of:=[.E81]-273 -> 26.9040014965502 | G81: of:=[.A81]*330/16384-[.$E81]*[.$E$2]+[.$F$2]-273 -> 17.046656775486 | H81: of:=[.B81]*330/16384-[.$E81]*[.$E$2]+[.$F$2]-273 -> 29.9977065801735 | I81: of:=[.C81]*330/16384-[.$E81]*[.$E$2]+[.$F$2]-273 -> 21.236109900486
A82: 15043 | B82: 15676 | C82: 15241 | D82: 6574 | E82: of:=1 / ( (LN([.D82])-LN([.$B$2])) / [.$C$2] + 1 / [.$A$2]) -> 299.835604221377 | F82: of:=[.E82]-273 -> 26.8356042213771 | G82: of:=[.A82]*330/16384-[.$E82]*[.$E$2]+[.$F$2]-273 -> 17.123446964816 | H82: of:=[.B82]*330/16384-[.$E82]*[.$E$2]+[.$F$2]-273 -> 29.8730807538785 | I82: of:=[.C82]*330/16384-[.$E82]*[.$E$2]+[.$F$2]-273 -> 21.111484074191
A83: 15046 | B83: 15680 | C83: 15239 | D83: 6574 | E83: of:=1 / ( (LN([.D83])-LN([.$B$2])) / [.$C$2] + 1 / [.$A$2]) -> 299.835604221377 | F83: of:=[.E83]-273 -> 26.8356042213771 | G83: of:=[.A83]*330/16384-[.$E83]*[.$E$2]+[.$F$2]-273 -> 17.1838717695035 | H83: of:=[.B83]*330/16384-[.$E83]*[.$E$2]+[.$F$2]-273 -> 29.9536471601285 | I83: of:=[.C83]*330/16384-[.$E83]*[.$E$2]+[.$F$2]-273 -> 21.071200871066
A84: 15039 | B84: 15672 | C84: 15240 | D84: 6575 | E84: of:=1 / ( (LN([.D84])-LN([.$B$2])) / [.$C$2] + 1 / [.$A$2]) -> 299.767248533292 | F84: of:=[.E84]-273 -> 26.767248533292 | G84: of:=[.A84]*330/16384-[.$E84]*[.$E$2]+[.$F$2]-273 -> 16.9384598626016 | H84: of:=[.B84]*330/16384-[.$E84]*[.$E$2]+[.$F$2]-273 -> 29.6880936516641 | I84: of:=[.C84]*330/16384-[.$E84]*[.$E$2]+[.$F$2]-273 -> 20.9869217766641
A85: 15038 | B85: 15674 | C85: 15244 | D85: 6575 | E85: of:=1 / ( (LN([.D85])-LN([.$B$2])) / [.$C$2] + 1 / [.$A$2]) -> 299.767248533292 | F85: of:=[.E85]-273 -> 26.767248533292 | G85: of:=[.A85]*330/16384-[.$E85]*[.$E$2]+[.$F$2]-273 -> 16.9183182610391 | H85: of:=[.B85]*330/16384-[.$E85]*[.$E$2]+[.$F$2]-273 -> 29.7283768547891 | I85: of:=[.C85]*330/16384-[.$E85]*[.$E$2]+[.$F$2]-273 -> 21.0674881829141
A86: 15045 | B86: 15668 | C86: 15246 | D86: 6576 | E86: of:=1 / ( (LN([.D86])-LN([.$B$2])) / [.$C$2] + 1 / [.$A$2]) -> 299.698934393587 | F86: of:=[.E86]-273 -> 26.6989343935875 | G86: of:=[.A86]*330/16384-[.$E86]*[.$E$2]+[.$F$2]-273 -> 16.9549522456508 | H86: of:=[.B86]*330/16384-[.$E86]*[.$E$2]+[.$F$2]-273 -> 29.5031700190883 | I86: of:=[.C86]*330/16384-[.$E86]*[.$E$2]+[.$F$2]-273 -> 21.0034141597133
A87: 15035 | B87: 15672 | C87: 15245 | D87: 6575 | E87: of:=1 / ( (LN([.D87])-LN([.$B$2])) / [.$C$2] + 1 / [.$A$2]) -> 299.767248533292 | F87: of:=[.E87]-273 -> 26.767248533292 | G87: of:=[.A87]*330/16384-[.$E87]*[.$E$2]+[.$F$2]-273 -> 16.8578934563516 | H87: of:=[.B87]*330/16384-[.$E87]*[.$E$2]+[.$F$2]-273 -> 29.6880936516641 | I87: of:=[.C87]*330/16384-[.$E87]*[.$E$2]+[.$F$2]-273 -> 21.0876297844766
A88: 15049 | B88: 15669 | C88: 15233 | D88: 6575 | E88: of:=1 / ( (LN([.D88])-LN([.$B$2])) / [.$C$2] + 1 / [.$A$2]) -> 299.767248533292 | F88: of:=[.E88]-273 -> 26.767248533292 | G88: of:=[.A88]*330/16384-[.$E88]*[.$E$2]+[.$F$2]-273 -> 17.1398758782266 | H88: of:=[.B88]*330/16384-[.$E88]*[.$E$2]+[.$F$2]-273 -> 29.6276688469766 | I88: of:=[.C88]*330/16384-[.$E88]*[.$E$2]+[.$F$2]-273 -> 20.8459305657266
A89: 15044 | B89: 15665 | C89: 15232 | D89: 6575 | E89: of:=1 / ( (LN([.D89])-LN([.$B$2])) / [.$C$2] + 1 / [.$A$2]) -> 299.767248533292 | F89: of:=[.E89]-273 -> 26.767248533292 | G89: of:=[.A89]*330/16384-[.$E89]*[.$E$2]+[.$F$2]-273 -> 17.0391678704141 | H89: of:=[.B89]*330/16384-[.$E89]*[.$E$2]+[.$F$2]-273 -> 29.5471024407266 | I89: of:=[.C89]*330/16384-[.$E89]*[.$E$2]+[.$F$2]-273 -> 20.8257889641641
A90: 15048 | B90: 15668 | C90: 15228 | D90: 6574 | E90: of:=1 / ( (LN([.D90])-LN([.$B$2])) / [.$C$2] + 1 / [.$A$2]) -> 299.835604221377 | F90: of:=[.E90]-273 -> 26.8356042213771 | G90: of:=[.A90]*330/16384-[.$E90]*[.$E$2]+[.$F$2]-273 -> 17.2241549726285 | H90: of:=[.B90]*330/16384-[.$E90]*[.$E$2]+[.$F$2]-273 -> 29.7119479413785 | I90: of:=[.C90]*330/16384-[.$E90]*[.$E$2]+[.$F$2]-273 -> 20.8496432538785
A91: 15046 | B91: 15665 | C91: 15237 | D91: 6575 | E91: of:=1 / ( (LN([.D91])-LN([.$B$2])) / [.$C$2] + 1 / [.$A$2]) -> 299.767248533292 | F91: of:=[.E91]-273 -> 26.767248533292 | G91: of:=[.A91]*330/16384-[.$E91]*[.$E$2]+[.$F$2]-273 -> 17.0794510735391 | H91: of:=[.B91]*330/16384-[.$E91]*[.$E$2]+[.$F$2]-273 -> 29.5471024407266 | I91: of:=[.C91]*330/16384-[.$E91]*[.$E$2]+[.$F$2]-273 -> 20.9264969719766
A92: 15045 | B92: 15660 | C92: 15228 | D92: 6575 | E92: of:=1 / ( (LN([.D92])-LN([.$B$2])) / [.$C$2] + 1 / [.$A$2]) -> 299.767248533292 | F92: of:=[.E92]-273 -> 26.767248533292 | G92: of:=[.A92]*330/16384-[.$E92]*[.$E$2]+[.$F$2]-273 -> 17.0593094719766 | H92: of:=[.B92]*330/16384-[.$E92]*[.$E$2]+[.$F$2]-273 -> 29.4463944329141 | I92: of:=[.C92]*330/16384-[.$E92]*[.$E$2]+[.$F$2]-273 -> 20.7452225579141
A93: 15052 | B93: 15658 | C93: 15222 | D93: 6575 | E93: of:=1 / ( (LN([.D93])-LN([.$B$2])) / [.$C$2] + 1 / [.$A$2]) -> 299.767248533292 | F93: of:=[.E93]-273 -> 26.767248533292 | G93: of:=[.A93]*330/16384-[.$E93]*[.$E$2]+[.$F$2]-273 -> 17.2003006829141 | H93: of:=[.B93]*330/16384-[.$E93]*[.$E$2]+[.$F$2]-273 -> 29.4061112297891 | I93: of:=[.C93]*330/16384-[.$E93]*[.$E$2]+[.$F$2]-273 -> 20.6243729485391
A94: 15053 | B94: 15655 | C94: 15225 | D94: 6574 | E94: of:=1 / ( (LN([.D94])-LN([.$B$2])) / [.$C$2] + 1 / [.$A$2]) -> 299.835604221377 | F94: of:=[.E94]-273 -> 26.8356042213771 | G94: of:=[.A94]*330/16384-[.$E94]*[.$E$2]+[.$F$2]-273 -> 17.324862980441 | H94: of:=[.B94]*330/16384-[.$E94]*[.$E$2]+[.$F$2]-273 -> 29.450107121066 | I94: of:=[.C94]*330/16384-[.$E94]*[.$E$2]+[.$F$2]-273 -> 20.789218449191
A95: 15059 | B95: 15659 | C95: 15225 | D95: 6574 | E95: of:=1 / ( (LN([.D95])-LN([.$B$2])) / [.$C$2] + 1 / [.$A$2]) -> 299.835604221377 | F95: of:=[.E95]-273 -> 26.8356042213771 | G95: of:=[.A95]*330/16384-[.$E95]*[.$E$2]+[.$F$2]-273 -> 17.445712589816 | H95: of:=[.B95]*330/16384-[.$E95]*[.$E$2]+[.$F$2]-273 -> 29.530673527316 | I95: of:=[.C95]*330/16384-[.$E95]*[.$E$2]+[.$F$2]-273 -> 20.789218449191
A96: 15055 | B96: 15659 | C96: 15220 | D96: 6575 | E96: of:=1 / ( (LN([.D96])-LN([.$B$2])) / [.$C$2] + 1 / [.$A$2]) -> 299.767248533292 | F96: of:=[.E96]-273 -> 26.767248533292 | G96: of:=[.A96]*330/16384-[.$E96]*[.$E$2]+[.$F$2]-273 -> 17.2607254876016 | H96: of:=[.B96]*330/16384-[.$E96]*[.$E$2]+[.$F$2]-273 -> 29.4262528313516 | I96: of:=[.C96]*330/16384-[.$E96]*[.$E$2]+[.$F$2]-273 -> 20.5840897454141
A97: 15060 | B97: 15654 | C97: 15227 | D97: 6575 | E97: of:=1 / ( (LN([.D97])-LN([.$B$2])) / [.$C$2] + 1 / [.$A$2]) -> 299.767248533292 | F97: of:=[.E97]-273 -> 26.767248533292 | G97: of:=[.A97]*330/16384-[.$E97]*[.$E$2]+[.$F$2]-273 -> 17.3614334954141 | H97: of:=[.B97]*330/16384-[.$E97]*[.$E$2]+[.$F$2]-273 -> 29.3255448235391 | I97: of:=[.C97]*330/16384-[.$E97]*[.$E$2]+[.$F$2]-273 -> 20.7250809563516
A98: 15044 | B98: 15663 | C98: 15218 | D98: 6575 | E98: of:=1 / ( (LN([.D98])-LN([.$B$2])) / [.$C$2] + 1 / [.$A$2]) -> 299.767248533292 | F98: of:=[.E98]-273 -> 26.767248533292 | G98: of:=[.A98]*330/16384-[.$E98]*[.$E$2]+[.$F$2]-273 -> 17.0391678704141 | H98: of:=[.B98]*330/16384-[.$E98]*[.$E$2]+[.$F$2]-273 -> 29.5068192376016 | I98: of:=[.C98]*330/16384-[.$E98]*[.$E$2]+[.$F$2]-273 -> 20.5438065422891
A99: 15050 | B99: 15658 | C99: 15214 | D99: 6574 | E99: of:=1 / ( (LN([.D99])-LN([.$B$2])) / [.$C$2] + 1 / [.$A$2]) -> 299.835604221377 | F99: of:=[.E99]-273 -> 26.8356042213771 | G99: of:=[.A99]*330/16384-[.$E99]*[.$E$2]+[.$F$2]-273 -> 17.2644381757535 | H99: of:=[.B99]*330/16384-[.$E99]*[.$E$2]+[.$F$2]-273 -> 29.5105319257535 | I99: of:=[.C99]*330/16384-[.$E99]*[.$E$2]+[.$F$2]-273 -> 20.5676608320035
A100: 15040 | B100: 15679 | C100: 15246 | D100: 6571 | E100: of:=1 / ( (LN([.D100])-LN([.$B$2])) / [.$C$2] + 1 / [.$A$2]) -> 300.040920963233 | F100: of:=[.E100]-273 -> 27.0409209632335 | G100: of:=[.A100]*330/16384-[.$E100]*[.$E$2]+[.$F$2]-273 -> 17.3766656575222 | H100: of:=[.B100]*330/16384-[.$E100]*[.$E$2]+[.$F$2]-273 -> 30.2471490559597 | I100: of:=[.C100]*330/16384-[.$E100]*[.$E$2]+[.$F$2]-273 -> 21.5258355793972
A101: 15028 | B101: 15674 | C101: 15233 | D101: 6574 | E101: of:=1 / ( (LN([.D101])-LN([.$B$2])) / [.$C$2] + 1 / [.$A$2]) -> 299.835604221377 | F101: of:=[.E101]-273 -> 26.8356042213771 | G101: of:=[.A101]*330/16384-[.$E101]*[.$E$2]+[.$F$2]-273 -> 16.8213229413785 | H101: of:=[.B101]*330/16384-[.$E101]*[.$E$2]+[.$F$2]-273 -> 29.8327975507535 | I101: of:=[.C101]*330/16384-[.$E101]*[.$E$2]+[.$F$2]-273 -> 20.950351261691
A102: 15040 | B102: 15674 | C102: 15227 | D102: 6573 | E102: of:=1 / ( (LN([.D102])-LN([.$B$2])) / [.$C$2] + 1 / [.$A$2]) -> 299.90400149655 | F102: of:=[.E102]-273 -> 26.9040014965502 | G102: of:=[.A102]*330/16384-[.$E102]*[.$E$2]+[.$F$2]-273 -> 17.167506384861 | H102: of:=[.B102]*330/16384-[.$E102]*[.$E$2]+[.$F$2]-273 -> 29.937281775486 | I102: of:=[.C102]*330/16384-[.$E102]*[.$E$2]+[.$F$2]-273 -> 20.9339858770485
A103: 15042 | B103: 15679 | C103: 15241 | D103: 6574 | E103: of:=1 / ( (LN([.D103])-LN([.$B$2])) / [.$C$2] + 1 / [.$A$2]) -> 299.835604221377 | F103: of:=[.E103]-273 -> 26.8356042213771 | G103: of:=[.A103]*330/16384-[.$E103]*[.$E$2]+[.$F$2]-273 -> 17.1033053632535 | H103: of:=[.B103]*330/16384-[.$E103]*[.$E$2]+[.$F$2]-273 -> 29.933505558566 | I103: of:=[.C103]*330/16384-[.$E103]*[.$E$2]+[.$F$2]-273 -> 21.111484074191
A104: 15036 | B104: 15681 | C104: 15223 | D104: 6574 | E104: of:=1 / ( (LN([.D104])-LN([.$B$2])) / [.$C$2] + 1 / [.$A$2]) -> 299.835604221377 | F104: of:=[.E104]-273 -> 26.8356042213771 | G104: of:=[.A104]*330/16384-[.$E104]*[.$E$2]+[.$F$2]-273 -> 16.9824557538785 | H104: of:=[.B104]*330/16384-[.$E104]*[.$E$2]+[.$F$2]-273 -> 29.973788761691 | I104: of:=[.C104]*330/16384-[.$E104]*[.$E$2]+[.$F$2]-273 -> 20.748935246066
A105: 15042 | B105: 15676 | C105: 15234 | D105: 6575 | E105: of:=1 / ( (LN([.D105])-LN([.$B$2])) / [.$C$2] + 1 / [.$A$2]) -> 299.767248533292 | F105: of:=[.E105]-273 -> 26.767248533292 | G105: of:=[.A105]*330/16384-[.$E105]*[.$E$2]+[.$F$2]-273 -> 16.9988846672891 | H105: of:=[.B105]*330/16384-[.$E105]*[.$E$2]+[.$F$2]-273 -> 29.7686600579141 | I105: of:=[.C105]*330/16384-[.$E105]*[.$E$2]+[.$F$2]-273 -> 20.8660721672891
A106: 15048 | B106: 15672 | C106: 15235 | D106: 6574 | E106: of:=1 / ( (LN([.D106])-LN([.$B$2])) / [.$C$2] + 1 / [.$A$2]) -> 299.835604221377 | F106: of:=[.E106]-273 -> 26.8356042213771 | G106: of:=[.A106]*330/16384-[.$E106]*[.$E$2]+[.$F$2]-273 -> 17.2241549726285 | H106: of:=[.B106]*330/16384-[.$E106]*[.$E$2]+[.$F$2]-273 -> 29.7925143476285 | I106: of:=[.C106]*330/16384-[.$E106]*[.$E$2]+[.$F$2]-273 -> 20.990634464816
A107: 15037 | B107: 15669 | C107: 15235 | D107: 6576 | E107: of:=1 / ( (LN([.D107])-LN([.$B$2])) / [.$C$2] + 1 / [.$A$2]) -> 299.698934393587 | F107: of:=[.E107]-273 -> 26.6989343935875 | G107: of:=[.A107]*330/16384-[.$E107]*[.$E$2]+[.$F$2]-273 -> 16.7938194331508 | H107: of:=[.B107]*330/16384-[.$E107]*[.$E$2]+[.$F$2]-273 -> 29.5233116206508 | I107: of:=[.C107]*330/16384-[.$E107]*[.$E$2]+[.$F$2]-273 -> 20.7818565425258
A108: 15047 | B108: 15670 | C108: 15228 | D108: 6574 | E108: of:=1 / ( (LN([.D108])-LN([.$B$2])) / [.$C$2] + 1 / [.$A$2]) -> 299.835604221377 | F108: of:=[.E108]-273 -> 26.8356042213771 | G108: of:=[.A108]*330/16384-[.$E108]*[.$E$2]+[.$F$2]-273 -> 17.204013371066 | H108: of:=[.B108]*330/16384-[.$E108]*[.$E$2]+[.$F$2]-273 -> 29.7522311445035 | I108: of:=[.C108]*330/16384-[.$E108]*[.$E$2]+[.$F$2]-273 -> 20.8496432538785
A109: 15056 | B109: 15672 | C109: 15224 | D109: 6574 | E109: of:=1 / ( (LN([.D109])-LN([.$B$2])) / [.$C$2] + 1 / [.$A$2]) -> 299.835604221377 | F109: of:=[.E109]-273 -> 26.8356042213771 | G109: of:=[.A109]*330/16384-[.$E109]*[.$E$2]+[.$F$2]-273 -> 17.3852877851285 | H109: of:=[.B109]*330/16384-[.$E109]*[.$E$2]+[.$F$2]-273 -> 29.7925143476285 | I109: of:=[.C109]*330/16384-[.$E109]*[.$E$2]+[.$F$2]-273 -> 20.7690768476285
A110: 15054 | B110: 15672 | C110: 15209 | D110: 6575 | E110: of:=1 / ( (LN([.D110])-LN([.$B$2])) / [.$C$2] + 1 / [.$A$2]) -> 299.767248533292 | F110: of:=[.E110]-273 -> 26.767248533292 | G110: of:=[.A110]*330/16384-[.$E110]*[.$E$2]+[.$F$2]-273 -> 17.2405838860391 | H110: of:=[.B110]*330/16384-[.$E110]*[.$E$2]+[.$F$2]-273 -> 29.6880936516641 | I110: of:=[.C110]*330/16384-[.$E110]*[.$E$2]+[.$F$2]-273 -> 20.3625321282266
A111: 15047 | B111: 15665 | C111: 15215 | D111: 6575 | E111: of:=1 / ( (LN([.D111])-LN([.$B$2])) / [.$C$2] + 1 / [.$A$2]) -> 299.767248533292 | F111: of:=[.E111]-273 -> 26.767248533292 | G111: of:=[.A111]*330/16384-[.$E111]*[.$E$2]+[.$F$2]-273 -> 17.0995926751016 | H111: of:=[.B111]*330/16384-[.$E111]*[.$E$2]+[.$F$2]-273 -> 29.5471024407266 | I111: of:=[.C111]*330/16384-[.$E111]*[.$E$2]+[.$F$2]-273 -> 20.4833817376016
A112: 15044 | B112: 15665 | C112: 15217 | D112: 6574 | E112: of:=1 / ( (LN([.D112])-LN([.$B$2])) / [.$C$2] + 1 / [.$A$2]) -> 299.835604221377 | F112: of:=[.E112]-273 -> 26.8356042213771 | G112: of:=[.A112]*330/16384-[.$E112]*[.$E$2]+[.$F$2]-273 -> 17.1435885663785 | H112: of:=[.B112]*330/16384-[.$E112]*[.$E$2]+[.$F$2]-273 -> 29.651523136691 | I112: of:=[.C112]*330/16384-[.$E112]*[.$E$2]+[.$F$2]-273 -> 20.628085636691
A113: 15044 | B113: 15670 | C113: 15213 | D113: 6575 | E113: of:=1 / ( (LN([.D113])-LN([.$B$2])) / [.$C$2] + 1 / [.$A$2]) -> 299.767248533292 | F113: of:=[.E113]-273 -> 26.767248533292 | G113: of:=[.A113]*330/16384-[.$E113]*[.$E$2]+[.$F$2]-273 -> 17.0391678704141 | H113: of:=[.B113]*330/16384-[.$E113]*[.$E$2]+[.$F$2]-273 -> 29.6478104485391 | I113: of:=[.C113]*330/16384-[.$E113]*[.$E$2]+[.$F$2]-273 -> 20.4430985344766
A114: 15055 | B114: 15656 | C114: 15213 | D114: 6574 | E114: of:=1 / ( (LN([.D114])-LN([.$B$2])) / [.$C$2] + 1 / [.$A$2]) -> 299.835604221377 | F114: of:=[.E114]-273 -> 26.8356042213771 | G114: of:=[.A114]*330/16384-[.$E114]*[.$E$2]+[.$F$2]-273 -> 17.365146183566 | H114: of:=[.B114]*330/16384-[.$E114]*[.$E$2]+[.$F$2]-273 -> 29.4702487226285 | I114: of:=[.C114]*330/16384-[.$E114]*[.$E$2]+[.$F$2]-273 -> 20.547519230441
A115: 15042 | B115: 15654 | C115: 15207 | D115: 6574 | E115: of:=1 / ( (LN([.D115])-LN([.$B$2])) / [.$C$2] + 1 / [.$A$2]) -> 299.835604221377 | F115: of:=[.E115]-273 -> 26.8356042213771 | G115: of:=[.A115]*330/16384-[.$E115]*[.$E$2]+[.$F$2]-273 -> 17.1033053632535 | H115: of:=[.B115]*330/16384-[.$E115]*[.$E$2]+[.$F$2]-273 -> 29.4299655195035 | I115: of:=[.C115]*330/16384-[.$E115]*[.$E$2]+[.$F$2]-273 -> 20.426669621066
A116: 15035 | B116: 15658 | C116: 15205 | D116: 6574 | E116: of:=1 / ( (LN([.D116])-LN([.$B$2])) / [.$C$2] + 1 / [.$A$2]) -> 299.835604221377 | F116: of:=[.E116]-273 -> 26.8356042213771 | G116: of:=[.A116]*330/16384-[.$E116]*[.$E$2]+[.$F$2]-273 -> 16.962314152316 | H116: of:=[.B116]*330/16384-[.$E116]*[.$E$2]+[.$F$2]-273 -> 29.5105319257535 | I116: of:=[.C116]*330/16384-[.$E116]*[.$E$2]+[.$F$2]-273 -> 20.386386417941
A117: 15048 | B117: 15662 | C117: 15206 | D117: 6574 | E117: of:=1 / ( (LN([.D117])-LN([.$B$2])) / [.$C$2] + 1 / [.$A$2]) -> 299.835604221377 | F117: of:=[.E117]-273 -> 26.8356042213771 | G117: of:=[.A117]*330/16384-[.$E117]*[.$E$2]+[.$F$2]-273 -> 17.2241549726285 | H117: of:=[.B117]*330/16384-[.$E117]*[.$E$2]+[.$F$2]-273 -> 29.5910983320035 | I117: of:=[.C117]*330/16384-[.$E117]*[.$E$2]+[.$F$2]-273 -> 20.4065280195035
A118: 15045 | B118: 15658 | C118: 15203 | D118: 6574 | E118: of:=1 / ( (LN([.D118])-LN([.$B$2])) / [.$C$2] + 1 / [.$A$2]) -> 299.835604221377 | F118: of:=[.E118]-273 -> 26.8356042213771 | G118: of:=[.A118]*330/16384-[.$E118]*[.$E$2]+[.$F$2]-273 -> 17.163730167941 | H118: of:=[.B118]*330/16384-[.$E118]*[.$E$2]+[.$F$2]-273 -> 29.5105319257535 | I118: of:=[.C118]*330/16384-[.$E118]*[.$E$2]+[.$F$2]-273 -> 20.346103214816
A119: 15025 | B119: 15676 | C119: 15230 | D119: 6571 | E119: of:=1 / ( (LN([.D119])-LN([.$B$2])) / [.$C$2] + 1 / [.$A$2]) -> 300.040920963233 | F119: of:=[.E119]-273 -> 27.0409209632335 | G119: of:=[.A119]*330/16384-[.$E119]*[.$E$2]+[.$F$2]-273 -> 17.0745416340847 | H119: of:=[.B119]*330/16384-[.$E119]*[.$E$2]+[.$F$2]-273 -> 30.1867242512722 | I119: of:=[.C119]*330/16384-[.$E119]*[.$E$2]+[.$F$2]-273 -> 21.2035699543972
A120: 15025 | B120: 15673 | C120: 15226 | D120: 6573 | E120: of:=1 / ( (LN([.D120])-LN([.$B$2])) / [.$C$2] + 1 / [.$A$2]) -> 299.90400149655 | F120: of:=[.E120]-273 -> 26.9040014965502 | G120: of:=[.A120]*330/16384-[.$E120]*[.$E$2]+[.$F$2]-273 -> 16.8653823614235 | H120: of:=[.B120]*330/16384-[.$E120]*[.$E$2]+[.$F$2]-273 -> 29.9171401739235 | I120: of:=[.C120]*330/16384-[.$E120]*[.$E$2]+[.$F$2]-273 -> 20.913844275486
A121: 15028 | B121: 15682 | C121: 15220 | D121: 6573 | E121: of:=1 / ( (LN([.D121])-LN([.$B$2])) / [.$C$2] + 1 / [.$A$2]) -> 299.90400149655 | F121: of:=[.E121]-273 -> 26.9040014965502 | G121: of:=[.A121]*330/16384-[.$E121]*[.$E$2]+[.$F$2]-273 -> 16.925807166111 | H121: of:=[.B121]*330/16384-[.$E121]*[.$E$2]+[.$F$2]-273 -> 30.098414587986 | I121: of:=[.C121]*330/16384-[.$E121]*[.$E$2]+[.$F$2]-273 -> 20.792994666111
A122: 15039 | B122: 15674 | C122: 15234 | D122: 6573 | E122: of:=1 / ( (LN([.D122])-LN([.$B$2])) / [.$C$2] + 1 / [.$A$2]) -> 299.90400149655 | F122: of:=[.E122]-273 -> 26.9040014965502 | G122: of:=[.A122]*330/16384-[.$E122]*[.$E$2]+[.$F$2]-273 -> 17.1473647832985 | H122: of:=[.B122]*330/16384-[.$E122]*[.$E$2]+[.$F$2]-273 -> 29.937281775486 | I122: of:=[.C122]*330/16384-[.$E122]*[.$E$2]+[.$F$2]-273 -> 21.074977087986
A123: 15027 | B123: 15674 | C123: 15220 | D123: 6573 | E123: of:=1 / ( (LN([.D123])-LN([.$B$2])) / [.$C$2] + 1 / [.$A$2]) -> 299.90400149655 | F123: of:=[.E123]-273 -> 26.9040014965502 | G123: of:=[.A123]*330/16384-[.$E123]*[.$E$2]+[.$F$2]-273 -> 16.9056655645485 | H123: of:=[.B123]*330/16384-[.$E123]*[.$E$2]+[.$F$2]-273 -> 29.937281775486 | I123: of:=[.C123]*330/16384-[.$E123]*[.$E$2]+[.$F$2]-273 -> 20.792994666111
A124: 15021 | B124: 15678 | C124: 15215 | D124: 6574 | E124: of:=1 / ( (LN([.D124])-LN([.$B$2])) / [.$C$2] + 1 / [.$A$2]) -> 299.835604221377 | F124: of:=[.E124]-273 -> 26.8356042213771 | G124: of:=[.A124]*330/16384-[.$E124]*[.$E$2]+[.$F$2]-273 -> 16.680331730441 | H124: of:=[.B124]*330/16384-[.$E124]*[.$E$2]+[.$F$2]-273 -> 29.9133639570035 | I124: of:=[.C124]*330/16384-[.$E124]*[.$E$2]+[.$F$2]-273 -> 20.587802433566
A125: 15029 | B125: 15674 | C125: 15226 | D125: 6574 | E125: of:=1 / ( (LN([.D125])-LN([.$B$2])) / [.$C$2] + 1 / [.$A$2]) -> 299.835604221377 | F125: of:=[.E125]-273 -> 26.8356042213771 | G125: of:=[.A125]*330/16384-[.$E125]*[.$E$2]+[.$F$2]-273 -> 16.841464542941 | H125: of:=[.B125]*330/16384-[.$E125]*[.$E$2]+[.$F$2]-273 -> 29.8327975507535 | I125: of:=[.C125]*330/16384-[.$E125]*[.$E$2]+[.$F$2]-273 -> 20.8093600507535
A126: 15019 | B126: 15672 | C126: 15218 | D126: 6573 | E126: of:=1 / ( (LN([.D126])-LN([.$B$2])) / [.$C$2] + 1 / [.$A$2]) -> 299.90400149655 | F126: of:=[.E126]-273 -> 26.9040014965502 | G126: of:=[.A126]*330/16384-[.$E126]*[.$E$2]+[.$F$2]-273 -> 16.7445327520485 | H126: of:=[.B126]*330/16384-[.$E126]*[.$E$2]+[.$F$2]-273 -> 29.896998572361 | I126: of:=[.C126]*330/16384-[.$E126]*[.$E$2]+[.$F$2]-273 -> 20.752711462986
A127: 15030 | B127: 15666 | C127: 15216 | D127: 6574 | E127: of:=1 / ( (LN([.D127])-LN([.$B$2])) / [.$C$2] + 1 / [.$A$2]) -> 299.835604221377 | F127: of:=[.E127]-273 -> 26.8356042213771 | G127: of:=[.A127]*330/16384-[.$E127]*[.$E$2]+[.$F$2]-273 -> 16.8616061445035 | H127: of:=[.B127]*330/16384-[.$E127]*[.$E$2]+[.$F$2]-273 -> 29.6716647382535 | I127: of:=[.C127]*330/16384-[.$E127]*[.$E$2]+[.$F$2]-273 -> 20.6079440351285
A128: 15027 | B128: 15669 | C128: 15215 | D128: 6573 | E128: of:=1 / ( (LN([.D128])-LN([.$B$2])) / [.$C$2] + 1 / [.$A$2]) -> 299.90400149655 | F128: of:=[.E128]-273 -> 26.9040014965502 | G128: of:=[.A128]*330/16384-[.$E128]*[.$E$2]+[.$F$2]-273 -> 16.9056655645485 | H128: of:=[.B128]*330/16384-[.$E128]*[.$E$2]+[.$F$2]-273 -> 29.8365737676735 | I128: of:=[.C128]*330/16384-[.$E128]*[.$E$2]+[.$F$2]-273 -> 20.6922866582985
A129: 15036 | B129: 15659 | C129: 15217 | D129: 6574 | E129: of:=1 / ( (LN([.D129])-LN([.$B$2])) / [.$C$2] + 1 / [.$A$2]) -> 299.835604221377 | F129: of:=[.E129]-273 -> 26.8356042213771 | G129: of:=[.A129]*330/16384-[.$E129]*[.$E$2]+[.$F$2]-273 -> 16.9824557538785 | H129: of:=[.B129]*330/16384-[.$E129]*[.$E$2]+[.$F$2]-273 -> 29.530673527316 | I129: of:=[.C129]*330/16384-[.$E129]*[.$E$2]+[.$F$2]-273 -> 20.628085636691
A130: 15038 | B130: 15663 | C130: 15205 | D130: 6574 | E130: of:=1 / ( (LN([.D130])-LN([.$B$2])) / [.$C$2] + 1 / [.$A$2]) -> 299.835604221377 | F130: of:=[.E130]-273 -> 26.8356042213771 | G130: of:=[.A130]*330/16384-[.$E130]*[.$E$2]+[.$F$2]-273 -> 17.0227389570035 | H130: of:=[.B130]*330/16384-[.$E130]*[.$E$2]+[.$F$2]-273 -> 29.611239933566 | I130: of:=[.C130]*330/16384-[.$E130]*[.$E$2]+[.$F$2]-273 -> 20.386386417941
A131: 15038 | B131: 15667 | C131: 15211 | D131: 6574 | E131: of:=1 / ( (LN([.D131])-LN([.$B$2])) / [.$C$2] + 1 / [.$A$2]) -> 299.835604221377 | F131: of:=[.E131]-273 -> 26.8356042213771 | G131: of:=[.A131]*330/16384-[.$E131]*[.$E$2]+[.$F$2]-273 -> 17.0227389570035 | H131: of:=[.B131]*330/16384-[.$E131]*[.$E$2]+[.$F$2]-273 -> 29.691806339816 | I131: of:=[.C131]*330/16384-[.$E131]*[.$E$2]+[.$F$2]-273 -> 20.507236027316
A132: 15043 | B132: 15662 | C132: 15203 | D132: 6574 | E132: of:=1 / ( (LN([.D132])-LN([.$B$2])) / [.$C$2] + 1 / [.$A$2]) -> 299.835604221377 | F132: of:=[.E132]-273 -> 26.8356042213771 | G132: of:=[.A132]*330/16384-[.$E132]*[.$E$2]+[.$F$2]-273 -> 17.123446964816 | H132: of:=[.B132]*330/16384-[.$E132]*[.$E$2]+[.$F$2]-273 -> 29.5910983320035 | I132: of:=[.C132]*330/16384-[.$E132]*[.$E$2]+[.$F$2]-273 -> 20.346103214816
A133: 15046 | B133: 15664 | C133: 15205 | D133: 6573 | E133: of:=1 / ( (LN([.D133])-LN([.$B$2])) / [.$C$2] + 1 / [.$A$2]) -> 299.90400149655 | F133: of:=[.E133]-273 -> 26.9040014965502 | G133: of:=[.A133]*330/16384-[.$E133]*[.$E$2]+[.$F$2]-273 -> 17.288355994236 | H133: of:=[.B133]*330/16384-[.$E133]*[.$E$2]+[.$F$2]-273 -> 29.735865759861 | I133: of:=[.C133]*330/16384-[.$E133]*[.$E$2]+[.$F$2]-273 -> 20.4908706426735
A134: 15040 | B134: 15663 | C134: 15201 | D134: 6573 | E134: of:=1 / ( (LN([.D134])-LN([.$B$2])) / [.$C$2] + 1 / [.$A$2]) -> 299.90400149655 | F134: of:=[.E134]-273 -> 26.9040014965502 | G134: of:=[.A134]*330/16384-[.$E134]*[.$E$2]+[.$F$2]-273 -> 17.167506384861 | H134: of:=[.B134]*330/16384-[.$E134]*[.$E$2]+[.$F$2]-273 -> 29.7157241582985 | I134: of:=[.C134]*330/16384-[.$E134]*[.$E$2]+[.$F$2]-273 -> 20.4103042364235
A135: 15033 | B135: 15659 | C135: 15207 | D135: 6575 | E135: of:=1 / ( (LN([.D135])-LN([.$B$2])) / [.$C$2] + 1 / [.$A$2]) -> 299.767248533292 | F135: of:=[.E135]-273 -> 26.767248533292 | G135: of:=[.A135]*330/16384-[.$E135]*[.$E$2]+[.$F$2]-273 -> 16.8176102532266 | H135: of:=[.B135]*330/16384-[.$E135]*[.$E$2]+[.$F$2]-273 -> 29.4262528313516 | I135: of:=[.C135]*330/16384-[.$E135]*[.$E$2]+[.$F$2]-273 -> 20.3222489251016
A136: 15038 | B136: 15659 | C136: 15200 | D136: 6573 | E136: of:=1 / ( (LN([.D136])-LN([.$B$2])) / [.$C$2] + 1 / [.$A$2]) -> 299.90400149655 | F136: of:=[.E136]-273 -> 26.9040014965502 | G136: of:=[.A136]*330/16384-[.$E136]*[.$E$2]+[.$F$2]-273 -> 17.127223181736 | H136: of:=[.B136]*330/16384-[.$E136]*[.$E$2]+[.$F$2]-273 -> 29.6351577520485 | I136: of:=[.C136]*330/16384-[.$E136]*[.$E$2]+[.$F$2]-273 -> 20.390162634861
A137: 15035 | B137: 15657 | C137: 15196 | D137: 6574 | E137: of:=1 / ( (LN([.D137])-LN([.$B$2])) / [.$C$2] + 1 / [.$A$2]) -> 299.835604221377 | F137: of:=[.E137]-273 -> 26.8356042213771 | G137: of:=[.A137]*330/16384-[.$E137]*[.$E$2]+[.$F$2]-273 -> 16.962314152316 | H137: of:=[.B137]*330/16384-[.$E137]*[.$E$2]+[.$F$2]-273 -> 29.490390324191 | I137: of:=[.C137]*330/16384-[.$E137]*[.$E$2]+[.$F$2]-273 -> 20.2051120038785
A138: 15043 | B138: 15980 | C138: 15586 | D138: 6571 | E138: of:=1 / ( (LN([.D138])-LN([.$B$2])) / [.$C$2] + 1 / [.$A$2]) -> 300.040920963233 | F138: of:=[.E138]-273 -> 27.0409209632335 | G138: of:=[.A138]*330/16384-[.$E138]*[.$E$2]+[.$F$2]-273 -> 17.4370904622097 | H138: of:=[.B138]*330/16384-[.$E138]*[.$E$2]+[.$F$2]-273 -> 36.3097711262722 | I138: of:=[.C138]*330/16384-[.$E138]*[.$E$2]+[.$F$2]-273 -> 28.3739801106472
A139: 15203 | B139: 16001 | C139: 15633 | D139: 6572 | E139: of:=1 / ( (LN([.D139])-LN([.$B$2])) / [.$C$2] + 1 / [.$A$2]) -> 299.972440397568 | F139: of:=[.E139]-273 -> 26.9724403975678 | G139: of:=[.A139]*330/16384-[.$E139]*[.$E$2]+[.$F$2]-273 -> 20.5551352522542 | H139: of:=[.B139]*330/16384-[.$E139]*[.$E$2]+[.$F$2]-273 -> 36.6281332991292 | I139: of:=[.C139]*330/16384-[.$E139]*[.$E$2]+[.$F$2]-273 -> 29.2160239241292
A140: 15209 | B140: 15966 | C140: 15604 | D140: 6572 | E140: of:=1 / ( (LN([.D140])-LN([.$B$2])) / [.$C$2] + 1 / [.$A$2]) -> 299.972440397568 | F140: of:=[.E140]-273 -> 26.9724403975678 | G140: of:=[.A140]*330/16384-[.$E140]*[.$E$2]+[.$F$2]-273 -> 20.6759848616292 | H140: of:=[.B140]*330/16384-[.$E140]*[.$E$2]+[.$F$2]-273 -> 35.9231772444417 | I140: of:=[.C140]*330/16384-[.$E140]*[.$E$2]+[.$F$2]-273 -> 28.6319174788167
A141: 15219 | B141: 15930 | C141: 15596 | D141: 6573 | E141: of:=1 / ( (LN([.D141])-LN([.$B$2])) / [.$C$2] + 1 / [.$A$2]) -> 299.90400149655 | F141: of:=[.E141]-273 -> 26.9040014965502 | G141: of:=[.A141]*330/16384-[.$E141]*[.$E$2]+[.$F$2]-273 -> 20.7728530645485 | H141: of:=[.B141]*330/16384-[.$E141]*[.$E$2]+[.$F$2]-273 -> 35.093531775486 | I141: of:=[.C141]*330/16384-[.$E141]*[.$E$2]+[.$F$2]-273 -> 28.366236853611
A142: 15248 | B142: 15916 | C142: 15593 | D142: 6573 | E142: of:=1 / ( (LN([.D142])-LN([.$B$2])) / [.$C$2] + 1 / [.$A$2]) -> 299.90400149655 | F142: of:=[.E142]-273 -> 26.9040014965502 | G142: of:=[.A142]*330/16384-[.$E142]*[.$E$2]+[.$F$2]-273 -> 21.356959509861 | H142: of:=[.B142]*330/16384-[.$E142]*[.$E$2]+[.$F$2]-273 -> 34.811549353611 | I142: of:=[.C142]*330/16384-[.$E142]*[.$E$2]+[.$F$2]-273 -> 28.3058120489235
A143: 15289 | B143: 16007 | C143: 15553 | D143: 6573 | E143: of:=1 / ( (LN([.D143])-LN([.$B$2])) / [.$C$2] + 1 / [.$A$2]) -> 299.90400149655 | F143: of:=[.E143]-273 -> 26.9040014965502 | G143: of:=[.A143]*330/16384-[.$E143]*[.$E$2]+[.$F$2]-273 -> 22.1827651739235 | H143: of:=[.B143]*330/16384-[.$E143]*[.$E$2]+[.$F$2]-273 -> 36.6444350957985 | I143: of:=[.C143]*330/16384-[.$E143]*[.$E$2]+[.$F$2]-273 -> 27.5001479864235
A144: 15282 | B144: 15954 | C144: 15537 | D144: 6572 | E144: of:=1 / ( (LN([.D144])-LN([.$B$2])) / [.$C$2] + 1 / [.$A$2]) -> 299.972440397568 | F144: of:=[.E144]-273 -> 26.9724403975678 | G144: of:=[.A144]*330/16384-[.$E144]*[.$E$2]+[.$F$2]-273 -> 22.1463217756917 | H144: of:=[.B144]*330/16384-[.$E144]*[.$E$2]+[.$F$2]-273 -> 35.6814780256917 | I144: of:=[.C144]*330/16384-[.$E144]*[.$E$2]+[.$F$2]-273 -> 27.2824301741292
A145: 15240 | B145: 15983 | C145: 15477 | D145: 6574 | E145: of:=1 / ( (LN([.D145])-LN([.$B$2])) / [.$C$2] + 1 / [.$A$2]) -> 299.835604221377 | F145: of:=[.E145]-273 -> 26.8356042213771 | G145: of:=[.A145]*330/16384-[.$E145]*[.$E$2]+[.$F$2]-273 -> 21.0913424726285 | H145: of:=[.B145]*330/16384-[.$E145]*[.$E$2]+[.$F$2]-273 -> 36.056552433566 | I145: of:=[.C145]*330/16384-[.$E145]*[.$E$2]+[.$F$2]-273 -> 25.864902042941
A146: 15211 | B146: 17629 | C146: 15247 | D146: 6573 | E146: of:=1 / ( (LN([.D146])-LN([.$B$2])) / [.$C$2] + 1 / [.$A$2]) -> 299.90400149655 | F146: of:=[.E146]-273 -> 26.9040014965502 | G146: of:=[.A146]*330/16384-[.$E146]*[.$E$2]+[.$F$2]-273 -> 20.6117202520485 | H146: of:=[.B146]*330/16384-[.$E146]*[.$E$2]+[.$F$2]-273 -> 69.3141128301735 | I146: of:=[.C146]*330/16384-[.$E146]*[.$E$2]+[.$F$2]-273 -> 21.3368179082985
A147: 15090 | B147: 17443 | C147: 15256 | D147: 6573 | E147: of:=1 / ( (LN([.D147])-LN([.$B$2])) / [.$C$2] + 1 / [.$A$2]) -> 299.90400149655 | F147: of:=[.E147]-273 -> 26.9040014965502 | G147: of:=[.A147]*330/16384-[.$E147]*[.$E$2]+[.$F$2]-273 -> 18.174586462986 | H147: of:=[.B147]*330/16384-[.$E147]*[.$E$2]+[.$F$2]-273 -> 65.5677749395485 | I147: of:=[.C147]*330/16384-[.$E147]*[.$E$2]+[.$F$2]-273 -> 21.518092322361
A148: 15078 | B148: 18023 | C148: 16817 | D148: 6574 | E148: of:=1 / ( (LN([.D148])-LN([.$B$2])) / [.$C$2] + 1 / [.$A$2]) -> 299.835604221377 | F148: of:=[.E148]-273 -> 26.8356042213771 | G148: of:=[.A148]*330/16384-[.$E148]*[.$E$2]+[.$F$2]-273 -> 17.8284030195035 | H148: of:=[.B148]*330/16384-[.$E148]*[.$E$2]+[.$F$2]-273 -> 77.145419621066 | I148: of:=[.C148]*330/16384-[.$E148]*[.$E$2]+[.$F$2]-273 -> 52.854648136691
A149: 15076 | B149: 17893 | C149: 15403 | D149: 6573 | E149: of:=1 / ( (LN([.D149])-LN([.$B$2])) / [.$C$2] + 1 / [.$A$2]) -> 299.90400149655 | F149: of:=[.E149]-273 -> 26.9040014965502 | G149: of:=[.A149]*330/16384-[.$E149]*[.$E$2]+[.$F$2]-273 -> 17.892604041111 | H149: of:=[.B149]*330/16384-[.$E149]*[.$E$2]+[.$F$2]-273 -> 74.6314956426735 | I149: of:=[.C149]*330/16384-[.$E149]*[.$E$2]+[.$F$2]-273 -> 24.4789077520485
A150: 15210 | B150: 17537 | C150: 15346 | D150: 6573 | E150: of:=1 / ( (LN([.D150])-LN([.$B$2])) / [.$C$2] + 1 / [.$A$2]) -> 299.90400149655 | F150: of:=[.E150]-273 -> 26.9040014965502 | G150: of:=[.A150]*330/16384-[.$E150]*[.$E$2]+[.$F$2]-273 -> 20.591578650486 | H150: of:=[.B150]*330/16384-[.$E150]*[.$E$2]+[.$F$2]-273 -> 67.4610854864235 | I150: of:=[.C150]*330/16384-[.$E150]*[.$E$2]+[.$F$2]-273 -> 23.330836462986
A151: 15008 | B151: 15880 | C151: 15532 | D151: 6573 | E151: of:=1 / ( (LN([.D151])-LN([.$B$2])) / [.$C$2] + 1 / [.$A$2]) -> 299.90400149655 | F151: of:=[.E151]-273 -> 26.9040014965502 | G151: of:=[.A151]*330/16384-[.$E151]*[.$E$2]+[.$F$2]-273 -> 16.522975134861 | H151: of:=[.B151]*330/16384-[.$E151]*[.$E$2]+[.$F$2]-273 -> 34.086451697361 | I151: of:=[.C151]*330/16384-[.$E151]*[.$E$2]+[.$F$2]-273 -> 27.077174353611
A152: 15061 | B152: 15886 | C152: 15476 | D152: 6574 | E152: of:=1 / ( (LN([.D152])-LN([.$B$2])) / [.$C$2] + 1 / [.$A$2]) -> 299.835604221377 | F152: of:=[.E152]-273 -> 26.8356042213771 | G152: of:=[.A152]*330/16384-[.$E152]*[.$E$2]+[.$F$2]-273 -> 17.485995792941 | H152: of:=[.B152]*330/16384-[.$E152]*[.$E$2]+[.$F$2]-273 -> 34.1028170820035 | I152: of:=[.C152]*330/16384-[.$E152]*[.$E$2]+[.$F$2]-273 -> 25.8447604413785
A153: 15016 | B153: 15773 | C153: 15265 | D153: 6574 | E153: of:=1 / ( (LN([.D153])-LN([.$B$2])) / [.$C$2] + 1 / [.$A$2]) -> 299.835604221377 | F153: of:=[.E153]-273 -> 26.8356042213771 | G153: of:=[.A153]*330/16384-[.$E153]*[.$E$2]+[.$F$2]-273 -> 16.5796237226285 | H153: of:=[.B153]*330/16384-[.$E153]*[.$E$2]+[.$F$2]-273 -> 31.826816105441 | I153: of:=[.C153]*330/16384-[.$E153]*[.$E$2]+[.$F$2]-273 -> 21.594882511691
A154: 15045 | B154: 15855 | C154: 15193 | D154: 6573 | E154: of:=1 / ( (LN([.D154])-LN([.$B$2])) / [.$C$2] + 1 / [.$A$2]) -> 299.90400149655 | F154: of:=[.E154]-273 -> 26.9040014965502 | G154: of:=[.A154]*330/16384-[.$E154]*[.$E$2]+[.$F$2]-273 -> 17.2682143926735 | H154: of:=[.B154]*330/16384-[.$E154]*[.$E$2]+[.$F$2]-273 -> 33.5829116582985 | I154: of:=[.C154]*330/16384-[.$E154]*[.$E$2]+[.$F$2]-273 -> 20.2491714239235
A155: 15027 | B155: 15881 | C155: 15191 | D155: 6573 | E155: of:=1 / ( (LN([.D155])-LN([.$B$2])) / [.$C$2] + 1 / [.$A$2]) -> 299.90400149655 | F155: of:=[.E155]-273 -> 26.9040014965502 | G155: of:=[.A155]*330/16384-[.$E155]*[.$E$2]+[.$F$2]-273 -> 16.9056655645485 | H155: of:=[.B155]*330/16384-[.$E155]*[.$E$2]+[.$F$2]-273 -> 34.1065932989235 | I155: of:=[.C155]*330/16384-[.$E155]*[.$E$2]+[.$F$2]-273 -> 20.2088882207985
A156: 15022 | B156: 15968 | C156: 15438 | D156: 6573 | E156: of:=1 / ( (LN([.D156])-LN([.$B$2])) / [.$C$2] + 1 / [.$A$2]) -> 299.90400149655 | F156: of:=[.E156]-273 -> 26.9040014965502 | G156: of:=[.A156]*330/16384-[.$E156]*[.$E$2]+[.$F$2]-273 -> 16.804957556736 | H156: of:=[.B156]*330/16384-[.$E156]*[.$E$2]+[.$F$2]-273 -> 35.858912634861 | I156: of:=[.C156]*330/16384-[.$E156]*[.$E$2]+[.$F$2]-273 -> 25.183863806736
A157: 15033 | B157: 16056 | C157: 15277 | D157: 6570 | E157: of:=1 / ( (LN([.D157])-LN([.$B$2])) / [.$C$2] + 1 / [.$A$2]) -> 300.109443232399 | F157: of:=[.E157]-273 -> 27.1094432323994 | G157: of:=[.A157]*330/16384-[.$E157]*[.$E$2]+[.$F$2]-273 -> 17.3403496131406 | H157: of:=[.B157]*330/16384-[.$E157]*[.$E$2]+[.$F$2]-273 -> 37.9452080115781 | I157: of:=[.C157]*330/16384-[.$E157]*[.$E$2]+[.$F$2]-273 -> 22.2549003943906
A158: 14989 | B158: 15959 | C158: 15215 | D158: 6572 | E158: of:=1 / ( (LN([.D158])-LN([.$B$2])) / [.$C$2] + 1 / [.$A$2]) -> 299.972440397568 | F158: of:=[.E158]-273 -> 26.9724403975678 | G158: of:=[.A158]*330/16384-[.$E158]*[.$E$2]+[.$F$2]-273 -> 16.2448325178792 | H158: of:=[.B158]*330/16384-[.$E158]*[.$E$2]+[.$F$2]-273 -> 35.7821860335042 | I158: of:=[.C158]*330/16384-[.$E158]*[.$E$2]+[.$F$2]-273 -> 20.7968344710042
A159: 14980 | B159: 15946 | C159: 15234 | D159: 6573 | E159: of:=1 / ( (LN([.D159])-LN([.$B$2])) / [.$C$2] + 1 / [.$A$2]) -> 299.90400149655 | F159: of:=[.E159]-273 -> 26.9040014965502 | G159: of:=[.A159]*330/16384-[.$E159]*[.$E$2]+[.$F$2]-273 -> 15.959010291111 | H159: of:=[.B159]*330/16384-[.$E159]*[.$E$2]+[.$F$2]-273 -> 35.415797400486 | I159: of:=[.C159]*330/16384-[.$E159]*[.$E$2]+[.$F$2]-273 -> 21.074977087986
A160: 14986 | B160: 16760 | C160: 15209 | D160: 6574 | E160: of:=1 / ( (LN([.D160])-LN([.$B$2])) / [.$C$2] + 1 / [.$A$2]) -> 299.835604221377 | F160: of:=[.E160]-273 -> 26.8356042213771 | G160: of:=[.A160]*330/16384-[.$E160]*[.$E$2]+[.$F$2]-273 -> 15.9753756757535 | H160: of:=[.B160]*330/16384-[.$E160]*[.$E$2]+[.$F$2]-273 -> 51.7065768476285 | I160: of:=[.C160]*330/16384-[.$E160]*[.$E$2]+[.$F$2]-273 -> 20.466952824191
A161: 15139 | B161: 17360 | C161: 15508 | D161: 6573 | E161: of:=1 / ( (LN([.D161])-LN([.$B$2])) / [.$C$2] + 1 / [.$A$2]) -> 299.90400149655 | F161: of:=[.E161]-273 -> 26.9040014965502 | G161: of:=[.A161]*330/16384-[.$E161]*[.$E$2]+[.$F$2]-273 -> 19.1615249395485 | H161: of:=[.B161]*330/16384-[.$E161]*[.$E$2]+[.$F$2]-273 -> 63.896022009861 | I161: of:=[.C161]*330/16384-[.$E161]*[.$E$2]+[.$F$2]-273 -> 26.593775916111
A162: 15146 | B162: 17653 | C162: 15508 | D162: 6573 | E162: of:=1 / ( (LN([.D162])-LN([.$B$2])) / [.$C$2] + 1 / [.$A$2]) -> 299.90400149655 | F162: of:=[.E162]-273 -> 26.9040014965502 | G162: of:=[.A162]*330/16384-[.$E162]*[.$E$2]+[.$F$2]-273 -> 19.302516150486 | H162: of:=[.B162]*330/16384-[.$E162]*[.$E$2]+[.$F$2]-273 -> 69.7975112676735 | I162: of:=[.C162]*330/16384-[.$E162]*[.$E$2]+[.$F$2]-273 -> 26.593775916111
A163: 15027 | B163: 17487 | C163: 15449 | D163: 6573 | E163: of:=1 / ( (LN([.D163])-LN([.$B$2])) / [.$C$2] + 1 / [.$A$2]) -> 299.90400149655 | F163: of:=[.E163]-273 -> 26.9040014965502 | G163: of:=[.A163]*330/16384-[.$E163]*[.$E$2]+[.$F$2]-273 -> 16.9056655645485 | H163: of:=[.B163]*330/16384-[.$E163]*[.$E$2]+[.$F$2]-273 -> 66.4540054082985 | I163: of:=[.C163]*330/16384-[.$E163]*[.$E$2]+[.$F$2]-273 -> 25.4054214239235
A164: 15041 | B164: 17738 | C164: 15477 | D164: 6574 | E164: of:=1 / ( (LN([.D164])-LN([.$B$2])) / [.$C$2] + 1 / [.$A$2]) -> 299.835604221377 | F164: of:=[.E164]-273 -> 26.8356042213771 | G164: of:=[.A164]*330/16384-[.$E164]*[.$E$2]+[.$F$2]-273 -> 17.083163761691 | H164: of:=[.B164]*330/16384-[.$E164]*[.$E$2]+[.$F$2]-273 -> 71.4050631757535 | I164: of:=[.C164]*330/16384-[.$E164]*[.$E$2]+[.$F$2]-273 -> 25.864902042941
A165: 15037 | B165: 17744 | C165: 15641 | D165: 6574 | E165: of:=1 / ( (LN([.D165])-LN([.$B$2])) / [.$C$2] + 1 / [.$A$2]) -> 299.835604221377 | F165: of:=[.E165]-273 -> 26.8356042213771 | G165: of:=[.A165]*330/16384-[.$E165]*[.$E$2]+[.$F$2]-273 -> 17.002597355441 | H165: of:=[.B165]*330/16384-[.$E165]*[.$E$2]+[.$F$2]-273 -> 71.5259127851285 | I165: of:=[.C165]*330/16384-[.$E165]*[.$E$2]+[.$F$2]-273 -> 29.168124699191
A166: 15058 | B166: 17646 | C166: 15685 | D166: 6573 | E166: of:=1 / ( (LN([.D166])-LN([.$B$2])) / [.$C$2] + 1 / [.$A$2]) -> 299.90400149655 | F166: of:=[.E166]-273 -> 26.9040014965502 | G166: of:=[.A166]*330/16384-[.$E166]*[.$E$2]+[.$F$2]-273 -> 17.530055212986 | H166: of:=[.B166]*330/16384-[.$E166]*[.$E$2]+[.$F$2]-273 -> 69.656520056736 | I166: of:=[.C166]*330/16384-[.$E166]*[.$E$2]+[.$F$2]-273 -> 30.1588393926735
A167: 15089 | B167: 17418 | C167: 15735 | D167: 6573 | E167: of:=1 / ( (LN([.D167])-LN([.$B$2])) / [.$C$2] + 1 / [.$A$2]) -> 299.90400149655 | F167: of:=[.E167]-273 -> 26.9040014965502 | G167: of:=[.A167]*330/16384-[.$E167]*[.$E$2]+[.$F$2]-273 -> 18.1544448614235 | H167: of:=[.B167]*330/16384-[.$E167]*[.$E$2]+[.$F$2]-273 -> 65.064234900486 | I167: of:=[.C167]*330/16384-[.$E167]*[.$E$2]+[.$F$2]-273 -> 31.1659194707985
A168: 15064 | B168: 17238 | C168: 15703 | D168: 6572 | E168: of:=1 / ( (LN([.D168])-LN([.$B$2])) / [.$C$2] + 1 / [.$A$2]) -> 299.972440397568 | F168: of:=[.E168]-273 -> 26.9724403975678 | G168: of:=[.A168]*330/16384-[.$E168]*[.$E$2]+[.$F$2]-273 -> 17.7554526350667 | H168: of:=[.B168]*330/16384-[.$E168]*[.$E$2]+[.$F$2]-273 -> 61.5432944319417 | I168: of:=[.C168]*330/16384-[.$E168]*[.$E$2]+[.$F$2]-273 -> 30.6259360335042
A169: 15167 | B169: 17218 | C169: 15745 | D169: 6572 | E169: of:=1 / ( (LN([.D169])-LN([.$B$2])) / [.$C$2] + 1 / [.$A$2]) -> 299.972440397568 | F169: of:=[.E169]-273 -> 26.9724403975678 | G169: of:=[.A169]*330/16384-[.$E169]*[.$E$2]+[.$F$2]-273 -> 19.8300375960042 | H169: of:=[.B169]*330/16384-[.$E169]*[.$E$2]+[.$F$2]-273 -> 61.1404624006917 | I169: of:=[.C169]*330/16384-[.$E169]*[.$E$2]+[.$F$2]-273 -> 31.4718832991292
A170: 15062 | B170: 17206 | C170: 15555 | D170: 6574 | E170: of:=1 / ( (LN([.D170])-LN([.$B$2])) / [.$C$2] + 1 / [.$A$2]) -> 299.835604221377 | F170: of:=[.E170]-273 -> 26.8356042213771 | G170: of:=[.A170]*330/16384-[.$E170]*[.$E$2]+[.$F$2]-273 -> 17.5061373945035 | H170: of:=[.B170]*330/16384-[.$E170]*[.$E$2]+[.$F$2]-273 -> 60.6897311445035 | I170: of:=[.C170]*330/16384-[.$E170]*[.$E$2]+[.$F$2]-273 -> 27.435946964816
A171: 15040 | B171: 17195 | C171: 15356 | D171: 6574 | E171: of:=1 / ( (LN([.D171])-LN([.$B$2])) / [.$C$2] + 1 / [.$A$2]) -> 299.835604221377 | F171: of:=[.E171]-273 -> 26.8356042213771 | G171: of:=[.A171]*330/16384-[.$E171]*[.$E$2]+[.$F$2]-273 -> 17.0630221601285 | H171: of:=[.B171]*330/16384-[.$E171]*[.$E$2]+[.$F$2]-273 -> 60.468173527316 | I171: of:=[.C171]*330/16384-[.$E171]*[.$E$2]+[.$F$2]-273 -> 23.4277682538785
A172: 15049 | B172: 16957 | C172: 15237 | D172: 6574 | E172: of:=1 / ( (LN([.D172])-LN([.$B$2])) / [.$C$2] + 1 / [.$A$2]) -> 299.835604221377 | F172: of:=[.E172]-273 -> 26.8356042213771 | G172: of:=[.A172]*330/16384-[.$E172]*[.$E$2]+[.$F$2]-273 -> 17.244296574191 | H172: of:=[.B172]*330/16384-[.$E172]*[.$E$2]+[.$F$2]-273 -> 55.674472355441 | I172: of:=[.C172]*330/16384-[.$E172]*[.$E$2]+[.$F$2]-273 -> 21.030917667941
A173: 15017 | B173: 17284 | C173: 15239 | D173: 6573 | E173: of:=1 / ( (LN([.D173])-LN([.$B$2])) / [.$C$2] + 1 / [.$A$2]) -> 299.90400149655 | F173: of:=[.E173]-273 -> 26.9040014965502 | G173: of:=[.A173]*330/16384-[.$E173]*[.$E$2]+[.$F$2]-273 -> 16.7042495489235 | H173: of:=[.B173]*330/16384-[.$E173]*[.$E$2]+[.$F$2]-273 -> 62.365260291111 | I173: of:=[.C173]*330/16384-[.$E173]*[.$E$2]+[.$F$2]-273 -> 21.1756850957985
A174: 15006 | B174: 17659 | C174: 15222 | D174: 6573 | E174: of:=1 / ( (LN([.D174])-LN([.$B$2])) / [.$C$2] + 1 / [.$A$2]) -> 299.90400149655 | F174: of:=[.E174]-273 -> 26.9040014965502 | G174: of:=[.A174]*330/16384-[.$E174]*[.$E$2]+[.$F$2]-273 -> 16.482691931736 | H174: of:=[.B174]*330/16384-[.$E174]*[.$E$2]+[.$F$2]-273 -> 69.9183608770485 | I174: of:=[.C174]*330/16384-[.$E174]*[.$E$2]+[.$F$2]-273 -> 20.833277869236
A175: 14996 | B175: 17640 | C175: 15211 | D175: 6573 | E175: of:=1 / ( (LN([.D175])-LN([.$B$2])) / [.$C$2] + 1 / [.$A$2]) -> 299.90400149655 | F175: of:=[.E175]-273 -> 26.9040014965502 | G175: of:=[.A175]*330/16384-[.$E175]*[.$E$2]+[.$F$2]-273 -> 16.281275916111 | H175: of:=[.B175]*330/16384-[.$E175]*[.$E$2]+[.$F$2]-273 -> 69.535670447361 | I175: of:=[.C175]*330/16384-[.$E175]*[.$E$2]+[.$F$2]-273 -> 20.6117202520485
A176: 15020 | B176: 18130 | C176: 15266 | D176: 6570 | E176: of:=1 / ( (LN([.D176])-LN([.$B$2])) / [.$C$2] + 1 / [.$A$2]) -> 300.109443232399 | F176: of:=[.E176]-273 -> 27.1094432323994 | G176: of:=[.A176]*330/16384-[.$E176]*[.$E$2]+[.$F$2]-273 -> 17.0785087928281 | H176: of:=[.B176]*330/16384-[.$E176]*[.$E$2]+[.$F$2]-273 -> 79.7188896522031 | I176: of:=[.C176]*330/16384-[.$E176]*[.$E$2]+[.$F$2]-273 -> 22.0333427772031
A177: 15032 | B177: 20170 | C177: 15377 | D177: 6572 | E177: of:=1 / ( (LN([.D177])-LN([.$B$2])) / [.$C$2] + 1 / [.$A$2]) -> 299.972440397568 | F177: of:=[.E177]-273 -> 26.9724403975678 | G177: of:=[.A177]*330/16384-[.$E177]*[.$E$2]+[.$F$2]-273 -> 17.1109213850667 | H177: of:=[.B177]*330/16384-[.$E177]*[.$E$2]+[.$F$2]-273 -> 120.598470213192 | I177: of:=[.C177]*330/16384-[.$E177]*[.$E$2]+[.$F$2]-273 -> 24.0597739241292
A178: 15038 | B178: 20311 | C178: 15350 | D178: 6573 | E178: of:=1 / ( (LN([.D178])-LN([.$B$2])) / [.$C$2] + 1 / [.$A$2]) -> 299.90400149655 | F178: of:=[.E178]-273 -> 26.9040014965502 | G178: of:=[.A178]*330/16384-[.$E178]*[.$E$2]+[.$F$2]-273 -> 17.127223181736 | H178: of:=[.B178]*330/16384-[.$E178]*[.$E$2]+[.$F$2]-273 -> 123.333888220799 | I178: of:=[.C178]*330/16384-[.$E178]*[.$E$2]+[.$F$2]-273 -> 23.411402869236
A179: 15029 | B179: 20171 | C179: 15275 | D179: 6573 | E179: of:=1 / ( (LN([.D179])-LN([.$B$2])) / [.$C$2] + 1 / [.$A$2]) -> 299.90400149655 | F179: of:=[.E179]-273 -> 26.9040014965502 | G179: of:=[.A179]*330/16384-[.$E179]*[.$E$2]+[.$F$2]-273 -> 16.9459487676735 | H179: of:=[.B179]*330/16384-[.$E179]*[.$E$2]+[.$F$2]-273 -> 120.514064002049 | I179: of:=[.C179]*330/16384-[.$E179]*[.$E$2]+[.$F$2]-273 -> 21.9007827520485
A180: 15036 | B180: 20180 | C180: 15271 | D180: 6573 | E180: of:=1 / ( (LN([.D180])-LN([.$B$2])) / [.$C$2] + 1 / [.$A$2]) -> 299.90400149655 | F180: of:=[.E180]-273 -> 26.9040014965502 | G180: of:=[.A180]*330/16384-[.$E180]*[.$E$2]+[.$F$2]-273 -> 17.086939978611 | H180: of:=[.B180]*330/16384-[.$E180]*[.$E$2]+[.$F$2]-273 -> 120.695338416111 | I180: of:=[.C180]*330/16384-[.$E180]*[.$E$2]+[.$F$2]-273 -> 21.8202163457985
A181: 15040 | B181: 20264 | C181: 15274 | D181: 6574 | E181: of:=1 / ( (LN([.D181])-LN([.$B$2])) / [.$C$2] + 1 / [.$A$2]) -> 299.835604221377 | F181: of:=[.E181]-273 -> 26.8356042213771 | G181: of:=[.A181]*330/16384-[.$E181]*[.$E$2]+[.$F$2]-273 -> 17.0630221601285 | H181: of:=[.B181]*330/16384-[.$E181]*[.$E$2]+[.$F$2]-273 -> 122.282748722629 | I181: of:=[.C181]*330/16384-[.$E181]*[.$E$2]+[.$F$2]-273 -> 21.7761569257535
A182: 15043 | B182: 20279 | C182: 15290 | D182: 6573 | E182: of:=1 / ( (LN([.D182])-LN([.$B$2])) / [.$C$2] + 1 / [.$A$2]) -> 299.90400149655 | F182: of:=[.E182]-273 -> 26.9040014965502 | G182: of:=[.A182]*330/16384-[.$E182]*[.$E$2]+[.$F$2]-273 -> 17.2279311895485 | H182: of:=[.B182]*330/16384-[.$E182]*[.$E$2]+[.$F$2]-273 -> 122.689356970798 | I182: of:=[.C182]*330/16384-[.$E182]*[.$E$2]+[.$F$2]-273 -> 22.202906775486
A183: 15159 | B183: 20199 | C183: 15452 | D183: 6574 | E183: of:=1 / ( (LN([.D183])-LN([.$B$2])) / [.$C$2] + 1 / [.$A$2]) -> 299.835604221377 | F183: of:=[.E183]-273 -> 26.8356042213771 | G183: of:=[.A183]*330/16384-[.$E183]*[.$E$2]+[.$F$2]-273 -> 19.459872746066 | H183: of:=[.B183]*330/16384-[.$E183]*[.$E$2]+[.$F$2]-273 -> 120.973544621066 | I183: of:=[.C183]*330/16384-[.$E183]*[.$E$2]+[.$F$2]-273 -> 25.3613620038785
A184: 15159 | B184: 20154 | C184: 15399 | D184: 6574 | E184: of:=1 / ( (LN([.D184])-LN([.$B$2])) / [.$C$2] + 1 / [.$A$2]) -> 299.835604221377 | F184: of:=[.E184]-273 -> 26.8356042213771 | G184: of:=[.A184]*330/16384-[.$E184]*[.$E$2]+[.$F$2]-273 -> 19.459872746066 | H184: of:=[.B184]*330/16384-[.$E184]*[.$E$2]+[.$F$2]-273 -> 120.067172550754 | I184: of:=[.C184]*330/16384-[.$E184]*[.$E$2]+[.$F$2]-273 -> 24.293857121066
A185: 15173 | B185: 20196 | C185: 15537 | D185: 6573 | E185: of:=1 / ( (LN([.D185])-LN([.$B$2])) / [.$C$2] + 1 / [.$A$2]) -> 299.90400149655 | F185: of:=[.E185]-273 -> 26.9040014965502 | G185: of:=[.A185]*330/16384-[.$E185]*[.$E$2]+[.$F$2]-273 -> 19.8463393926735 | H185: of:=[.B185]*330/16384-[.$E185]*[.$E$2]+[.$F$2]-273 -> 121.017604041111 | I185: of:=[.C185]*330/16384-[.$E185]*[.$E$2]+[.$F$2]-273 -> 27.1778823614235
A186: 15194 | B186: 20161 | C186: 15526 | D186: 6572 | E186: of:=1 / ( (LN([.D186])-LN([.$B$2])) / [.$C$2] + 1 / [.$A$2]) -> 299.972440397568 | F186: of:=[.E186]-273 -> 26.9724403975678 | G186: of:=[.A186]*330/16384-[.$E186]*[.$E$2]+[.$F$2]-273 -> 20.3738608381917 | H186: of:=[.B186]*330/16384-[.$E186]*[.$E$2]+[.$F$2]-273 -> 120.417195799129 | I186: of:=[.C186]*330/16384-[.$E186]*[.$E$2]+[.$F$2]-273 -> 27.0608725569417
A187: 15203 | B187: 20056 | C187: 15508 | D187: 6573 | E187: of:=1 / ( (LN([.D187])-LN([.$B$2])) / [.$C$2] + 1 / [.$A$2]) -> 299.90400149655 | F187: of:=[.E187]-273 -> 26.9040014965502 | G187: of:=[.A187]*330/16384-[.$E187]*[.$E$2]+[.$F$2]-273 -> 20.4505874395485 | H187: of:=[.B187]*330/16384-[.$E187]*[.$E$2]+[.$F$2]-273 -> 118.197779822361 | I187: of:=[.C187]*330/16384-[.$E187]*[.$E$2]+[.$F$2]-273 -> 26.593775916111
A188: 15208 | B188: 20008 | C188: 15588 | D188: 6574 | E188: of:=1 / ( (LN([.D188])-LN([.$B$2])) / [.$C$2] + 1 / [.$A$2]) -> 299.835604221377 | F188: of:=[.E188]-273 -> 26.8356042213771 | G188: of:=[.A188]*330/16384-[.$E188]*[.$E$2]+[.$F$2]-273 -> 20.4468112226285 | H188: of:=[.B188]*330/16384-[.$E188]*[.$E$2]+[.$F$2]-273 -> 117.126498722629 | I188: of:=[.C188]*330/16384-[.$E188]*[.$E$2]+[.$F$2]-273 -> 28.1006198163785
A189: 15168 | B189: 20202 | C189: 15462 | D189: 6573 | E189: of:=1 / ( (LN([.D189])-LN([.$B$2])) / [.$C$2] + 1 / [.$A$2]) -> 299.90400149655 | F189: of:=[.E189]-273 -> 26.9040014965502 | G189: of:=[.A189]*330/16384-[.$E189]*[.$E$2]+[.$F$2]-273 -> 19.745631384861 | H189: of:=[.B189]*330/16384-[.$E189]*[.$E$2]+[.$F$2]-273 -> 121.138453650486 | I189: of:=[.C189]*330/16384-[.$E189]*[.$E$2]+[.$F$2]-273 -> 25.667262244236
A190: 15192 | B190: 20176 | C190: 15555 | D190: 6574 | E190: of:=1 / ( (LN([.D190])-LN([.$B$2])) / [.$C$2] + 1 / [.$A$2]) -> 299.835604221377 | F190: of:=[.E190]-273 -> 26.8356042213771 | G190: of:=[.A190]*330/16384-[.$E190]*[.$E$2]+[.$F$2]-273 -> 20.1245455976285 | H190: of:=[.B190]*330/16384-[.$E190]*[.$E$2]+[.$F$2]-273 -> 120.510287785129 | I190: of:=[.C190]*330/16384-[.$E190]*[.$E$2]+[.$F$2]-273 -> 27.435946964816
A191: 15182 | B191: 19974 | C191: 15494 | D191: 6573 | E191: of:=1 / ( (LN([.D191])-LN([.$B$2])) / [.$C$2] + 1 / [.$A$2]) -> 299.90400149655 | F191: of:=[.E191]-273 -> 26.9040014965502 | G191: of:=[.A191]*330/16384-[.$E191]*[.$E$2]+[.$F$2]-273 -> 20.027613806736 | H191: of:=[.B191]*330/16384-[.$E191]*[.$E$2]+[.$F$2]-273 -> 116.546168494236 | I191: of:=[.C191]*330/16384-[.$E191]*[.$E$2]+[.$F$2]-273 -> 26.311793494236
A192: 15196 | B192: 19779 | C192: 15426 | D192: 6572 | E192: of:=1 / ( (LN([.D192])-LN([.$B$2])) / [.$C$2] + 1 / [.$A$2]) -> 299.972440397568 | F192: of:=[.E192]-273 -> 26.9724403975678 | G192: of:=[.A192]*330/16384-[.$E192]*[.$E$2]+[.$F$2]-273 -> 20.4141440413167 | H192: of:=[.B192]*330/16384-[.$E192]*[.$E$2]+[.$F$2]-273 -> 112.723104002254 | I192: of:=[.C192]*330/16384-[.$E192]*[.$E$2]+[.$F$2]-273 -> 25.0467124006917
A193: 15191 | B193: 19812 | C193: 15505 | D193: 6573 | E193: of:=1 / ( (LN([.D193])-LN([.$B$2])) / [.$C$2] + 1 / [.$A$2]) -> 299.90400149655 | F193: of:=[.E193]-273 -> 26.9040014965502 | G193: of:=[.A193]*330/16384-[.$E193]*[.$E$2]+[.$F$2]-273 -> 20.2088882207985 | H193: of:=[.B193]*330/16384-[.$E193]*[.$E$2]+[.$F$2]-273 -> 113.283229041111 | I193: of:=[.C193]*330/16384-[.$E193]*[.$E$2]+[.$F$2]-273 -> 26.5333511114235
A194: 15160 | B194: 20031 | C194: 15469 | D194: 6573 | E194: of:=1 / ( (LN([.D194])-LN([.$B$2])) / [.$C$2] + 1 / [.$A$2]) -> 299.90400149655 | F194: of:=[.E194]-273 -> 26.9040014965502 | G194: of:=[.A194]*330/16384-[.$E194]*[.$E$2]+[.$F$2]-273 -> 19.584498572361 | H194: of:=[.B194]*330/16384-[.$E194]*[.$E$2]+[.$F$2]-273 -> 117.694239783299 | I194: of:=[.C194]*330/16384-[.$E194]*[.$E$2]+[.$F$2]-273 -> 25.8082534551735
A195: 15157 | B195: 19943 | C195: 15491 | D195: 6573 | E195: of:=1 / ( (LN([.D195])-LN([.$B$2])) / [.$C$2] + 1 / [.$A$2]) -> 299.90400149655 | F195: of:=[.E195]-273 -> 26.9040014965502 | G195: of:=[.A195]*330/16384-[.$E195]*[.$E$2]+[.$F$2]-273 -> 19.5240737676735 | H195: of:=[.B195]*330/16384-[.$E195]*[.$E$2]+[.$F$2]-273 -> 115.921778845798 | I195: of:=[.C195]*330/16384-[.$E195]*[.$E$2]+[.$F$2]-273 -> 26.2513686895485
A196: 15154 | B196: 20080 | C196: 15507 | D196: 6573 | E196: of:=1 / ( (LN([.D196])-LN([.$B$2])) / [.$C$2] + 1 / [.$A$2]) -> 299.90400149655 | F196: of:=[.E196]-273 -> 26.9040014965502 | G196: of:=[.A196]*330/16384-[.$E196]*[.$E$2]+[.$F$2]-273 -> 19.463648962986 | H196: of:=[.B196]*330/16384-[.$E196]*[.$E$2]+[.$F$2]-273 -> 118.681178259861 | I196: of:=[.C196]*330/16384-[.$E196]*[.$E$2]+[.$F$2]-273 -> 26.5736343145485
A197: 15153 | B197: 20016 | C197: 15392 | D197: 6573 | E197: of:=1 / ( (LN([.D197])-LN([.$B$2])) / [.$C$2] + 1 / [.$A$2]) -> 299.90400149655 | F197: of:=[.E197]-273 -> 26.9040014965502 | G197: of:=[.A197]*330/16384-[.$E197]*[.$E$2]+[.$F$2]-273 -> 19.4435073614235 | H197: of:=[.B197]*330/16384-[.$E197]*[.$E$2]+[.$F$2]-273 -> 117.392115759861 | I197: of:=[.C197]*330/16384-[.$E197]*[.$E$2]+[.$F$2]-273 -> 24.257350134861
A198: 15147 | B198: 20133 | C198: 15470 | D198: 6573 | E198: of:=1 / ( (LN([.D198])-LN([.$B$2])) / [.$C$2] + 1 / [.$A$2]) -> 299.90400149655 | F198: of:=[.E198]-273 -> 26.9040014965502 | G198: of:=[.A198]*330/16384-[.$E198]*[.$E$2]+[.$F$2]-273 -> 19.3226577520485 | H198: of:=[.B198]*330/16384-[.$E198]*[.$E$2]+[.$F$2]-273 -> 119.748683142673 | I198: of:=[.C198]*330/16384-[.$E198]*[.$E$2]+[.$F$2]-273 -> 25.828395056736
A199: 15149 | B199: 20165 | C199: 15366 | D199: 6573 | E199: of:=1 / ( (LN([.D199])-LN([.$B$2])) / [.$C$2] + 1 / [.$A$2]) -> 299.90400149655 | F199: of:=[.E199]-273 -> 26.9040014965502 | G199: of:=[.A199]*330/16384-[.$E199]*[.$E$2]+[.$F$2]-273 -> 19.3629409551735 | H199: of:=[.B199]*330/16384-[.$E199]*[.$E$2]+[.$F$2]-273 -> 120.393214392673 | I199: of:=[.C199]*330/16384-[.$E199]*[.$E$2]+[.$F$2]-273 -> 23.733668494236
A200: 15149 | B200: 20112 | C200: 15284 | D200: 6572 | E200: of:=1 / ( (LN([.D200])-LN([.$B$2])) / [.$C$2] + 1 / [.$A$2]) -> 299.972440397568 | F200: of:=[.E200]-273 -> 26.9724403975678 | G200: of:=[.A200]*330/16384-[.$E200]*[.$E$2]+[.$F$2]-273 -> 19.4674887678792 | H200: of:=[.B200]*330/16384-[.$E200]*[.$E$2]+[.$F$2]-273 -> 119.430257322567 | I200: of:=[.C200]*330/16384-[.$E200]*[.$E$2]+[.$F$2]-273 -> 22.1866049788167
A201: 15146 | B201: 20206 | C201: 15244 | D201: 6573 | E201: of:=1 / ( (LN([.D201])-LN([.$B$2])) / [.$C$2] + 1 / [.$A$2]) -> 299.90400149655 | F201: of:=[.E201]-273 -> 26.9040014965502 | G201: of:=[.A201]*330/16384-[.$E201]*[.$E$2]+[.$F$2]-273 -> 19.302516150486 | H201: of:=[.B201]*330/16384-[.$E201]*[.$E$2]+[.$F$2]-273 -> 121.219020056736 | I201: of:=[.C201]*330/16384-[.$E201]*[.$E$2]+[.$F$2]-273 -> 21.276393103611
A202: 15146 | B202: 20206 | C202: 15239 | D202: 6572 | E202: of:=1 / ( (LN([.D202])-LN([.$B$2])) / [.$C$2] + 1 / [.$A$2]) -> 299.972440397568 | F202: of:=[.E202]-273 -> 26.9724403975678 | G202: of:=[.A202]*330/16384-[.$E202]*[.$E$2]+[.$F$2]-273 -> 19.4070639631917 | H202: of:=[.B202]*330/16384-[.$E202]*[.$E$2]+[.$F$2]-273 -> 121.323567869442 | I202: of:=[.C202]*330/16384-[.$E202]*[.$E$2]+[.$F$2]-273 -> 21.2802329085042
A203: 15146 | B203: 20231 | C203: 15240 | D203: 6572 | E203: of:=1 / ( (LN([.D203])-LN([.$B$2])) / [.$C$2] + 1 / [.$A$2]) -> 299.972440397568 | F203: of:=[.E203]-273 -> 26.9724403975678 | G203: of:=[.A203]*330/16384-[.$E203]*[.$E$2]+[.$F$2]-273 -> 19.4070639631917 | H203: of:=[.B203]*330/16384-[.$E203]*[.$E$2]+[.$F$2]-273 -> 121.827107908504 | I203: of:=[.C203]*330/16384-[.$E203]*[.$E$2]+[.$F$2]-273 -> 21.3003745100667
A204: 15142 | B204: 20328 | C204: 15230 | D204: 6572 | E204: of:=1 / ( (LN([.D204])-LN([.$B$2])) / [.$C$2] + 1 / [.$A$2]) -> 299.972440397568 | F204: of:=[.E204]-273 -> 26.9724403975678 | G204: of:=[.A204]*330/16384-[.$E204]*[.$E$2]+[.$F$2]-273 -> 19.3264975569417 | H204: of:=[.B204]*330/16384-[.$E204]*[.$E$2]+[.$F$2]-273 -> 123.780843260067 | I204: of:=[.C204]*330/16384-[.$E204]*[.$E$2]+[.$F$2]-273 -> 21.0989584944417
A205: 15148 | B205: 20329 | C205: 15251 | D205: 6573 | E205: of:=1 / ( (LN([.D205])-LN([.$B$2])) / [.$C$2] + 1 / [.$A$2]) -> 299.90400149655 | F205: of:=[.E205]-273 -> 26.9040014965502 | G205: of:=[.A205]*330/16384-[.$E205]*[.$E$2]+[.$F$2]-273 -> 19.342799353611 | H205: of:=[.B205]*330/16384-[.$E205]*[.$E$2]+[.$F$2]-273 -> 123.696437048923 | I205: of:=[.C205]*330/16384-[.$E205]*[.$E$2]+[.$F$2]-273 -> 21.4173843145485
A206: 15140 | B206: 20344 | C206: 15259 | D206: 6572 | E206: of:=1 / ( (LN([.D206])-LN([.$B$2])) / [.$C$2] + 1 / [.$A$2]) -> 299.972440397568 | F206: of:=[.E206]-273 -> 26.9724403975678 | G206: of:=[.A206]*330/16384-[.$E206]*[.$E$2]+[.$F$2]-273 -> 19.2862143538167 | H206: of:=[.B206]*330/16384-[.$E206]*[.$E$2]+[.$F$2]-273 -> 124.103108885067 | I206: of:=[.C206]*330/16384-[.$E206]*[.$E$2]+[.$F$2]-273 -> 21.6830649397542
A207: 15145 | B207: 20309 | C207: 15339 | D207: 6572 | E207: of:=1 / ( (LN([.D207])-LN([.$B$2])) / [.$C$2] + 1 / [.$A$2]) -> 299.972440397568 | F207: of:=[.E207]-273 -> 26.9724403975678 | G207: of:=[.A207]*330/16384-[.$E207]*[.$E$2]+[.$F$2]-273 -> 19.3869223616292 | H207: of:=[.B207]*330/16384-[.$E207]*[.$E$2]+[.$F$2]-273 -> 123.398152830379 | I207: of:=[.C207]*330/16384-[.$E207]*[.$E$2]+[.$F$2]-273 -> 23.2943930647542
A208: 15153 | B208: 20268 | C208: 15416 | D208: 6573 | E208: of:=1 / ( (LN([.D208])-LN([.$B$2])) / [.$C$2] + 1 / [.$A$2]) -> 299.90400149655 | F208: of:=[.E208]-273 -> 26.9040014965502 | G208: of:=[.A208]*330/16384-[.$E208]*[.$E$2]+[.$F$2]-273 -> 19.4435073614235 | H208: of:=[.B208]*330/16384-[.$E208]*[.$E$2]+[.$F$2]-273 -> 122.467799353611 | I208: of:=[.C208]*330/16384-[.$E208]*[.$E$2]+[.$F$2]-273 -> 24.740748572361
A209: 15145 | B209: 20347 | C209: 15684 | D209: 6573 | E209: of:=1 / ( (LN([.D209])-LN([.$B$2])) / [.$C$2] + 1 / [.$A$2]) -> 299.90400149655 | F209: of:=[.E209]-273 -> 26.9040014965502 | G209: of:=[.A209]*330/16384-[.$E209]*[.$E$2]+[.$F$2]-273 -> 19.2823745489235 | H209: of:=[.B209]*330/16384-[.$E209]*[.$E$2]+[.$F$2]-273 -> 124.058985877048 | I209: of:=[.C209]*330/16384-[.$E209]*[.$E$2]+[.$F$2]-273 -> 30.138697791111
A210: 15146 | B210: 20382 | C210: 15827 | D210: 6572 | E210: of:=1 / ( (LN([.D210])-LN([.$B$2])) / [.$C$2] + 1 / [.$A$2]) -> 299.972440397568 | F210: of:=[.E210]-273 -> 26.9724403975678 | G210: of:=[.A210]*330/16384-[.$E210]*[.$E$2]+[.$F$2]-273 -> 19.4070639631917 | H210: of:=[.B210]*330/16384-[.$E210]*[.$E$2]+[.$F$2]-273 -> 124.868489744442 | I210: of:=[.C210]*330/16384-[.$E210]*[.$E$2]+[.$F$2]-273 -> 33.1234946272542
A211: 15149 | B211: 20461 | C211: 19534 | D211: 6572 | E211: of:=1 / ( (LN([.D211])-LN([.$B$2])) / [.$C$2] + 1 / [.$A$2]) -> 299.972440397568 | F211: of:=[.E211]-273 -> 26.9724403975678 | G211: of:=[.A211]*330/16384-[.$E211]*[.$E$2]+[.$F$2]-273 -> 19.4674887678792 | H211: of:=[.B211]*330/16384-[.$E211]*[.$E$2]+[.$F$2]-273 -> 126.459676267879 | I211: of:=[.C211]*330/16384-[.$E211]*[.$E$2]+[.$F$2]-273 -> 107.788411619442
A212: 15142 | B212: 20442 | C212: 17109 | D212: 6572 | E212: of:=1 / ( (LN([.D212])-LN([.$B$2])) / [.$C$2] + 1 / [.$A$2]) -> 299.972440397568 | F212: of:=[.E212]-273 -> 26.9724403975678 | G212: of:=[.A212]*330/16384-[.$E212]*[.$E$2]+[.$F$2]-273 -> 19.3264975569417 | H212: of:=[.B212]*330/16384-[.$E212]*[.$E$2]+[.$F$2]-273 -> 126.076985838192 | I212: of:=[.C212]*330/16384-[.$E212]*[.$E$2]+[.$F$2]-273 -> 58.9450278303792
A213: 15058 | B213: 20524 | C213: 15746 | D213: 6570 | E213: of:=1 / ( (LN([.D213])-LN([.$B$2])) / [.$C$2] + 1 / [.$A$2]) -> 300.109443232399 | F213: of:=[.E213]-273 -> 27.1094432323994 | G213: of:=[.A213]*330/16384-[.$E213]*[.$E$2]+[.$F$2]-273 -> 17.8438896522031 | H213: of:=[.B213]*330/16384-[.$E213]*[.$E$2]+[.$F$2]-273 -> 127.937883792828 | I213: of:=[.C213]*330/16384-[.$E213]*[.$E$2]+[.$F$2]-273 -> 31.7013115272031
A214: 15181 | B214: 20479 | C214: 15869 | D214: 6571 | E214: of:=1 / ( (LN([.D214])-LN([.$B$2])) / [.$C$2] + 1 / [.$A$2]) -> 300.040920963233 | F214: of:=[.E214]-273 -> 27.0409209632335 | G214: of:=[.A214]*330/16384-[.$E214]*[.$E$2]+[.$F$2]-273 -> 20.2166314778347 | H214: of:=[.B214]*330/16384-[.$E214]*[.$E$2]+[.$F$2]-273 -> 126.92683655596 | I214: of:=[.C214]*330/16384-[.$E214]*[.$E$2]+[.$F$2]-273 -> 34.0740533528347
A215: 15185 | B215: 20536 | C215: 15833 | D215: 6571 | E215: of:=1 / ( (LN([.D215])-LN([.$B$2])) / [.$C$2] + 1 / [.$A$2]) -> 300.040920963233 | F215: of:=[.E215]-273 -> 27.0409209632335 | G215: of:=[.A215]*330/16384-[.$E215]*[.$E$2]+[.$F$2]-273 -> 20.2971978840847 | H215: of:=[.B215]*330/16384-[.$E215]*[.$E$2]+[.$F$2]-273 -> 128.074907845022 | I215: of:=[.C215]*330/16384-[.$E215]*[.$E$2]+[.$F$2]-273 -> 33.3489556965847
A216: 15180 | B216: 20531 | C216: 15839 | D216: 6572 | E216: of:=1 / ( (LN([.D216])-LN([.$B$2])) / [.$C$2] + 1 / [.$A$2]) -> 299.972440397568 | F216: of:=[.E216]-273 -> 26.9724403975678 | G216: of:=[.A216]*330/16384-[.$E216]*[.$E$2]+[.$F$2]-273 -> 20.0918784163167 | H216: of:=[.B216]*330/16384-[.$E216]*[.$E$2]+[.$F$2]-273 -> 127.869588377254 | I216: of:=[.C216]*330/16384-[.$E216]*[.$E$2]+[.$F$2]-273 -> 33.3651938460042
A217: 15186 | B217: 20493 | C217: 19890 | D217: 6572 | E217: of:=1 / ( (LN([.D217])-LN([.$B$2])) / [.$C$2] + 1 / [.$A$2]) -> 299.972440397568 | F217: of:=[.E217]-273 -> 26.9724403975678 | G217: of:=[.A217]*330/16384-[.$E217]*[.$E$2]+[.$F$2]-273 -> 20.2127280256917 | H217: of:=[.B217]*330/16384-[.$E217]*[.$E$2]+[.$F$2]-273 -> 127.104207517879 | I217: of:=[.C217]*330/16384-[.$E217]*[.$E$2]+[.$F$2]-273 -> 114.958821775692
A218: 15190 | B218: 20432 | C218: 19895 | D218: 6572 | E218: of:=1 / ( (LN([.D218])-LN([.$B$2])) / [.$C$2] + 1 / [.$A$2]) -> 299.972440397568 | F218: of:=[.E218]-273 -> 26.9724403975678 | G218: of:=[.A218]*330/16384-[.$E218]*[.$E$2]+[.$F$2]-273 -> 20.2932944319417 | H218: of:=[.B218]*330/16384-[.$E218]*[.$E$2]+[.$F$2]-273 -> 125.875569822567 | I218: of:=[.C218]*330/16384-[.$E218]*[.$E$2]+[.$F$2]-273 -> 115.059529783504
A219: 15189 | B219: 20454 | C219: 15756 | D219: 6572 | E219: of:=1 / ( (LN([.D219])-LN([.$B$2])) / [.$C$2] + 1 / [.$A$2]) -> 299.972440397568 | F219: of:=[.E219]-273 -> 26.9724403975678 | G219: of:=[.A219]*330/16384-[.$E219]*[.$E$2]+[.$F$2]-273 -> 20.2731528303792 | H219: of:=[.B219]*330/16384-[.$E219]*[.$E$2]+[.$F$2]-273 -> 126.318685056942 | I219: of:=[.C219]*330/16384-[.$E219]*[.$E$2]+[.$F$2]-273 -> 31.6934409163167
A220: 15190 | B220: 20492 | C220: 15730 | D220: 6572 | E220: of:=1 / ( (LN([.D220])-LN([.$B$2])) / [.$C$2] + 1 / [.$A$2]) -> 299.972440397568 | F220: of:=[.E220]-273 -> 26.9724403975678 | G220: of:=[.A220]*330/16384-[.$E220]*[.$E$2]+[.$F$2]-273 -> 20.2932944319417 | H220: of:=[.B220]*330/16384-[.$E220]*[.$E$2]+[.$F$2]-273 -> 127.084065916317 | I220: of:=[.C220]*330/16384-[.$E220]*[.$E$2]+[.$F$2]-273 -> 31.1697592756917
A221: 15179 | B221: 20426 | C221: 15772 | D221: 6572 | E221: of:=1 / ( (LN([.D221])-LN([.$B$2])) / [.$C$2] + 1 / [.$A$2]) -> 299.972440397568 | F221: of:=[.E221]-273 -> 26.9724403975678 | G221: of:=[.A221]*330/16384-[.$E221]*[.$E$2]+[.$F$2]-273 -> 20.0717368147542 | H221: of:=[.B221]*330/16384-[.$E221]*[.$E$2]+[.$F$2]-273 -> 125.754720213192 | I221: of:=[.C221]*330/16384-[.$E221]*[.$E$2]+[.$F$2]-273 -> 32.0157065413167
A222: 15186 | B222: 20452 | C222: 15955 | D222: 6571 | E222: of:=1 / ( (LN([.D222])-LN([.$B$2])) / [.$C$2] + 1 / [.$A$2]) -> 300.040920963233 | F222: of:=[.E222]-273 -> 27.0409209632335 | G222: of:=[.A222]*330/16384-[.$E222]*[.$E$2]+[.$F$2]-273 -> 20.3173394856472 | H222: of:=[.B222]*330/16384-[.$E222]*[.$E$2]+[.$F$2]-273 -> 126.383013313772 | I222: of:=[.C222]*330/16384-[.$E222]*[.$E$2]+[.$F$2]-273 -> 35.8062310872097
A223: 15185 | B223: 20481 | C223: 15922 | D223: 6573 | E223: of:=1 / ( (LN([.D223])-LN([.$B$2])) / [.$C$2] + 1 / [.$A$2]) -> 299.90400149655 | F223: of:=[.E223]-273 -> 26.9040014965502 | G223: of:=[.A223]*330/16384-[.$E223]*[.$E$2]+[.$F$2]-273 -> 20.0880386114235 | H223: of:=[.B223]*330/16384-[.$E223]*[.$E$2]+[.$F$2]-273 -> 126.757960486424 | I223: of:=[.C223]*330/16384-[.$E223]*[.$E$2]+[.$F$2]-273 -> 34.932398962986
A224: 15126 | B224: 20522 | C224: 18882 | D224: 6572 | E224: of:=1 / ( (LN([.D224])-LN([.$B$2])) / [.$C$2] + 1 / [.$A$2]) -> 299.972440397568 | F224: of:=[.E224]-273 -> 26.9724403975678 | G224: of:=[.A224]*330/16384-[.$E224]*[.$E$2]+[.$F$2]-273 -> 19.0042319319417 | H224: of:=[.B224]*330/16384-[.$E224]*[.$E$2]+[.$F$2]-273 -> 127.688313963192 | I224: of:=[.C224]*330/16384-[.$E224]*[.$E$2]+[.$F$2]-273 -> 94.6560874006917
A225: 15104 | B225: 20546 | C225: 18168 | D225: 6573 | E225: of:=1 / ( (LN([.D225])-LN([.$B$2])) / [.$C$2] + 1 / [.$A$2]) -> 299.90400149655 | F225: of:=[.E225]-273 -> 26.9040014965502 | G225: of:=[.A225]*330/16384-[.$E225]*[.$E$2]+[.$F$2]-273 -> 18.456568884861 | H225: of:=[.B225]*330/16384-[.$E225]*[.$E$2]+[.$F$2]-273 -> 128.067164587986 | I225: of:=[.C225]*330/16384-[.$E225]*[.$E$2]+[.$F$2]-273 -> 80.170436072361
A226: 15090 | B226: 20545 | C226: 15588 | D226: 6572 | E226: of:=1 / ( (LN([.D226])-LN([.$B$2])) / [.$C$2] + 1 / [.$A$2]) -> 299.972440397568 | F226: of:=[.E226]-273 -> 26.9724403975678 | G226: of:=[.A226]*330/16384-[.$E226]*[.$E$2]+[.$F$2]-273 -> 18.2791342756917 | H226: of:=[.B226]*330/16384-[.$E226]*[.$E$2]+[.$F$2]-273 -> 128.151570799129 | I226: of:=[.C226]*330/16384-[.$E226]*[.$E$2]+[.$F$2]-273 -> 28.3096518538167
A227: 15114 | B227: 20522 | C227: 19729 | D227: 6571 | E227: of:=1 / ( (LN([.D227])-LN([.$B$2])) / [.$C$2] + 1 / [.$A$2]) -> 300.040920963233 | F227: of:=[.E227]-273 -> 27.0409209632335 | G227: of:=[.A227]*330/16384-[.$E227]*[.$E$2]+[.$F$2]-273 -> 18.8671441731472 | H227: of:=[.B227]*330/16384-[.$E227]*[.$E$2]+[.$F$2]-273 -> 127.792925423147 | I227: of:=[.C227]*330/16384-[.$E227]*[.$E$2]+[.$F$2]-273 -> 111.820635384085
A228: 15146 | B228: 20558 | C228: 16058 | D228: 6572 | E228: of:=1 / ( (LN([.D228])-LN([.$B$2])) / [.$C$2] + 1 / [.$A$2]) -> 299.972440397568 | F228: of:=[.E228]-273 -> 26.9724403975678 | G228: of:=[.A228]*330/16384-[.$E228]*[.$E$2]+[.$F$2]-273 -> 19.4070639631917 | H228: of:=[.B228]*330/16384-[.$E228]*[.$E$2]+[.$F$2]-273 -> 128.413411619442 | I228: of:=[.C228]*330/16384-[.$E228]*[.$E$2]+[.$F$2]-273 -> 37.7762045881917
A229: 15100 | B229: 20557 | C229: 15297 | D229: 6571 | E229: of:=1 / ( (LN([.D229])-LN([.$B$2])) / [.$C$2] + 1 / [.$A$2]) -> 300.040920963233 | F229: of:=[.E229]-273 -> 27.0409209632335 | G229: of:=[.A229]*330/16384-[.$E229]*[.$E$2]+[.$F$2]-273 -> 18.5851617512722 | H229: of:=[.B229]*330/16384-[.$E229]*[.$E$2]+[.$F$2]-273 -> 128.497881477835 | I229: of:=[.C229]*330/16384-[.$E229]*[.$E$2]+[.$F$2]-273 -> 22.5530572590847
A230: 15193 | B230: 20521 | C230: 15995 | D230: 6573 | E230: of:=1 / ( (LN([.D230])-LN([.$B$2])) / [.$C$2] + 1 / [.$A$2]) -> 299.90400149655 | F230: of:=[.E230]-273 -> 26.9040014965502 | G230: of:=[.A230]*330/16384-[.$E230]*[.$E$2]+[.$F$2]-273 -> 20.2491714239235 | H230: of:=[.B230]*330/16384-[.$E230]*[.$E$2]+[.$F$2]-273 -> 127.563624548924 | I230: of:=[.C230]*330/16384-[.$E230]*[.$E$2]+[.$F$2]-273 -> 36.4027358770485
A231: 15182 | B231: 20572 | C231: 19733 | D231: 6572 | E231: of:=1 / ( (LN([.D231])-LN([.$B$2])) / [.$C$2] + 1 / [.$A$2]) -> 299.972440397568 | F231: of:=[.E231]-273 -> 26.9724403975678 | G231: of:=[.A231]*330/16384-[.$E231]*[.$E$2]+[.$F$2]-273 -> 20.1321616194417 | H231: of:=[.B231]*330/16384-[.$E231]*[.$E$2]+[.$F$2]-273 -> 128.695394041317 | I231: of:=[.C231]*330/16384-[.$E231]*[.$E$2]+[.$F$2]-273 -> 111.796590330379
A232: 15189 | B232: 20571 | C232: 19125 | D232: 6572 | E232: of:=1 / ( (LN([.D232])-LN([.$B$2])) / [.$C$2] + 1 / [.$A$2]) -> 299.972440397568 | F232: of:=[.E232]-273 -> 26.9724403975678 | G232: of:=[.A232]*330/16384-[.$E232]*[.$E$2]+[.$F$2]-273 -> 20.2731528303792 | H232: of:=[.B232]*330/16384-[.$E232]*[.$E$2]+[.$F$2]-273 -> 128.675252439754 | I232: of:=[.C232]*330/16384-[.$E232]*[.$E$2]+[.$F$2]-273 -> 99.5504965803792
A233: 15196 | B233: 20595 | C233: 19891 | D233: 6572 | E233: of:=1 / ( (LN([.D233])-LN([.$B$2])) / [.$C$2] + 1 / [.$A$2]) -> 299.972440397568 | F233: of:=[.E233]-273 -> 26.9724403975678 | G233: of:=[.A233]*330/16384-[.$E233]*[.$E$2]+[.$F$2]-273 -> 20.4141440413167 | H233: of:=[.B233]*330/16384-[.$E233]*[.$E$2]+[.$F$2]-273 -> 129.158650877254 | I233: of:=[.C233]*330/16384-[.$E233]*[.$E$2]+[.$F$2]-273 -> 114.978963377254
A234: 15196 | B234: 20609 | C234: 16973 | D234: 6572 | E234: of:=1 / ( (LN([.D234])-LN([.$B$2])) / [.$C$2] + 1 / [.$A$2]) -> 299.972440397568 | F234: of:=[.E234]-273 -> 26.9724403975678 | G234: of:=[.A234]*330/16384-[.$E234]*[.$E$2]+[.$F$2]-273 -> 20.4141440413167 | H234: of:=[.B234]*330/16384-[.$E234]*[.$E$2]+[.$F$2]-273 -> 129.440633299129 | I234: of:=[.C234]*330/16384-[.$E234]*[.$E$2]+[.$F$2]-273 -> 56.2057700178792
A235: 15199 | B235: 20622 | C235: 19805 | D235: 6572 | E235: of:=1 / ( (LN([.D235])-LN([.$B$2])) / [.$C$2] + 1 / [.$A$2]) -> 299.972440397568 | F235: of:=[.E235]-273 -> 26.9724403975678 | G235: of:=[.A235]*330/16384-[.$E235]*[.$E$2]+[.$F$2]-273 -> 20.4745688460042 | H235: of:=[.B235]*330/16384-[.$E235]*[.$E$2]+[.$F$2]-273 -> 129.702474119442 | I235: of:=[.C235]*330/16384-[.$E235]*[.$E$2]+[.$F$2]-273 -> 113.246785642879
A236: 15199 | B236: 20644 | C236: 16738 | D236: 6571 | E236: of:=1 / ( (LN([.D236])-LN([.$B$2])) / [.$C$2] + 1 / [.$A$2]) -> 300.040920963233 | F236: of:=[.E236]-273 -> 27.0409209632335 | G236: of:=[.A236]*330/16384-[.$E236]*[.$E$2]+[.$F$2]-273 -> 20.5791803059597 | H236: of:=[.B236]*330/16384-[.$E236]*[.$E$2]+[.$F$2]-273 -> 130.250200813772 | I236: of:=[.C236]*330/16384-[.$E236]*[.$E$2]+[.$F$2]-273 -> 51.5771051106472
A237: 15197 | B237: 20637 | C237: 16148 | D237: 6572 | E237: of:=1 / ( (LN([.D237])-LN([.$B$2])) / [.$C$2] + 1 / [.$A$2]) -> 299.972440397568 | F237: of:=[.E237]-273 -> 26.9724403975678 | G237: of:=[.A237]*330/16384-[.$E237]*[.$E$2]+[.$F$2]-273 -> 20.4342856428792 | H237: of:=[.B237]*330/16384-[.$E237]*[.$E$2]+[.$F$2]-273 -> 130.004598142879 | I237: of:=[.C237]*330/16384-[.$E237]*[.$E$2]+[.$F$2]-273 -> 39.5889487288167
A238: 15205 | B238: 20620 | C238: 16497 | D238: 6572 | E238: of:=1 / ( (LN([.D238])-LN([.$B$2])) / [.$C$2] + 1 / [.$A$2]) -> 299.972440397568 | F238: of:=[.E238]-273 -> 26.9724403975678 | G238: of:=[.A238]*330/16384-[.$E238]*[.$E$2]+[.$F$2]-273 -> 20.5954184553792 | H238: of:=[.B238]*330/16384-[.$E238]*[.$E$2]+[.$F$2]-273 -> 129.662190916317 | I238: of:=[.C238]*330/16384-[.$E238]*[.$E$2]+[.$F$2]-273 -> 46.6183676741292
A239: 15203 | B239: 20606 | C239: 19131 | D239: 6572 | E239: of:=1 / ( (LN([.D239])-LN([.$B$2])) / [.$C$2] + 1 / [.$A$2]) -> 299.972440397568 | F239: of:=[.E239]-273 -> 26.9724403975678 | G239: of:=[.A239]*330/16384-[.$E239]*[.$E$2]+[.$F$2]-273 -> 20.5551352522542 | H239: of:=[.B239]*330/16384-[.$E239]*[.$E$2]+[.$F$2]-273 -> 129.380208494442 | I239: of:=[.C239]*330/16384-[.$E239]*[.$E$2]+[.$F$2]-273 -> 99.6713461897542
A240: 15211 | B240: 20624 | C240: 20171 | D240: 6571 | E240: of:=1 / ( (LN([.D240])-LN([.$B$2])) / [.$C$2] + 1 / [.$A$2]) -> 300.040920963233 | F240: of:=[.E240]-273 -> 27.0409209632335 | G240: of:=[.A240]*330/16384-[.$E240]*[.$E$2]+[.$F$2]-273 -> 20.8208795247097 | H240: of:=[.B240]*330/16384-[.$E240]*[.$E$2]+[.$F$2]-273 -> 129.847368782522 | I240: of:=[.C240]*330/16384-[.$E240]*[.$E$2]+[.$F$2]-273 -> 120.72322327471
A241: 15215 | B241: 20602 | C241: 20481 | D241: 6571 | E241: of:=1 / ( (LN([.D241])-LN([.$B$2])) / [.$C$2] + 1 / [.$A$2]) -> 300.040920963233 | F241: of:=[.E241]-273 -> 27.0409209632335 | G241: of:=[.A241]*330/16384-[.$E241]*[.$E$2]+[.$F$2]-273 -> 20.9014459309597 | H241: of:=[.B241]*330/16384-[.$E241]*[.$E$2]+[.$F$2]-273 -> 129.404253548147 | I241: of:=[.C241]*330/16384-[.$E241]*[.$E$2]+[.$F$2]-273 -> 126.967119759085
A242: 15217 | B242: 20607 | C242: 20470 | D242: 6573 | E242: of:=1 / ( (LN([.D242])-LN([.$B$2])) / [.$C$2] + 1 / [.$A$2]) -> 299.90400149655 | F242: of:=[.E242]-273 -> 26.9040014965502 | G242: of:=[.A242]*330/16384-[.$E242]*[.$E$2]+[.$F$2]-273 -> 20.7325698614235 | H242: of:=[.B242]*330/16384-[.$E242]*[.$E$2]+[.$F$2]-273 -> 129.295802283299 | I242: of:=[.C242]*330/16384-[.$E242]*[.$E$2]+[.$F$2]-273 -> 126.536402869236
A243: 15219 | B243: 20596 | C243: 20474 | D243: 6573 | E243: of:=1 / ( (LN([.D243])-LN([.$B$2])) / [.$C$2] + 1 / [.$A$2]) -> 299.90400149655 | F243: of:=[.E243]-273 -> 26.9040014965502 | G243: of:=[.A243]*330/16384-[.$E243]*[.$E$2]+[.$F$2]-273 -> 20.7728530645485 | H243: of:=[.B243]*330/16384-[.$E243]*[.$E$2]+[.$F$2]-273 -> 129.074244666111 | I243: of:=[.C243]*330/16384-[.$E243]*[.$E$2]+[.$F$2]-273 -> 126.616969275486
A244: 15220 | B244: 20559 | C244: 20471 | D244: 6573 | E244: of:=1 / ( (LN([.D244])-LN([.$B$2])) / [.$C$2] + 1 / [.$A$2]) -> 299.90400149655 | F244: of:=[.E244]-273 -> 26.9040014965502 | G244: of:=[.A244]*330/16384-[.$E244]*[.$E$2]+[.$F$2]-273 -> 20.792994666111 | H244: of:=[.B244]*330/16384-[.$E244]*[.$E$2]+[.$F$2]-273 -> 128.329005408298 | I244: of:=[.C244]*330/16384-[.$E244]*[.$E$2]+[.$F$2]-273 -> 126.556544470799
A245: 15214 | B245: 20587 | C245: 20465 | D245: 6572 | E245: of:=1 / ( (LN([.D245])-LN([.$B$2])) / [.$C$2] + 1 / [.$A$2]) -> 299.972440397568 | F245: of:=[.E245]-273 -> 26.9724403975678 | G245: of:=[.A245]*330/16384-[.$E245]*[.$E$2]+[.$F$2]-273 -> 20.7766928694417 | H245: of:=[.B245]*330/16384-[.$E245]*[.$E$2]+[.$F$2]-273 -> 128.997518064754 | I245: of:=[.C245]*330/16384-[.$E245]*[.$E$2]+[.$F$2]-273 -> 126.540242674129
A246: 15215 | B246: 20560 | C246: 20443 | D246: 6572 | E246: of:=1 / ( (LN([.D246])-LN([.$B$2])) / [.$C$2] + 1 / [.$A$2]) -> 299.972440397568 | F246: of:=[.E246]-273 -> 26.9724403975678 | G246: of:=[.A246]*330/16384-[.$E246]*[.$E$2]+[.$F$2]-273 -> 20.7968344710042 | H246: of:=[.B246]*330/16384-[.$E246]*[.$E$2]+[.$F$2]-273 -> 128.453694822567 | I246: of:=[.C246]*330/16384-[.$E246]*[.$E$2]+[.$F$2]-273 -> 126.097127439754
A247: 15217 | B247: 20618 | C247: 20484 | D247: 6573 | E247: of:=1 / ( (LN([.D247])-LN([.$B$2])) / [.$C$2] + 1 / [.$A$2]) -> 299.90400149655 | F247: of:=[.E247]-273 -> 26.9040014965502 | G247: of:=[.A247]*330/16384-[.$E247]*[.$E$2]+[.$F$2]-273 -> 20.7325698614235 | H247: of:=[.B247]*330/16384-[.$E247]*[.$E$2]+[.$F$2]-273 -> 129.517359900486 | I247: of:=[.C247]*330/16384-[.$E247]*[.$E$2]+[.$F$2]-273 -> 126.818385291111
A248: 15215 | B248: 20574 | C248: 20459 | D248: 6572 | E248: of:=1 / ( (LN([.D248])-LN([.$B$2])) / [.$C$2] + 1 / [.$A$2]) -> 299.972440397568 | F248: of:=[.E248]-273 -> 26.9724403975678 | G248: of:=[.A248]*330/16384-[.$E248]*[.$E$2]+[.$F$2]-273 -> 20.7968344710042 | H248: of:=[.B248]*330/16384-[.$E248]*[.$E$2]+[.$F$2]-273 -> 128.735677244442 | I248: of:=[.C248]*330/16384-[.$E248]*[.$E$2]+[.$F$2]-273 -> 126.419393064754
A249: 15215 | B249: 20563 | C249: 20443 | D249: 6572 | E249: of:=1 / ( (LN([.D249])-LN([.$B$2])) / [.$C$2] + 1 / [.$A$2]) -> 299.972440397568 | F249: of:=[.E249]-273 -> 26.9724403975678 | G249: of:=[.A249]*330/16384-[.$E249]*[.$E$2]+[.$F$2]-273 -> 20.7968344710042 | H249: of:=[.B249]*330/16384-[.$E249]*[.$E$2]+[.$F$2]-273 -> 128.514119627254 | I249: of:=[.C249]*330/16384-[.$E249]*[.$E$2]+[.$F$2]-273 -> 126.097127439754
A250: 15231 | B250: 20556 | C250: 20451 | D250: 6569 | E250: of:=1 / ( (LN([.D250])-LN([.$B$2])) / [.$C$2] + 1 / [.$A$2]) -> 300.178007243967 | F250: of:=[.E250]-273 -> 27.1780072439671 | G250: of:=[.A250]*330/16384-[.$E250]*[.$E$2]+[.$F$2]-273 -> 21.4331256550985 | H250: of:=[.B250]*330/16384-[.$E250]*[.$E$2]+[.$F$2]-273 -> 128.687153975411 | I250: of:=[.C250]*330/16384-[.$E250]*[.$E$2]+[.$F$2]-273 -> 126.572285811348
A251: 15234 | B251: 20552 | C251: 20452 | D251: 6570 | E251: of:=1 / ( (LN([.D251])-LN([.$B$2])) / [.$C$2] + 1 / [.$A$2]) -> 300.109443232399 | F251: of:=[.E251]-273 -> 27.1094432323994 | G251: of:=[.A251]*330/16384-[.$E251]*[.$E$2]+[.$F$2]-273 -> 21.3888115272031 | H251: of:=[.B251]*330/16384-[.$E251]*[.$E$2]+[.$F$2]-273 -> 128.501848636578 | I251: of:=[.C251]*330/16384-[.$E251]*[.$E$2]+[.$F$2]-273 -> 126.487688480328
A252: 15237 | B252: 20611 | C252: 20467 | D252: 6571 | E252: of:=1 / ( (LN([.D252])-LN([.$B$2])) / [.$C$2] + 1 / [.$A$2]) -> 300.040920963233 | F252: of:=[.E252]-273 -> 27.0409209632335 | G252: of:=[.A252]*330/16384-[.$E252]*[.$E$2]+[.$F$2]-273 -> 21.3445611653347 | H252: of:=[.B252]*330/16384-[.$E252]*[.$E$2]+[.$F$2]-273 -> 129.58552796221 | I252: of:=[.C252]*330/16384-[.$E252]*[.$E$2]+[.$F$2]-273 -> 126.68513733721
A253: 15235 | B253: 20593 | C253: 20366 | D253: 6572 | E253: of:=1 / ( (LN([.D253])-LN([.$B$2])) / [.$C$2] + 1 / [.$A$2]) -> 299.972440397568 | F253: of:=[.E253]-273 -> 26.9724403975678 | G253: of:=[.A253]*330/16384-[.$E253]*[.$E$2]+[.$F$2]-273 -> 21.1996665022542 | H253: of:=[.B253]*330/16384-[.$E253]*[.$E$2]+[.$F$2]-273 -> 129.118367674129 | I253: of:=[.C253]*330/16384-[.$E253]*[.$E$2]+[.$F$2]-273 -> 124.546224119442
A254: 15240 | B254: 20538 | C254: 20331 | D254: 6571 | E254: of:=1 / ( (LN([.D254])-LN([.$B$2])) / [.$C$2] + 1 / [.$A$2]) -> 300.040920963233 | F254: of:=[.E254]-273 -> 27.0409209632335 | G254: of:=[.A254]*330/16384-[.$E254]*[.$E$2]+[.$F$2]-273 -> 21.4049859700222 | H254: of:=[.B254]*330/16384-[.$E254]*[.$E$2]+[.$F$2]-273 -> 128.115191048147 | I254: of:=[.C254]*330/16384-[.$E254]*[.$E$2]+[.$F$2]-273 -> 123.94587952471
A255: 15240 | B255: 20551 | C255: 20318 | D255: 6571 | E255: of:=1 / ( (LN([.D255])-LN([.$B$2])) / [.$C$2] + 1 / [.$A$2]) -> 300.040920963233 | F255: of:=[.E255]-273 -> 27.0409209632335 | G255: of:=[.A255]*330/16384-[.$E255]*[.$E$2]+[.$F$2]-273 -> 21.4049859700222 | H255: of:=[.B255]*330/16384-[.$E255]*[.$E$2]+[.$F$2]-273 -> 128.37703186846 | I255: of:=[.C255]*330/16384-[.$E255]*[.$E$2]+[.$F$2]-273 -> 123.684038704397
A256: 15251 | B256: 20565 | C256: 20230 | D256: 6572 | E256: of:=1 / ( (LN([.D256])-LN([.$B$2])) / [.$C$2] + 1 / [.$A$2]) -> 299.972440397568 | F256: of:=[.E256]-273 -> 26.9724403975678 | G256: of:=[.A256]*330/16384-[.$E256]*[.$E$2]+[.$F$2]-273 -> 21.5219321272542 | H256: of:=[.B256]*330/16384-[.$E256]*[.$E$2]+[.$F$2]-273 -> 128.554402830379 | I256: of:=[.C256]*330/16384-[.$E256]*[.$E$2]+[.$F$2]-273 -> 121.806966306942
A257: 15246 | B257: 20485 | C257: 20176 | D257: 6572 | E257: of:=1 / ( (LN([.D257])-LN([.$B$2])) / [.$C$2] + 1 / [.$A$2]) -> 299.972440397568 | F257: of:=[.E257]-273 -> 26.9724403975678 | G257: of:=[.A257]*330/16384-[.$E257]*[.$E$2]+[.$F$2]-273 -> 21.4212241194417 | H257: of:=[.B257]*330/16384-[.$E257]*[.$E$2]+[.$F$2]-273 -> 126.943074705379 | I257: of:=[.C257]*330/16384-[.$E257]*[.$E$2]+[.$F$2]-273 -> 120.719319822567
A258: 15245 | B258: 20470 | C258: 20071 | D258: 6572 | E258: of:=1 / ( (LN([.D258])-LN([.$B$2])) / [.$C$2] + 1 / [.$A$2]) -> 299.972440397568 | F258: of:=[.E258]-273 -> 26.9724403975678 | G258: of:=[.A258]*330/16384-[.$E258]*[.$E$2]+[.$F$2]-273 -> 21.4010825178792 | H258: of:=[.B258]*330/16384-[.$E258]*[.$E$2]+[.$F$2]-273 -> 126.640950681942 | I258: of:=[.C258]*330/16384-[.$E258]*[.$E$2]+[.$F$2]-273 -> 118.604451658504
A259: 15253 | B259: 20443 | C259: 20170 | D259: 6572 | E259: of:=1 / ( (LN([.D259])-LN([.$B$2])) / [.$C$2] + 1 / [.$A$2]) -> 299.972440397568 | F259: of:=[.E259]-273 -> 26.9724403975678 | G259: of:=[.A259]*330/16384-[.$E259]*[.$E$2]+[.$F$2]-273 -> 21.5622153303792 | H259: of:=[.B259]*330/16384-[.$E259]*[.$E$2]+[.$F$2]-273 -> 126.097127439754 | I259: of:=[.C259]*330/16384-[.$E259]*[.$E$2]+[.$F$2]-273 -> 120.598470213192
A260: 15250 | B260: 20427 | C260: 20201 | D260: 6571 | E260: of:=1 / ( (LN([.D260])-LN([.$B$2])) / [.$C$2] + 1 / [.$A$2]) -> 300.040920963233 | F260: of:=[.E260]-273 -> 27.0409209632335 | G260: of:=[.A260]*330/16384-[.$E260]*[.$E$2]+[.$F$2]-273 -> 21.6064019856472 | H260: of:=[.B260]*330/16384-[.$E260]*[.$E$2]+[.$F$2]-273 -> 125.87947327471 | I260: of:=[.C260]*330/16384-[.$E260]*[.$E$2]+[.$F$2]-273 -> 121.327471321585
A261: 15249 | B261: 20399 | C261: 20204 | D261: 6571 | E261: of:=1 / ( (LN([.D261])-LN([.$B$2])) / [.$C$2] + 1 / [.$A$2]) -> 300.040920963233 | F261: of:=[.E261]-273 -> 27.0409209632335 | G261: of:=[.A261]*330/16384-[.$E261]*[.$E$2]+[.$F$2]-273 -> 21.5862603840847 | H261: of:=[.B261]*330/16384-[.$E261]*[.$E$2]+[.$F$2]-273 -> 125.31550843096 | I261: of:=[.C261]*330/16384-[.$E261]*[.$E$2]+[.$F$2]-273 -> 121.387896126272
A262: 15247 | B262: 20436 | C262: 20170 | D262: 6572 | E262: of:=1 / ( (LN([.D262])-LN([.$B$2])) / [.$C$2] + 1 / [.$A$2]) -> 299.972440397568 | F262: of:=[.E262]-273 -> 26.9724403975678 | G262: of:=[.A262]*330/16384-[.$E262]*[.$E$2]+[.$F$2]-273 -> 21.4413657210042 | H262: of:=[.B262]*330/16384-[.$E262]*[.$E$2]+[.$F$2]-273 -> 125.956136228817 | I262: of:=[.C262]*330/16384-[.$E262]*[.$E$2]+[.$F$2]-273 -> 120.598470213192
A263: 15246 | B263: 20467 | C263: 20102 | D263: 6571 | E263: of:=1 / ( (LN([.D263])-LN([.$B$2])) / [.$C$2] + 1 / [.$A$2]) -> 300.040920963233 | F263: of:=[.E263]-273 -> 27.0409209632335 | G263: of:=[.A263]*330/16384-[.$E263]*[.$E$2]+[.$F$2]-273 -> 21.5258355793972 | H263: of:=[.B263]*330/16384-[.$E263]*[.$E$2]+[.$F$2]-273 -> 126.68513733721 | I263: of:=[.C263]*330/16384-[.$E263]*[.$E$2]+[.$F$2]-273 -> 119.333452766897
A264: 15246 | B264: 20464 | C264: 20104 | D264: 6572 | E264: of:=1 / ( (LN([.D264])-LN([.$B$2])) / [.$C$2] + 1 / [.$A$2]) -> 299.972440397568 | F264: of:=[.E264]-273 -> 26.9724403975678 | G264: of:=[.A264]*330/16384-[.$E264]*[.$E$2]+[.$F$2]-273 -> 21.4212241194417 | H264: of:=[.B264]*330/16384-[.$E264]*[.$E$2]+[.$F$2]-273 -> 126.520101072567 | I264: of:=[.C264]*330/16384-[.$E264]*[.$E$2]+[.$F$2]-273 -> 119.269124510067
A265: 15248 | B265: 20473 | C265: 20153 | D265: 6572 | E265: of:=1 / ( (LN([.D265])-LN([.$B$2])) / [.$C$2] + 1 / [.$A$2]) -> 299.972440397568 | F265: of:=[.E265]-273 -> 26.9724403975678 | G265: of:=[.A265]*330/16384-[.$E265]*[.$E$2]+[.$F$2]-273 -> 21.4615073225667 | H265: of:=[.B265]*330/16384-[.$E265]*[.$E$2]+[.$F$2]-273 -> 126.701375486629 | I265: of:=[.C265]*330/16384-[.$E265]*[.$E$2]+[.$F$2]-273 -> 120.256062986629
A266: 15247 | B266: 20456 | C266: 20201 | D266: 6571 | E266: of:=1 / ( (LN([.D266])-LN([.$B$2])) / [.$C$2] + 1 / [.$A$2]) -> 300.040920963233 | F266: of:=[.E266]-273 -> 27.0409209632335 | G266: of:=[.A266]*330/16384-[.$E266]*[.$E$2]+[.$F$2]-273 -> 21.5459771809597 | H266: of:=[.B266]*330/16384-[.$E266]*[.$E$2]+[.$F$2]-273 -> 126.463579720022 | I266: of:=[.C266]*330/16384-[.$E266]*[.$E$2]+[.$F$2]-273 -> 121.327471321585
A267: 15233 | B267: 20437 | C267: 20200 | D267: 6571 | E267: of:=1 / ( (LN([.D267])-LN([.$B$2])) / [.$C$2] + 1 / [.$A$2]) -> 300.040920963233 | F267: of:=[.E267]-273 -> 27.0409209632335 | G267: of:=[.A267]*330/16384-[.$E267]*[.$E$2]+[.$F$2]-273 -> 21.2639947590847 | H267: of:=[.B267]*330/16384-[.$E267]*[.$E$2]+[.$F$2]-273 -> 126.080889290335 | I267: of:=[.C267]*330/16384-[.$E267]*[.$E$2]+[.$F$2]-273 -> 121.307329720022
A268: 15225 | B268: 20382 | C268: 20174 | D268: 6571 | E268: of:=1 / ( (LN([.D268])-LN([.$B$2])) / [.$C$2] + 1 / [.$A$2]) -> 300.040920963233 | F268: of:=[.E268]-273 -> 27.0409209632335 | G268: of:=[.A268]*330/16384-[.$E268]*[.$E$2]+[.$F$2]-273 -> 21.1028619465847 | H268: of:=[.B268]*330/16384-[.$E268]*[.$E$2]+[.$F$2]-273 -> 124.973101204397 | I268: of:=[.C268]*330/16384-[.$E268]*[.$E$2]+[.$F$2]-273 -> 120.783648079397
A269: 15221 | B269: 20441 | C269: 19944 | D269: 6572 | E269: of:=1 / ( (LN([.D269])-LN([.$B$2])) / [.$C$2] + 1 / [.$A$2]) -> 299.972440397568 | F269: of:=[.E269]-273 -> 26.9724403975678 | G269: of:=[.A269]*330/16384-[.$E269]*[.$E$2]+[.$F$2]-273 -> 20.9176840803792 | H269: of:=[.B269]*330/16384-[.$E269]*[.$E$2]+[.$F$2]-273 -> 126.056844236629 | I269: of:=[.C269]*330/16384-[.$E269]*[.$E$2]+[.$F$2]-273 -> 116.046468260067
A270: 15221 | B270: 20437 | C270: 19950 | D270: 6571 | E270: of:=1 / ( (LN([.D270])-LN([.$B$2])) / [.$C$2] + 1 / [.$A$2]) -> 300.040920963233 | F270: of:=[.E270]-273 -> 27.0409209632335 | G270: of:=[.A270]*330/16384-[.$E270]*[.$E$2]+[.$F$2]-273 -> 21.0222955403347 | H270: of:=[.B270]*330/16384-[.$E270]*[.$E$2]+[.$F$2]-273 -> 126.080889290335 | I270: of:=[.C270]*330/16384-[.$E270]*[.$E$2]+[.$F$2]-273 -> 116.271929329397
A271: 15225 | B271: 20337 | C271: 19893 | D271: 6571 | E271: of:=1 / ( (LN([.D271])-LN([.$B$2])) / [.$C$2] + 1 / [.$A$2]) -> 300.040920963233 | F271: of:=[.E271]-273 -> 27.0409209632335 | G271: of:=[.A271]*330/16384-[.$E271]*[.$E$2]+[.$F$2]-273 -> 21.1028619465847 | H271: of:=[.B271]*330/16384-[.$E271]*[.$E$2]+[.$F$2]-273 -> 124.066729134085 | I271: of:=[.C271]*330/16384-[.$E271]*[.$E$2]+[.$F$2]-273 -> 115.123858040335
A272: 15225 | B272: 20332 | C272: 20078 | D272: 6571 | E272: of:=1 / ( (LN([.D272])-LN([.$B$2])) / [.$C$2] + 1 / [.$A$2]) -> 300.040920963233 | F272: of:=[.E272]-273 -> 27.0409209632335 | G272: of:=[.A272]*330/16384-[.$E272]*[.$E$2]+[.$F$2]-273 -> 21.1028619465847 | H272: of:=[.B272]*330/16384-[.$E272]*[.$E$2]+[.$F$2]-273 -> 123.966021126272 | I272: of:=[.C272]*330/16384-[.$E272]*[.$E$2]+[.$F$2]-273 -> 118.850054329397
A273: 15225 | B273: 20321 | C273: 20087 | D273: 6571 | E273: of:=1 / ( (LN([.D273])-LN([.$B$2])) / [.$C$2] + 1 / [.$A$2]) -> 300.040920963233 | F273: of:=[.E273]-273 -> 27.0409209632335 | G273: of:=[.A273]*330/16384-[.$E273]*[.$E$2]+[.$F$2]-273 -> 21.1028619465847 | H273: of:=[.B273]*330/16384-[.$E273]*[.$E$2]+[.$F$2]-273 -> 123.744463509085 | I273: of:=[.C273]*330/16384-[.$E273]*[.$E$2]+[.$F$2]-273 -> 119.03132874346
A274: 15227 | B274: 20292 | C274: 20099 | D274: 6572 | E274: of:=1 / ( (LN([.D274])-LN([.$B$2])) / [.$C$2] + 1 / [.$A$2]) -> 299.972440397568 | F274: of:=[.E274]-273 -> 26.9724403975678 | G274: of:=[.A274]*330/16384-[.$E274]*[.$E$2]+[.$F$2]-273 -> 21.0385336897542 | H274: of:=[.B274]*330/16384-[.$E274]*[.$E$2]+[.$F$2]-273 -> 123.055745603817 | I274: of:=[.C274]*330/16384-[.$E274]*[.$E$2]+[.$F$2]-273 -> 119.168416502254
A275: 15232 | B275: 20265 | C275: 19962 | D275: 6571 | E275: of:=1 / ( (LN([.D275])-LN([.$B$2])) / [.$C$2] + 1 / [.$A$2]) -> 300.040920963233 | F275: of:=[.E275]-273 -> 27.0409209632335 | G275: of:=[.A275]*330/16384-[.$E275]*[.$E$2]+[.$F$2]-273 -> 21.2438531575222 | H275: of:=[.B275]*330/16384-[.$E275]*[.$E$2]+[.$F$2]-273 -> 122.616533821585 | I275: of:=[.C275]*330/16384-[.$E275]*[.$E$2]+[.$F$2]-273 -> 116.513628548147
A276: 15230 | B276: 20331 | C276: 20140 | D276: 6571 | E276: of:=1 / ( (LN([.D276])-LN([.$B$2])) / [.$C$2] + 1 / [.$A$2]) -> 300.040920963233 | F276: of:=[.E276]-273 -> 27.0409209632335 | G276: of:=[.A276]*330/16384-[.$E276]*[.$E$2]+[.$F$2]-273 -> 21.2035699543972 | H276: of:=[.B276]*330/16384-[.$E276]*[.$E$2]+[.$F$2]-273 -> 123.94587952471 | I276: of:=[.C276]*330/16384-[.$E276]*[.$E$2]+[.$F$2]-273 -> 120.098833626272
A277: 15236 | B277: 20299 | C277: 20104 | D277: 6571 | E277: of:=1 / ( (LN([.D277])-LN([.$B$2])) / [.$C$2] + 1 / [.$A$2]) -> 300.040920963233 | F277: of:=[.E277]-273 -> 27.0409209632335 | G277: of:=[.A277]*330/16384-[.$E277]*[.$E$2]+[.$F$2]-273 -> 21.3244195637722 | H277: of:=[.B277]*330/16384-[.$E277]*[.$E$2]+[.$F$2]-273 -> 123.30134827471 | I277: of:=[.C277]*330/16384-[.$E277]*[.$E$2]+[.$F$2]-273 -> 119.373735970022
A278: 15235 | B278: 20338 | C278: 20023 | D278: 6570 | E278: of:=1 / ( (LN([.D278])-LN([.$B$2])) / [.$C$2] + 1 / [.$A$2]) -> 300.109443232399 | F278: of:=[.E278]-273 -> 27.1094432323994 | G278: of:=[.A278]*330/16384-[.$E278]*[.$E$2]+[.$F$2]-273 -> 21.4089531287656 | H278: of:=[.B278]*330/16384-[.$E278]*[.$E$2]+[.$F$2]-273 -> 124.191545902203 | I278: of:=[.C278]*330/16384-[.$E278]*[.$E$2]+[.$F$2]-273 -> 117.846941410016
A279: 15236 | B279: 20291 | C279: 20061 | D279: 6571 | E279: of:=1 / ( (LN([.D279])-LN([.$B$2])) / [.$C$2] + 1 / [.$A$2]) -> 300.040920963233 | F279: of:=[.E279]-273 -> 27.0409209632335 | G279: of:=[.A279]*330/16384-[.$E279]*[.$E$2]+[.$F$2]-273 -> 21.3244195637722 | H279: of:=[.B279]*330/16384-[.$E279]*[.$E$2]+[.$F$2]-273 -> 123.14021546221 | I279: of:=[.C279]*330/16384-[.$E279]*[.$E$2]+[.$F$2]-273 -> 118.507647102835
A280: 15241 | B280: 20264 | C280: 20080 | D280: 6571 | E280: of:=1 / ( (LN([.D280])-LN([.$B$2])) / [.$C$2] + 1 / [.$A$2]) -> 300.040920963233 | F280: of:=[.E280]-273 -> 27.0409209632335 | G280: of:=[.A280]*330/16384-[.$E280]*[.$E$2]+[.$F$2]-273 -> 21.4251275715847 | H280: of:=[.B280]*330/16384-[.$E280]*[.$E$2]+[.$F$2]-273 -> 122.596392220022 | I280: of:=[.C280]*330/16384-[.$E280]*[.$E$2]+[.$F$2]-273 -> 118.890337532522
A281: 15247 | B281: 20268 | C281: 20108 | D281: 6571 | E281: of:=1 / ( (LN([.D281])-LN([.$B$2])) / [.$C$2] + 1 / [.$A$2]) -> 300.040920963233 | F281: of:=[.E281]-273 -> 27.0409209632335 | G281: of:=[.A281]*330/16384-[.$E281]*[.$E$2]+[.$F$2]-273 -> 21.5459771809597 | H281: of:=[.B281]*330/16384-[.$E281]*[.$E$2]+[.$F$2]-273 -> 122.676958626272 | I281: of:=[.C281]*330/16384-[.$E281]*[.$E$2]+[.$F$2]-273 -> 119.454302376272
A282: 15243 | B282: 20273 | C282: 20131 | D282: 6572 | E282: of:=1 / ( (LN([.D282])-LN([.$B$2])) / [.$C$2] + 1 / [.$A$2]) -> 299.972440397568 | F282: of:=[.E282]-273 -> 26.9724403975678 | G282: of:=[.A282]*330/16384-[.$E282]*[.$E$2]+[.$F$2]-273 -> 21.3607993147542 | H282: of:=[.B282]*330/16384-[.$E282]*[.$E$2]+[.$F$2]-273 -> 122.673055174129 | I282: of:=[.C282]*330/16384-[.$E282]*[.$E$2]+[.$F$2]-273 -> 119.812947752254
A283: 15250 | B283: 20277 | C283: 20102 | D283: 6571 | E283: of:=1 / ( (LN([.D283])-LN([.$B$2])) / [.$C$2] + 1 / [.$A$2]) -> 300.040920963233 | F283: of:=[.E283]-273 -> 27.0409209632335 | G283: of:=[.A283]*330/16384-[.$E283]*[.$E$2]+[.$F$2]-273 -> 21.6064019856472 | H283: of:=[.B283]*330/16384-[.$E283]*[.$E$2]+[.$F$2]-273 -> 122.858233040335 | I283: of:=[.C283]*330/16384-[.$E283]*[.$E$2]+[.$F$2]-273 -> 119.333452766897
A284: 15251 | B284: 20254 | C284: 20141 | D284: 6571 | E284: of:=1 / ( (LN([.D284])-LN([.$B$2])) / [.$C$2] + 1 / [.$A$2]) -> 300.040920963233 | F284: of:=[.E284]-273 -> 27.0409209632335 | G284: of:=[.A284]*330/16384-[.$E284]*[.$E$2]+[.$F$2]-273 -> 21.6265435872097 | H284: of:=[.B284]*330/16384-[.$E284]*[.$E$2]+[.$F$2]-273 -> 122.394976204397 | I284: of:=[.C284]*330/16384-[.$E284]*[.$E$2]+[.$F$2]-273 -> 120.118975227835
A285: 15252 | B285: 20292 | C285: 20192 | D285: 6571 | E285: of:=1 / ( (LN([.D285])-LN([.$B$2])) / [.$C$2] + 1 / [.$A$2]) -> 300.040920963233 | F285: of:=[.E285]-273 -> 27.0409209632335 | G285: of:=[.A285]*330/16384-[.$E285]*[.$E$2]+[.$F$2]-273 -> 21.6466851887722 | H285: of:=[.B285]*330/16384-[.$E285]*[.$E$2]+[.$F$2]-273 -> 123.160357063772 | I285: of:=[.C285]*330/16384-[.$E285]*[.$E$2]+[.$F$2]-273 -> 121.146196907522
A286: 15253 | B286: 20304 | C286: 20148 | D286: 6571 | E286: of:=1 / ( (LN([.D286])-LN([.$B$2])) / [.$C$2] + 1 / [.$A$2]) -> 300.040920963233 | F286: of:=[.E286]-273 -> 27.0409209632335 | G286: of:=[.A286]*330/16384-[.$E286]*[.$E$2]+[.$F$2]-273 -> 21.6668267903347 | H286: of:=[.B286]*330/16384-[.$E286]*[.$E$2]+[.$F$2]-273 -> 123.402056282522 | I286: of:=[.C286]*330/16384-[.$E286]*[.$E$2]+[.$F$2]-273 -> 120.259966438772
A287: 15275 | B287: 20295 | C287: 20047 | D287: 6568 | E287: of:=1 / ( (LN([.D287])-LN([.$B$2])) / [.$C$2] + 1 / [.$A$2]) -> 300.246613036885 | F287: of:=[.E287]-273 -> 27.2466130368854 | G287: of:=[.A287]*330/16384-[.$E287]*[.$E$2]+[.$F$2]-273 -> 22.4241588819569 | H287: of:=[.B287]*330/16384-[.$E287]*[.$E$2]+[.$F$2]-273 -> 123.534998725707 | I287: of:=[.C287]*330/16384-[.$E287]*[.$E$2]+[.$F$2]-273 -> 118.539881538207
A288: 15277 | B288: 20233 | C288: 18871 | D288: 6570 | E288: of:=1 / ( (LN([.D288])-LN([.$B$2])) / [.$C$2] + 1 / [.$A$2]) -> 300.109443232399 | F288: of:=[.E288]-273 -> 27.1094432323994 | G288: of:=[.A288]*330/16384-[.$E288]*[.$E$2]+[.$F$2]-273 -> 22.2549003943906 | H288: of:=[.B288]*330/16384-[.$E288]*[.$E$2]+[.$F$2]-273 -> 122.076677738141 | I288: of:=[.C288]*330/16384-[.$E288]*[.$E$2]+[.$F$2]-273 -> 94.6438164100156
A289: 15272 | B289: 20260 | C289: 17807 | D289: 6570 | E289: of:=1 / ( (LN([.D289])-LN([.$B$2])) / [.$C$2] + 1 / [.$A$2]) -> 300.109443232399 | F289: of:=[.E289]-273 -> 27.1094432323994 | G289: of:=[.A289]*330/16384-[.$E289]*[.$E$2]+[.$F$2]-273 -> 22.1541923865781 | H289: of:=[.B289]*330/16384-[.$E289]*[.$E$2]+[.$F$2]-273 -> 122.620500980328 | I289: of:=[.C289]*330/16384-[.$E289]*[.$E$2]+[.$F$2]-273 -> 73.2131523475156
A290: 15261 | B290: 20070 | C290: 16972 | D290: 6571 | E290: of:=1 / ( (LN([.D290])-LN([.$B$2])) / [.$C$2] + 1 / [.$A$2]) -> 300.040920963233 | F290: of:=[.E290]-273 -> 27.0409209632335 | G290: of:=[.A290]*330/16384-[.$E290]*[.$E$2]+[.$F$2]-273 -> 21.8279596028347 | H290: of:=[.B290]*330/16384-[.$E290]*[.$E$2]+[.$F$2]-273 -> 118.688921516897 | I290: of:=[.C290]*330/16384-[.$E290]*[.$E$2]+[.$F$2]-273 -> 56.2902398762722
A291: 15227 | B291: 20181 | C291: 15812 | D291: 6570 | E291: of:=1 / ( (LN([.D291])-LN([.$B$2])) / [.$C$2] + 1 / [.$A$2]) -> 300.109443232399 | F291: of:=[.E291]-273 -> 27.1094432323994 | G291: of:=[.A291]*330/16384-[.$E291]*[.$E$2]+[.$F$2]-273 -> 21.2478203162656 | H291: of:=[.B291]*330/16384-[.$E291]*[.$E$2]+[.$F$2]-273 -> 121.029314456891 | I291: of:=[.C291]*330/16384-[.$E291]*[.$E$2]+[.$F$2]-273 -> 33.0306572303281
A292: 15106 | B292: 19847 | C292: 16576 | D292: 6571 | E292: of:=1 / ( (LN([.D292])-LN([.$B$2])) / [.$C$2] + 1 / [.$A$2]) -> 300.040920963233 | F292: of:=[.E292]-273 -> 27.0409209632335 | G292: of:=[.A292]*330/16384-[.$E292]*[.$E$2]+[.$F$2]-273 -> 18.7060113606472 | H292: of:=[.B292]*330/16384-[.$E292]*[.$E$2]+[.$F$2]-273 -> 114.19734436846 | I292: of:=[.C292]*330/16384-[.$E292]*[.$E$2]+[.$F$2]-273 -> 48.3141656575222
A293: 15088 | B293: 19245 | C293: 16032 | D293: 6571 | E293: of:=1 / ( (LN([.D293])-LN([.$B$2])) / [.$C$2] + 1 / [.$A$2]) -> 300.040920963233 | F293: of:=[.E293]-273 -> 27.0409209632335 | G293: of:=[.A293]*330/16384-[.$E293]*[.$E$2]+[.$F$2]-273 -> 18.3434625325222 | H293: of:=[.B293]*330/16384-[.$E293]*[.$E$2]+[.$F$2]-273 -> 102.072100227835 | I293: of:=[.C293]*330/16384-[.$E293]*[.$E$2]+[.$F$2]-273 -> 37.3571344075222
A294: 15083 | B294: 19187 | C294: 15726 | D294: 6571 | E294: of:=1 / ( (LN([.D294])-LN([.$B$2])) / [.$C$2] + 1 / [.$A$2]) -> 300.040920963233 | F294: of:=[.E294]-273 -> 27.0409209632335 | G294: of:=[.A294]*330/16384-[.$E294]*[.$E$2]+[.$F$2]-273 -> 18.2427545247097 | H294: of:=[.B294]*330/16384-[.$E294]*[.$E$2]+[.$F$2]-273 -> 100.90388733721 | I294: of:=[.C294]*330/16384-[.$E294]*[.$E$2]+[.$F$2]-273 -> 31.1938043293972
A295: 15111 | B295: 19099 | C295: 15289 | D295: 6571 | E295: of:=1 / ( (LN([.D295])-LN([.$B$2])) / [.$C$2] + 1 / [.$A$2]) -> 300.040920963233 | F295: of:=[.E295]-273 -> 27.0409209632335 | G295: of:=[.A295]*330/16384-[.$E295]*[.$E$2]+[.$F$2]-273 -> 18.8067193684597 | H295: of:=[.B295]*330/16384-[.$E295]*[.$E$2]+[.$F$2]-273 -> 99.1314263997097 | I295: of:=[.C295]*330/16384-[.$E295]*[.$E$2]+[.$F$2]-273 -> 22.3919244465847
A296: 15108 | B296: 17753 | C296: 15265 | D296: 6570 | E296: of:=1 / ( (LN([.D296])-LN([.$B$2])) / [.$C$2] + 1 / [.$A$2]) -> 300.109443232399 | F296: of:=[.E296]-273 -> 27.1094432323994 | G296: of:=[.A296]*330/16384-[.$E296]*[.$E$2]+[.$F$2]-273 -> 18.8509697303281 | H296: of:=[.B296]*330/16384-[.$E296]*[.$E$2]+[.$F$2]-273 -> 72.1255058631406 | I296: of:=[.C296]*330/16384-[.$E296]*[.$E$2]+[.$F$2]-273 -> 22.0132011756406
A297: 15099 | B297: 17744 | C297: 15270 | D297: 6570 | E297: of:=1 / ( (LN([.D297])-LN([.$B$2])) / [.$C$2] + 1 / [.$A$2]) -> 300.109443232399 | F297: of:=[.E297]-273 -> 27.1094432323994 | G297: of:=[.A297]*330/16384-[.$E297]*[.$E$2]+[.$F$2]-273 -> 18.6696953162656 | H297: of:=[.B297]*330/16384-[.$E297]*[.$E$2]+[.$F$2]-273 -> 71.9442314490781 | I297: of:=[.C297]*330/16384-[.$E297]*[.$E$2]+[.$F$2]-273 -> 22.1139091834531
A298: 15097 | B298: 17028 | C298: 15271 | D298: 6571 | E298: of:=1 / ( (LN([.D298])-LN([.$B$2])) / [.$C$2] + 1 / [.$A$2]) -> 300.040920963233 | F298: of:=[.E298]-273 -> 27.0409209632335 | G298: of:=[.A298]*330/16384-[.$E298]*[.$E$2]+[.$F$2]-273 -> 18.5247369465847 | H298: of:=[.B298]*330/16384-[.$E298]*[.$E$2]+[.$F$2]-273 -> 57.4181695637722 | I298: of:=[.C298]*330/16384-[.$E298]*[.$E$2]+[.$F$2]-273 -> 22.0293756184597
A299: 15096 | B299: 15754 | C299: 15272 | D299: 6571 | E299: of:=1 / ( (LN([.D299])-LN([.$B$2])) / [.$C$2] + 1 / [.$A$2]) -> 300.040920963233 | F299: of:=[.E299]-273 -> 27.0409209632335 | G299: of:=[.A299]*330/16384-[.$E299]*[.$E$2]+[.$F$2]-273 -> 18.5045953450222 | H299: of:=[.B299]*330/16384-[.$E299]*[.$E$2]+[.$F$2]-273 -> 31.7577691731472 | I299: of:=[.C299]*330/16384-[.$E299]*[.$E$2]+[.$F$2]-273 -> 22.0495172200222
A300: 15102 | B300: 17054 | C300: 15314 | D300: 6571 | E300: of:=1 / ( (LN([.D300])-LN([.$B$2])) / [.$C$2] + 1 / [.$A$2]) -> 300.040920963233 | F300: of:=[.E300]-273 -> 27.0409209632335 | G300: of:=[.A300]*330/16384-[.$E300]*[.$E$2]+[.$F$2]-273 -> 18.6254449543972 | H300: of:=[.B300]*330/16384-[.$E300]*[.$E$2]+[.$F$2]-273 -> 57.9418512043972 | I300: of:=[.C300]*330/16384-[.$E300]*[.$E$2]+[.$F$2]-273 -> 22.8954644856472
A301: 15106 | B301: 15853 | C301: 15293 | D301: 6571 | E301: of:=1 / ( (LN([.D301])-LN([.$B$2])) / [.$C$2] + 1 / [.$A$2]) -> 300.040920963233 | F301: of:=[.E301]-273 -> 27.0409209632335 | G301: of:=[.A301]*330/16384-[.$E301]*[.$E$2]+[.$F$2]-273 -> 18.7060113606472 | H301: of:=[.B301]*330/16384-[.$E301]*[.$E$2]+[.$F$2]-273 -> 33.7517877278347 | I301: of:=[.C301]*330/16384-[.$E301]*[.$E$2]+[.$F$2]-273 -> 22.4724908528347
A302: 15165 | B302: 16337 | C302: 15367 | D302: 6571 | E302: of:=1 / ( (LN([.D302])-LN([.$B$2])) / [.$C$2] + 1 / [.$A$2]) -> 300.040920963233 | F302: of:=[.E302]-273 -> 27.0409209632335 | G302: of:=[.A302]*330/16384-[.$E302]*[.$E$2]+[.$F$2]-273 -> 19.8943658528347 | H302: of:=[.B302]*330/16384-[.$E302]*[.$E$2]+[.$F$2]-273 -> 43.5003228840847 | I302: of:=[.C302]*330/16384-[.$E302]*[.$E$2]+[.$F$2]-273 -> 23.9629693684597
A303: 15131 | B303: 17960 | C303: 15370 | D303: 6572 | E303: of:=1 / ( (LN([.D303])-LN([.$B$2])) / [.$C$2] + 1 / [.$A$2]) -> 299.972440397568 | F303: of:=[.E303]-273 -> 26.9724403975678 | G303: of:=[.A303]*330/16384-[.$E303]*[.$E$2]+[.$F$2]-273 -> 19.1049399397542 | H303: of:=[.B303]*330/16384-[.$E303]*[.$E$2]+[.$F$2]-273 -> 76.0855307600667 | I303: of:=[.C303]*330/16384-[.$E303]*[.$E$2]+[.$F$2]-273 -> 23.9187827131917
A304: 15188 | B304: 18079 | C304: 15337 | D304: 6572 | E304: of:=1 / ( (LN([.D304])-LN([.$B$2])) / [.$C$2] + 1 / [.$A$2]) -> 299.972440397568 | F304: of:=[.E304]-273 -> 26.9724403975678 | G304: of:=[.A304]*330/16384-[.$E304]*[.$E$2]+[.$F$2]-273 -> 20.2530112288167 | H304: of:=[.B304]*330/16384-[.$E304]*[.$E$2]+[.$F$2]-273 -> 78.4823813460042 | I304: of:=[.C304]*330/16384-[.$E304]*[.$E$2]+[.$F$2]-273 -> 23.2541098616292
A305: 15244 | B305: 18038 | C305: 15378 | D305: 6571 | E305: of:=1 / ( (LN([.D305])-LN([.$B$2])) / [.$C$2] + 1 / [.$A$2]) -> 300.040920963233 | F305: of:=[.E305]-273 -> 27.0409209632335 | G305: of:=[.A305]*330/16384-[.$E305]*[.$E$2]+[.$F$2]-273 -> 21.4855523762722 | H305: of:=[.B305]*330/16384-[.$E305]*[.$E$2]+[.$F$2]-273 -> 77.7611871418972 | I305: of:=[.C305]*330/16384-[.$E305]*[.$E$2]+[.$F$2]-273 -> 24.1845269856472
A306: 15227 | B306: 18032 | C306: 15271 | D306: 6571 | E306: of:=1 / ( (LN([.D306])-LN([.$B$2])) / [.$C$2] + 1 / [.$A$2]) -> 300.040920963233 | F306: of:=[.E306]-273 -> 27.0409209632335 | G306: of:=[.A306]*330/16384-[.$E306]*[.$E$2]+[.$F$2]-273 -> 21.1431451497097 | H306: of:=[.B306]*330/16384-[.$E306]*[.$E$2]+[.$F$2]-273 -> 77.6403375325222 | I306: of:=[.C306]*330/16384-[.$E306]*[.$E$2]+[.$F$2]-273 -> 22.0293756184597
A307: 15184 | B307: 18042 | C307: 15334 | D307: 6571 | E307: of:=1 / ( (LN([.D307])-LN([.$B$2])) / [.$C$2] + 1 / [.$A$2]) -> 300.040920963233 | F307: of:=[.E307]-273 -> 27.0409209632335 | G307: of:=[.A307]*330/16384-[.$E307]*[.$E$2]+[.$F$2]-273 -> 20.2770562825222 | H307: of:=[.B307]*330/16384-[.$E307]*[.$E$2]+[.$F$2]-273 -> 77.8417535481472 | I307: of:=[.C307]*330/16384-[.$E307]*[.$E$2]+[.$F$2]-273 -> 23.2982965168972
A308: 15253 | B308: 18098 | C308: 15493 | D308: 6571 | E308: of:=1 / ( (LN([.D308])-LN([.$B$2])) / [.$C$2] + 1 / [.$A$2]) -> 300.040920963233 | F308: of:=[.E308]-273 -> 27.0409209632335 | G308: of:=[.A308]*330/16384-[.$E308]*[.$E$2]+[.$F$2]-273 -> 21.6668267903347 | H308: of:=[.B308]*330/16384-[.$E308]*[.$E$2]+[.$F$2]-273 -> 78.9696832356472 | I308: of:=[.C308]*330/16384-[.$E308]*[.$E$2]+[.$F$2]-273 -> 26.5008111653347
A309: 15241 | B309: 15897 | C309: 15359 | D309: 6571 | E309: of:=1 / ( (LN([.D309])-LN([.$B$2])) / [.$C$2] + 1 / [.$A$2]) -> 300.040920963233 | F309: of:=[.E309]-273 -> 27.0409209632335 | G309: of:=[.A309]*330/16384-[.$E309]*[.$E$2]+[.$F$2]-273 -> 21.4251275715847 | H309: of:=[.B309]*330/16384-[.$E309]*[.$E$2]+[.$F$2]-273 -> 34.6380181965847 | I309: of:=[.C309]*330/16384-[.$E309]*[.$E$2]+[.$F$2]-273 -> 23.8018365559597
A310: 15238 | B310: 15881 | C310: 15359 | D310: 6573 | E310: of:=1 / ( (LN([.D310])-LN([.$B$2])) / [.$C$2] + 1 / [.$A$2]) -> 299.90400149655 | F310: of:=[.E310]-273 -> 26.9040014965502 | G310: of:=[.A310]*330/16384-[.$E310]*[.$E$2]+[.$F$2]-273 -> 21.155543494236 | H310: of:=[.B310]*330/16384-[.$E310]*[.$E$2]+[.$F$2]-273 -> 34.1065932989235 | I310: of:=[.C310]*330/16384-[.$E310]*[.$E$2]+[.$F$2]-273 -> 23.5926772832985
A311: 15229 | B311: 15859 | C311: 15348 | D311: 6571 | E311: of:=1 / ( (LN([.D311])-LN([.$B$2])) / [.$C$2] + 1 / [.$A$2]) -> 300.040920963233 | F311: of:=[.E311]-273 -> 27.0409209632335 | G311: of:=[.A311]*330/16384-[.$E311]*[.$E$2]+[.$F$2]-273 -> 21.1834283528347 | H311: of:=[.B311]*330/16384-[.$E311]*[.$E$2]+[.$F$2]-273 -> 33.8726373372097 | I311: of:=[.C311]*330/16384-[.$E311]*[.$E$2]+[.$F$2]-273 -> 23.5802789387722
A312: 15233 | B312: 15862 | C312: 15348 | D312: 6571 | E312: of:=1 / ( (LN([.D312])-LN([.$B$2])) / [.$C$2] + 1 / [.$A$2]) -> 300.040920963233 | F312: of:=[.E312]-273 -> 27.0409209632335 | G312: of:=[.A312]*330/16384-[.$E312]*[.$E$2]+[.$F$2]-273 -> 21.2639947590847 | H312: of:=[.B312]*330/16384-[.$E312]*[.$E$2]+[.$F$2]-273 -> 33.9330621418972 | I312: of:=[.C312]*330/16384-[.$E312]*[.$E$2]+[.$F$2]-273 -> 23.5802789387722
A313: 15226 | B313: 15863 | C313: 15341 | D313: 6571 | E313: of:=1 / ( (LN([.D313])-LN([.$B$2])) / [.$C$2] + 1 / [.$A$2]) -> 300.040920963233 | F313: of:=[.E313]-273 -> 27.0409209632335 | G313: of:=[.A313]*330/16384-[.$E313]*[.$E$2]+[.$F$2]-273 -> 21.1230035481472 | H313: of:=[.B313]*330/16384-[.$E313]*[.$E$2]+[.$F$2]-273 -> 33.9532037434597 | I313: of:=[.C313]*330/16384-[.$E313]*[.$E$2]+[.$F$2]-273 -> 23.4392877278347
A314: 15231 | B314: 15851 | C314: 15347 | D314: 6572 | E314: of:=1 / ( (LN([.D314])-LN([.$B$2])) / [.$C$2] + 1 / [.$A$2]) -> 299.972440397568 | F314: of:=[.E314]-273 -> 26.9724403975678 | G314: of:=[.A314]*330/16384-[.$E314]*[.$E$2]+[.$F$2]-273 -> 21.1191000960042 | H314: of:=[.B314]*330/16384-[.$E314]*[.$E$2]+[.$F$2]-273 -> 33.6068930647542 | I314: of:=[.C314]*330/16384-[.$E314]*[.$E$2]+[.$F$2]-273 -> 23.4555258772542
A315: 15231 | B315: 15852 | C315: 15352 | D315: 6572 | E315: of:=1 / ( (LN([.D315])-LN([.$B$2])) / [.$C$2] + 1 / [.$A$2]) -> 299.972440397568 | F315: of:=[.E315]-273 -> 26.9724403975678 | G315: of:=[.A315]*330/16384-[.$E315]*[.$E$2]+[.$F$2]-273 -> 21.1191000960042 | H315: of:=[.B315]*330/16384-[.$E315]*[.$E$2]+[.$F$2]-273 -> 33.6270346663167 | I315: of:=[.C315]*330/16384-[.$E315]*[.$E$2]+[.$F$2]-273 -> 23.5562338850667
A316: 15227 | B316: 15850 | C316: 15339 | D316: 6571 | E316: of:=1 / ( (LN([.D316])-LN([.$B$2])) / [.$C$2] + 1 / [.$A$2]) -> 300.040920963233 | F316: of:=[.E316]-273 -> 27.0409209632335 | G316: of:=[.A316]*330/16384-[.$E316]*[.$E$2]+[.$F$2]-273 -> 21.1431451497097 | H316: of:=[.B316]*330/16384-[.$E316]*[.$E$2]+[.$F$2]-273 -> 33.6913629231472 | I316: of:=[.C316]*330/16384-[.$E316]*[.$E$2]+[.$F$2]-273 -> 23.3990045247097
A317: 15238 | B317: 15845 | C317: 15336 | D317: 6571 | E317: of:=1 / ( (LN([.D317])-LN([.$B$2])) / [.$C$2] + 1 / [.$A$2]) -> 300.040920963233 | F317: of:=[.E317]-273 -> 27.0409209632335 | G317: of:=[.A317]*330/16384-[.$E317]*[.$E$2]+[.$F$2]-273 -> 21.3647027668972 | H317: of:=[.B317]*330/16384-[.$E317]*[.$E$2]+[.$F$2]-273 -> 33.5906549153347 | I317: of:=[.C317]*330/16384-[.$E317]*[.$E$2]+[.$F$2]-273 -> 23.3385797200222
A318: 15236 | B318: 15848 | C318: 15338 | D318: 6571 | E318: of:=1 / ( (LN([.D318])-LN([.$B$2])) / [.$C$2] + 1 / [.$A$2]) -> 300.040920963233 | F318: of:=[.E318]-273 -> 27.0409209632335 | G318: of:=[.A318]*330/16384-[.$E318]*[.$E$2]+[.$F$2]-273 -> 21.3244195637722 | H318: of:=[.B318]*330/16384-[.$E318]*[.$E$2]+[.$F$2]-273 -> 33.6510797200222 | I318: of:=[.C318]*330/16384-[.$E318]*[.$E$2]+[.$F$2]-273 -> 23.3788629231472
A319: 15231 | B319: 15848 | C319: 15343 | D319: 6571 | E319: of:=1 / ( (LN([.D319])-LN([.$B$2])) / [.$C$2] + 1 / [.$A$2]) -> 300.040920963233 | F319: of:=[.E319]-273 -> 27.0409209632335 | G319: of:=[.A319]*330/16384-[.$E319]*[.$E$2]+[.$F$2]-273 -> 21.2237115559597 | H319: of:=[.B319]*330/16384-[.$E319]*[.$E$2]+[.$F$2]-273 -> 33.6510797200222 | I319: of:=[.C319]*330/16384-[.$E319]*[.$E$2]+[.$F$2]-273 -> 23.4795709309597
A320: 15242 | B320: 15839 | C320: 15347 | D320: 6571 | E320: of:=1 / ( (LN([.D320])-LN([.$B$2])) / [.$C$2] + 1 / [.$A$2]) -> 300.040920963233 | F320: of:=[.E320]-273 -> 27.0409209632335 | G320: of:=[.A320]*330/16384-[.$E320]*[.$E$2]+[.$F$2]-273 -> 21.4452691731472 | H320: of:=[.B320]*330/16384-[.$E320]*[.$E$2]+[.$F$2]-273 -> 33.4698053059597 | I320: of:=[.C320]*330/16384-[.$E320]*[.$E$2]+[.$F$2]-273 -> 23.5601373372097
A321: 15246 | B321: 15840 | C321: 15356 | D321: 6571 | E321: of:=1 / ( (LN([.D321])-LN([.$B$2])) / [.$C$2] + 1 / [.$A$2]) -> 300.040920963233 | F321: of:=[.E321]-273 -> 27.0409209632335 | G321: of:=[.A321]*330/16384-[.$E321]*[.$E$2]+[.$F$2]-273 -> 21.5258355793972 | H321: of:=[.B321]*330/16384-[.$E321]*[.$E$2]+[.$F$2]-273 -> 33.4899469075222 | I321: of:=[.C321]*330/16384-[.$E321]*[.$E$2]+[.$F$2]-273 -> 23.7414117512722
A322: 15240 | B322: 15833 | C322: 15337 | D322: 6571 | E322: of:=1 / ( (LN([.D322])-LN([.$B$2])) / [.$C$2] + 1 / [.$A$2]) -> 300.040920963233 | F322: of:=[.E322]-273 -> 27.0409209632335 | G322: of:=[.A322]*330/16384-[.$E322]*[.$E$2]+[.$F$2]-273 -> 21.4049859700222 | H322: of:=[.B322]*330/16384-[.$E322]*[.$E$2]+[.$F$2]-273 -> 33.3489556965847 | I322: of:=[.C322]*330/16384-[.$E322]*[.$E$2]+[.$F$2]-273 -> 23.3587213215847
A323: 15228 | B323: 15837 | C323: 15335 | D323: 6570 | E323: of:=1 / ( (LN([.D323])-LN([.$B$2])) / [.$C$2] + 1 / [.$A$2]) -> 300.109443232399 | F323: of:=[.E323]-273 -> 27.1094432323994 | G323: of:=[.A323]*330/16384-[.$E323]*[.$E$2]+[.$F$2]-273 -> 21.2679619178281 | H323: of:=[.B323]*330/16384-[.$E323]*[.$E$2]+[.$F$2]-273 -> 33.5341972693906 | I323: of:=[.C323]*330/16384-[.$E323]*[.$E$2]+[.$F$2]-273 -> 23.4231132850156
A324: 15192 | B324: 15829 | C324: 15350 | D324: 6569 | E324: of:=1 / ( (LN([.D324])-LN([.$B$2])) / [.$C$2] + 1 / [.$A$2]) -> 300.178007243967 | F324: of:=[.E324]-273 -> 27.1780072439671 | G324: of:=[.A324]*330/16384-[.$E324]*[.$E$2]+[.$F$2]-273 -> 20.647603194161 | H324: of:=[.B324]*330/16384-[.$E324]*[.$E$2]+[.$F$2]-273 -> 33.4778033894735 | I324: of:=[.C324]*330/16384-[.$E324]*[.$E$2]+[.$F$2]-273 -> 23.829976241036
A325: 15191 | B325: 15816 | C325: 15346 | D325: 6570 | E325: of:=1 / ( (LN([.D325])-LN([.$B$2])) / [.$C$2] + 1 / [.$A$2]) -> 300.109443232399 | F325: of:=[.E325]-273 -> 27.1094432323994 | G325: of:=[.A325]*330/16384-[.$E325]*[.$E$2]+[.$F$2]-273 -> 20.5227226600156 | H325: of:=[.B325]*330/16384-[.$E325]*[.$E$2]+[.$F$2]-273 -> 33.1112236365781 | I325: of:=[.C325]*330/16384-[.$E325]*[.$E$2]+[.$F$2]-273 -> 23.6446709022031
A326: 15203 | B326: 15814 | C326: 15354 | D326: 6571 | E326: of:=1 / ( (LN([.D326])-LN([.$B$2])) / [.$C$2] + 1 / [.$A$2]) -> 300.040920963233 | F326: of:=[.E326]-273 -> 27.0409209632335 | G326: of:=[.A326]*330/16384-[.$E326]*[.$E$2]+[.$F$2]-273 -> 20.6597467122097 | H326: of:=[.B326]*330/16384-[.$E326]*[.$E$2]+[.$F$2]-273 -> 32.9662652668972 | I326: of:=[.C326]*330/16384-[.$E326]*[.$E$2]+[.$F$2]-273 -> 23.7011285481472
A327: 15202 | B327: 15813 | C327: 15346 | D327: 6572 | E327: of:=1 / ( (LN([.D327])-LN([.$B$2])) / [.$C$2] + 1 / [.$A$2]) -> 299.972440397568 | F327: of:=[.E327]-273 -> 26.9724403975678 | G327: of:=[.A327]*330/16384-[.$E327]*[.$E$2]+[.$F$2]-273 -> 20.5349936506917 | H327: of:=[.B327]*330/16384-[.$E327]*[.$E$2]+[.$F$2]-273 -> 32.8415122053792 | I327: of:=[.C327]*330/16384-[.$E327]*[.$E$2]+[.$F$2]-273 -> 23.4353842756917
A328: 15193 | B328: 15809 | C328: 15353 | D328: 6571 | E328: of:=1 / ( (LN([.D328])-LN([.$B$2])) / [.$C$2] + 1 / [.$A$2]) -> 300.040920963233 | F328: of:=[.E328]-273 -> 27.0409209632335 | G328: of:=[.A328]*330/16384-[.$E328]*[.$E$2]+[.$F$2]-273 -> 20.4583306965847 | H328: of:=[.B328]*330/16384-[.$E328]*[.$E$2]+[.$F$2]-273 -> 32.8655572590847 | I328: of:=[.C328]*330/16384-[.$E328]*[.$E$2]+[.$F$2]-273 -> 23.6809869465847
A329: 15188 | B329: 15808 | C329: 15348 | D329: 6571 | E329: of:=1 / ( (LN([.D329])-LN([.$B$2])) / [.$C$2] + 1 / [.$A$2]) -> 300.040920963233 | F329: of:=[.E329]-273 -> 27.0409209632335 | G329: of:=[.A329]*330/16384-[.$E329]*[.$E$2]+[.$F$2]-273 -> 20.3576226887722 | H329: of:=[.B329]*330/16384-[.$E329]*[.$E$2]+[.$F$2]-273 -> 32.8454156575222 | I329: of:=[.C329]*330/16384-[.$E329]*[.$E$2]+[.$F$2]-273 -> 23.5802789387722
A330: 15200 | B330: 15803 | C330: 15345 | D330: 6572 | E330: of:=1 / ( (LN([.D330])-LN([.$B$2])) / [.$C$2] + 1 / [.$A$2]) -> 299.972440397568 | F330: of:=[.E330]-273 -> 26.9724403975678 | G330: of:=[.A330]*330/16384-[.$E330]*[.$E$2]+[.$F$2]-273 -> 20.4947104475667 | H330: of:=[.B330]*330/16384-[.$E330]*[.$E$2]+[.$F$2]-273 -> 32.6400961897542 | I330: of:=[.C330]*330/16384-[.$E330]*[.$E$2]+[.$F$2]-273 -> 23.4152426741292
A331: 15206 | B331: 15815 | C331: 15353 | D331: 6571 | E331: of:=1 / ( (LN([.D331])-LN([.$B$2])) / [.$C$2] + 1 / [.$A$2]) -> 300.040920963233 | F331: of:=[.E331]-273 -> 27.0409209632335 | G331: of:=[.A331]*330/16384-[.$E331]*[.$E$2]+[.$F$2]-273 -> 20.7201715168972 | H331: of:=[.B331]*330/16384-[.$E331]*[.$E$2]+[.$F$2]-273 -> 32.9864068684597 | I331: of:=[.C331]*330/16384-[.$E331]*[.$E$2]+[.$F$2]-273 -> 23.6809869465847
A332: 15196 | B332: 15809 | C332: 15353 | D332: 6571 | E332: of:=1 / ( (LN([.D332])-LN([.$B$2])) / [.$C$2] + 1 / [.$A$2]) -> 300.040920963233 | F332: of:=[.E332]-273 -> 27.0409209632335 | G332: of:=[.A332]*330/16384-[.$E332]*[.$E$2]+[.$F$2]-273 -> 20.5187555012722 | H332: of:=[.B332]*330/16384-[.$E332]*[.$E$2]+[.$F$2]-273 -> 32.8655572590847 | I332: of:=[.C332]*330/16384-[.$E332]*[.$E$2]+[.$F$2]-273 -> 23.6809869465847
A333: 15194 | B333: 15812 | C333: 15344 | D333: 6571 | E333: of:=1 / ( (LN([.D333])-LN([.$B$2])) / [.$C$2] + 1 / [.$A$2]) -> 300.040920963233 | F333: of:=[.E333]-273 -> 27.0409209632335 | G333: of:=[.A333]*330/16384-[.$E333]*[.$E$2]+[.$F$2]-273 -> 20.4784722981472 | H333: of:=[.B333]*330/16384-[.$E333]*[.$E$2]+[.$F$2]-273 -> 32.9259820637722 | I333: of:=[.C333]*330/16384-[.$E333]*[.$E$2]+[.$F$2]-273 -> 23.4997125325222
A334: 15193 | B334: 15815 | C334: 15340 | D334: 6571 | E334: of:=1 / ( (LN([.D334])-LN([.$B$2])) / [.$C$2] + 1 / [.$A$2]) -> 300.040920963233 | F334: of:=[.E334]-273 -> 27.0409209632335 | G334: of:=[.A334]*330/16384-[.$E334]*[.$E$2]+[.$F$2]-273 -> 20.4583306965847 | H334: of:=[.B334]*330/16384-[.$E334]*[.$E$2]+[.$F$2]-273 -> 32.9864068684597 | I334: of:=[.C334]*330/16384-[.$E334]*[.$E$2]+[.$F$2]-273 -> 23.4191461262722
A335: 15183 | B335: 15813 | C335: 15341 | D335: 6571 | E335: of:=1 / ( (LN([.D335])-LN([.$B$2])) / [.$C$2] + 1 / [.$A$2]) -> 300.040920963233 | F335: of:=[.E335]-273 -> 27.0409209632335 | G335: of:=[.A335]*330/16384-[.$E335]*[.$E$2]+[.$F$2]-273 -> 20.2569146809597 | H335: of:=[.B335]*330/16384-[.$E335]*[.$E$2]+[.$F$2]-273 -> 32.9461236653347 | I335: of:=[.C335]*330/16384-[.$E335]*[.$E$2]+[.$F$2]-273 -> 23.4392877278347
A336: 15199 | B336: 15821 | C336: 15338 | D336: 6571 | E336: of:=1 / ( (LN([.D336])-LN([.$B$2])) / [.$C$2] + 1 / [.$A$2]) -> 300.040920963233 | F336: of:=[.E336]-273 -> 27.0409209632335 | G336: of:=[.A336]*330/16384-[.$E336]*[.$E$2]+[.$F$2]-273 -> 20.5791803059597 | H336: of:=[.B336]*330/16384-[.$E336]*[.$E$2]+[.$F$2]-273 -> 33.1072564778347 | I336: of:=[.C336]*330/16384-[.$E336]*[.$E$2]+[.$F$2]-273 -> 23.3788629231472
A337: 15199 | B337: 15814 | C337: 15334 | D337: 6571 | E337: of:=1 / ( (LN([.D337])-LN([.$B$2])) / [.$C$2] + 1 / [.$A$2]) -> 300.040920963233 | F337: of:=[.E337]-273 -> 27.0409209632335 | G337: of:=[.A337]*330/16384-[.$E337]*[.$E$2]+[.$F$2]-273 -> 20.5791803059597 | H337: of:=[.B337]*330/16384-[.$E337]*[.$E$2]+[.$F$2]-273 -> 32.9662652668972 | I337: of:=[.C337]*330/16384-[.$E337]*[.$E$2]+[.$F$2]-273 -> 23.2982965168972
A338: 15201 | B338: 15816 | C338: 15341 | D338: 6571 | E338: of:=1 / ( (LN([.D338])-LN([.$B$2])) / [.$C$2] + 1 / [.$A$2]) -> 300.040920963233 | F338: of:=[.E338]-273 -> 27.0409209632335 | G338: of:=[.A338]*330/16384-[.$E338]*[.$E$2]+[.$F$2]-273 -> 20.6194635090847 | H338: of:=[.B338]*330/16384-[.$E338]*[.$E$2]+[.$F$2]-273 -> 33.0065484700222 | I338: of:=[.C338]*330/16384-[.$E338]*[.$E$2]+[.$F$2]-273 -> 23.4392877278347
A339: 15201 | B339: 15816 | C339: 15338 | D339: 6571 | E339: of:=1 / ( (LN([.D339])-LN([.$B$2])) / [.$C$2] + 1 / [.$A$2]) -> 300.040920963233 | F339: of:=[.E339]-273 -> 27.0409209632335 | G339: of:=[.A339]*330/16384-[.$E339]*[.$E$2]+[.$F$2]-273 -> 20.6194635090847 | H339: of:=[.B339]*330/16384-[.$E339]*[.$E$2]+[.$F$2]-273 -> 33.0065484700222 | I339: of:=[.C339]*330/16384-[.$E339]*[.$E$2]+[.$F$2]-273 -> 23.3788629231472
A340: 15196 | B340: 15817 | C340: 15332 | D340: 6570 | E340: of:=1 / ( (LN([.D340])-LN([.$B$2])) / [.$C$2] + 1 / [.$A$2]) -> 300.109443232399 | F340: of:=[.E340]-273 -> 27.1094432323994 | G340: of:=[.A340]*330/16384-[.$E340]*[.$E$2]+[.$F$2]-273 -> 20.6234306678281 | H340: of:=[.B340]*330/16384-[.$E340]*[.$E$2]+[.$F$2]-273 -> 33.1313652381406 | I340: of:=[.C340]*330/16384-[.$E340]*[.$E$2]+[.$F$2]-273 -> 23.3626884803281
A341: 15192 | B341: 15815 | C341: 15341 | D341: 6571 | E341: of:=1 / ( (LN([.D341])-LN([.$B$2])) / [.$C$2] + 1 / [.$A$2]) -> 300.040920963233 | F341: of:=[.E341]-273 -> 27.0409209632335 | G341: of:=[.A341]*330/16384-[.$E341]*[.$E$2]+[.$F$2]-273 -> 20.4381890950222 | H341: of:=[.B341]*330/16384-[.$E341]*[.$E$2]+[.$F$2]-273 -> 32.9864068684597 | I341: of:=[.C341]*330/16384-[.$E341]*[.$E$2]+[.$F$2]-273 -> 23.4392877278347
A342: 15199 | B342: 15819 | C342: 15343 | D342: 6571 | E342: of:=1 / ( (LN([.D342])-LN([.$B$2])) / [.$C$2] + 1 / [.$A$2]) -> 300.040920963233 | F342: of:=[.E342]-273 -> 27.0409209632335 | G342: of:=[.A342]*330/16384-[.$E342]*[.$E$2]+[.$F$2]-273 -> 20.5791803059597 | H342: of:=[.B342]*330/16384-[.$E342]*[.$E$2]+[.$F$2]-273 -> 33.0669732747097 | I342: of:=[.C342]*330/16384-[.$E342]*[.$E$2]+[.$F$2]-273 -> 23.4795709309597
A343: 15211 | B343: 15807 | C343: 15334 | D343: 6571 | E343: of:=1 / ( (LN([.D343])-LN([.$B$2])) / [.$C$2] + 1 / [.$A$2]) -> 300.040920963233 | F343: of:=[.E343]-273 -> 27.0409209632335 | G343: of:=[.A343]*330/16384-[.$E343]*[.$E$2]+[.$F$2]-273 -> 20.8208795247097 | H343: of:=[.B343]*330/16384-[.$E343]*[.$E$2]+[.$F$2]-273 -> 32.8252740559597 | I343: of:=[.C343]*330/16384-[.$E343]*[.$E$2]+[.$F$2]-273 -> 23.2982965168972
A344: 15192 | B344: 15809 | C344: 15336 | D344: 6571 | E344: of:=1 / ( (LN([.D344])-LN([.$B$2])) / [.$C$2] + 1 / [.$A$2]) -> 300.040920963233 | F344: of:=[.E344]-273 -> 27.0409209632335 | G344: of:=[.A344]*330/16384-[.$E344]*[.$E$2]+[.$F$2]-273 -> 20.4381890950222 | H344: of:=[.B344]*330/16384-[.$E344]*[.$E$2]+[.$F$2]-273 -> 32.8655572590847 | I344: of:=[.C344]*330/16384-[.$E344]*[.$E$2]+[.$F$2]-273 -> 23.3385797200222
A345: 15200 | B345: 15803 | C345: 15337 | D345: 6571 | E345: of:=1 / ( (LN([.D345])-LN([.$B$2])) / [.$C$2] + 1 / [.$A$2]) -> 300.040920963233 | F345: of:=[.E345]-273 -> 27.0409209632335 | G345: of:=[.A345]*330/16384-[.$E345]*[.$E$2]+[.$F$2]-273 -> 20.5993219075222 | H345: of:=[.B345]*330/16384-[.$E345]*[.$E$2]+[.$F$2]-273 -> 32.7447076497097 | I345: of:=[.C345]*330/16384-[.$E345]*[.$E$2]+[.$F$2]-273 -> 23.3587213215847
A346: 15197 | B346: 15807 | C346: 15330 | D346: 6571 | E346: of:=1 / ( (LN([.D346])-LN([.$B$2])) / [.$C$2] + 1 / [.$A$2]) -> 300.040920963233 | F346: of:=[.E346]-273 -> 27.0409209632335 | G346: of:=[.A346]*330/16384-[.$E346]*[.$E$2]+[.$F$2]-273 -> 20.5388971028347 | H346: of:=[.B346]*330/16384-[.$E346]*[.$E$2]+[.$F$2]-273 -> 32.8252740559597 | I346: of:=[.C346]*330/16384-[.$E346]*[.$E$2]+[.$F$2]-273 -> 23.2177301106472
A347: 15201 | B347: 15813 | C347: 15334 | D347: 6571 | E347: of:=1 / ( (LN([.D347])-LN([.$B$2])) / [.$C$2] + 1 / [.$A$2]) -> 300.040920963233 | F347: of:=[.E347]-273 -> 27.0409209632335 | G347: of:=[.A347]*330/16384-[.$E347]*[.$E$2]+[.$F$2]-273 -> 20.6194635090847 | H347: of:=[.B347]*330/16384-[.$E347]*[.$E$2]+[.$F$2]-273 -> 32.9461236653347 | I347: of:=[.C347]*330/16384-[.$E347]*[.$E$2]+[.$F$2]-273 -> 23.2982965168972
A348: 15194 | B348: 15813 | C348: 15318 | D348: 6571 | E348: of:=1 / ( (LN([.D348])-LN([.$B$2])) / [.$C$2] + 1 / [.$A$2]) -> 300.040920963233 | F348: of:=[.E348]-273 -> 27.0409209632335 | G348: of:=[.A348]*330/16384-[.$E348]*[.$E$2]+[.$F$2]-273 -> 20.4784722981472 | H348: of:=[.B348]*330/16384-[.$E348]*[.$E$2]+[.$F$2]-273 -> 32.9461236653347 | I348: of:=[.C348]*330/16384-[.$E348]*[.$E$2]+[.$F$2]-273 -> 22.9760308918972
A349: 15196 | B349: 15796 | C349: 15331 | D349: 6571 | E349: of:=1 / ( (LN([.D349])-LN([.$B$2])) / [.$C$2] + 1 / [.$A$2]) -> 300.040920963233 | F349: of:=[.E349]-273 -> 27.0409209632335 | G349: of:=[.A349]*330/16384-[.$E349]*[.$E$2]+[.$F$2]-273 -> 20.5187555012722 | H349: of:=[.B349]*330/16384-[.$E349]*[.$E$2]+[.$F$2]-273 -> 32.6037164387722 | I349: of:=[.C349]*330/16384-[.$E349]*[.$E$2]+[.$F$2]-273 -> 23.2378717122097
A350: exiting